user_input,retrieved_contexts,response,reference,faithfulness,answer_relevancy,context_precision,context_recall,answer_correctness,semantic_similarity,question_id
 comment conserver humalog mix 25 100ui kwikpen ,"[""Avant  la  première  utilisation,  conserver  votre  Humalog  Mix25  KwikPen  au  réfrigérateur  (entre  2°C  et 8°C). Ne pas congeler.\n\nConserver votre Humalog Mix25 KwikPen en cours d'utilisation à température ambiante (entre 15°C et 30°C) et jeter-le après 28 jours. Ne pas exposer à une chaleur excessive ou au soleil. Ne laissez pas votre stylo KwikPen en cours d'utilisation au réfrigérateur. Le stylo KwikPen ne doit pas être conservé avec l'aiguille vissée dessus.\n\nTenir hors de la portée et de la vue des enfants.\n\nNe pas utiliser Humalog Mix25 KwikPen après la date de péremption mentionnée sur l'étiquette et la boîte. La date d'expiration fait référence au dernier jour du mois.\n\nNe pas utiliser Humalog Mix25 KwikPen, si la suspension présente des grumeaux ou si des particules blanches restent collées au fond de la cartouche ou sur les parois, lui donnant un aspect givré. Vérifiez l'apparence avant chaque injection.\n\nLes médicaments ne doivent pas être jetés au tout à l'égout ou avec les ordures ménagères. Demandez à votre pharmacien ce qu'il faut faire des médicaments inutilisés. Ces mesures permettront de protéger l'environnement."", ""2. QUELLES SONT LES INFORMATIONS A CONNAITRE AVANT D'UTILISER HUMALOG MIX25 KWIKPEN"", ""- 1. Qu'est-ce qu'Humalog Mix25 KwikPen et dans quel cas est-il utilisé\n- 2. Quelles sont les informations à connaître avant d'utiliser Humalog Mix25 KwikPen\n- 3. Comment utiliser Humalog Mix25 KwikPen\n- 4. Quels sont les effets indésirables éventuels\n- 5. Comment conserver Humalog Mix25 KwikPen\n- 6. Informations supplémentaires"", ""Humalog Mix25 KwikPen 100 UI/ml, suspension injectable est une suspension stérile de couleur blanche et contient 100 unités internationales d'insuline lispro par millilitre (100 UI/ml) de suspension injectable. Humalog Mix25 KwikPen contient 25 % d'insuline lispro en solution dans l'eau et 75 % d'insuline lispro en suspension avec du sulfate de protamine. Chaque stylo contient 300 unités internationales (3 millilitres). Les stylos Humalog Mix25 KwikPen sont conditionnés par boîte de 5 stylos pré-remplis ou en emballage multiple de 2 x 5 stylos pré-remplis. Toutes les présentations peuvent ne pas être commercialisées. L'Humalog Mix25 contenu dans votre stylo KwikPen est le même produit que celui\n\ncontenu dans les  cartouches individuelles d'Humalog Mix25. Le stylo KwikPen comporte simplement une cartouche intégrée. Vous ne pouvez plus utiliser le stylo pré-rempli lorsqu'il est vide."", 'Humalog ® Mix25 ™  100 UI/ml KwikPen ™ , suspension injectable (insuline lispro)', ""Humalog Mix25 100 UI/ml KwikPen, suspension injectable est fabriqué par :\n\n- · Lilly France SAS, Rue du Colonel Lilly, 67640 Fegersheim - France.\n\nLe titulaire de l'autorisation de mise sur le marché est : Eli Lilly Nederland B.V., Grootslag 1-5, 3991 RA Houten, Pays-Bas.\n\nPour toute information complémentaire concernant ce médicament, veuillez prendre contact avec le représentant local du titulaire de l'autorisation de mise sur le marché :""]","Avant la première utilisation, Humalog Mix25 KwikPen doit être conservé au réfrigérateur entre 2°C et 8°C. Une fois ouvert, il doit être conservé à température ambiante entre 15°C et 30°C et jeté après 28 jours. Il ne doit pas être exposé à une chaleur excessive ou au soleil et ne doit pas être conservé avec l'aiguille vissée dessus.","Avant la première utilisation, Humalog Mix25 KwikPen doit être conservé au réfrigérateur entre 2°C et 8°C. Une fois en cours d'utilisation, il doit être conservé à température ambiante entre 15°C et 30°C et doit être jeté après 28 jours. Il ne doit pas être exposé à une chaleur excessive ou au soleil et ne doit pas être laissé au réfrigérateur .Le stylo KwikPen ne doit pas être conservé avec l’aiguille vissée dessus.",1.0,0.6461574381773569,0.8333333332916666,1.0,0.9213017220851555,0.9579341610678949,Q1
Orapen 1500 000ui comp peut-il être utilisé en association avec un antihypertenseur?,"['<!-- image -->\n\nFORMES et PRtsENT ATIONS :\n\nSUSpc:DSKHl bu\n\nv\n\nabie\n\nà 250\n\n000\n\nVUS\n\nml : Flacon\n\nde 60\n\nmJ\n\nCompnme\'\n\n1000 000\n\nln\n\nBotte\n\n12comprimes\n\nComprime\n\nà\n\n1 500\n\n000\n\nUJ\n\n12 comprimes\n\nCOMPOSITION,\n\n- Compamcs -l\'allc:rpe aux pénlCllhnes est croisee avec l\'allerl\'C au.""( céptWœponnc:s dans .s à 10 % des cas Ceci oonduit a proscnre \'ë::!DCS cbcz les sujCts alJer&amp;!qucs aux cephelosponoes\n\nParcom !Dé\n\nPenicillinc V(DCD)\n\nE.xciplc:rtts\n\nExClpU!nLS ci ~ff~1S noIolTe.(\n\nPoudre pour\n\nsuspensIOn bu••.blc\n\nCompnmés\n\n.\n\nlactOK\n\nINDICATIONS:\n\nEUes SOfW limitées aux infections ducs aux germes sensibles En curauf\n\n- · angtncs i streptocoque A bèta-bemolyuqcc .\n\n•\n\nuUCCltons cutaeèes\n\nberugecs\n\na\n\ngermes sensibles', 'En cuTuif La posologie qccudrcnec doit être frecuonncc en 2 ou 3 prises pour les angmcs et en 3 ou 4 prises pour les autres mdicauons\n\n- - AduJte 2 000 000 UI à 4 000 000 Ulljour\n- -Nourrisson et cnfantJusqu\'. 40 19 50000 à 100 000 UIJk8lJ0W""\n\nEn propltyluù! La posologie qcondrcnrc doit être fractionnée en 2 poses\n\n- -Adulte: 2 MUII)OUT La prophylaxie est 3 poursuivre au moms 2 ans aprCs la ~plénccton\\le\n- -Noumsson et enfant\n- -Jusqu\'à 10 kg !()()f)()(J UIJl.sIjour,\n\n•\n\nde\n\n101.&amp; à 401.&amp;\n\n50\n\n(MKt\n\nUIIL.g/jour\n\n2 MUUjour\n\nMode d\'administration;\n\nvœc orale\n\nSuspension buvable Rccoestnœr la suspension en introduisant dans le flacon de l\'eau minérale non gazeuse ou de l\'eau bcerlfic et refroidie jusqu\'au tran mdJquê, aglter jusqu\'à obtenbon d\'une suspension homogcnc Uuhscr le disposmf de mesure fourni (gradue a 5 ou 10 ml) pour mesurer la quanti lé de peoduu à adnuftlsua\n\nCompnmè : Les compnmcs sont a avala"" avec un verre d\'cau CO""\'TRE-INDICATIO S:\n\nAbJol..es AllergIe aux anubroeqccs de la Isnnllc des bêtalactamlOcs (Pêntcdhncs et Céphalosponncs)\n\nRdalÎ\\·es :\n\nMethotrexatc\n\nMISES EN GARDE"" PRECAIITIO \'S D\'EMPLOI:\n\n-La SurYCnuc de toute manlfcslalJOn allergique Impose l\'arrèt du tratlement dia mtse en place dun tnutcmcnt adapté\n\n- · l\'admlnlstrauon de pénicilline réccssnc un IntarCJgalOlrc prealable:. De··an\\ des antéc:Cdcnts rral\\erSlc lyptquc a ces pœduus (anaph)lulC), la coetrc-mdscencn est formellc\n\n250 000 UI\n\nOsp 5 ml\n\na\n\nsaccbarose\n\n1000000 UI\n\n1500 000 UI\n\nQsp 1 Cp\n\n- · la pote des compnmês est ccntre-rndrquèe chc7 l\'cnfant avent 6 IRI. car cUe peut CIItraincr une fausse-route.\n- · En raison de la pr-éscnce de lactose, cc mëdacamcnt est dêconscIllé chez les paUcnts présentanl une Into&amp;êranc:e au galactose, un dCficlt en lactase de Lapp ou un syndrome de malabsorpoon du glucose ou du galaaose (malDCbcs béreduaues norcs)\n\nPoudre pour SusocnstOn buvable en reeœ de la presence de sac::cJwosc. cc méchC&amp;mClltest conuc-mdtqut en cas d\'intolérance au rnact.ose, de malabwrption du glucose et du galactose ou de déftCrt en sucnsc-isomahasc.\n\nINTERACfIONS MEDICAMENTEUSES:\n\nD«oaueiJIœs Méthotrexate. augmentation des effets et de la lOXlCltë hêmatolOlJquc\n\nProb&amp;àna parti&lt;.lIlien d. déltqwiltbre de l\'INR : De nombrcu.&lt;t cas d\'augmentation de J\'adJvité des antICOagulants oraux ont clé: rapportés chez des patients recevant des antibtObqucs', ""- - Troubles digestifs nausées, vomissements, dianbéc:s,languc noire en cas de traitement prolongé.\n\ncoagulabon\n\n- · RéactIOnS hématologiques réversibles; anémie, thrombccytœéme.fescopémc, troubles de la\n\nCONDITIONS DE CONSERVA nON:\n\nA conserver à une tcmpënturc mfèricure à 30°C et à J'abn de l'humidité\n\nLéste :\n\nJ\n\nGARDER HORS DE LA PORTEE DES ENFANTS RESPECTER LES DOSES PRESCRITES fabriuat d cl&amp;catear de la D.E GROUPE INDUSTRIEL SAlDAL Ydiaie ANTIBIOl1CAL Roat&lt; d'El KIocmis, Br 33, \\_ -. ALGERŒ.\n\nDE 003/1 JG J06III9\n\nNotic;e RéVJSCeeu Novembre 2012\n\ndepasser"", ""GroSJCUC Les études chez ,'animai n'ont pas œrs en évidence d'cfTct:léfatoeènc et donc un effet malformatif dans l'espèce humaine n'est pas attendu., Les résultats des études épldémlOlDglqucs semblent exclure un effet malformatif ou foetoeœaque parncuher de la penicilline V.\n\nAllaittmellt Le passage de la pénicilline dans Ic lait matcrnc1 est faiMe et doec l'atlattement est possible en cas de pose de cet emibicnque. Toutefors, mtcrTOmpre l'allaitement (ou le médlcamenl) en cas dc survenue de diarrhée, de candidosc ou d'éruption cutanée chez ie nourrisson."", '- · des rechutes de RAA\n- - de rêrys\'pCle f\'CC.dJ\\ant\n\n•\n\n- -des sujd.S contacts dans ""COlouragc d\'une scarlatine.\n\n- des infections\'\n\npneumocoques cher\n\nles splénectormscs.\n\ndrtp&amp;nOC)Ulre5\n\nPOSOLOGIE\n\nmajeurs et les autres les\n\nesplémques foncuonncts\n\nET MODE D\'ADMINISTRA\n\nnON:']","La notice mentionne une interaction spécifique avec le méthotrexate, mais ne fait pas mention d'une interaction avec les antihypertenseurs.",Aucune information concernant les antihypertenseurs n'est mentionnée dans la notice.,1.0,0.45740516704330475,0.0,1.0,0.5313087948598325,0.6252351794393302,Q2
Quels sont les signes d une réaction allergique grave à Calcidose 500mg sachet dose ?,"[""Adultes: 1 à 1,5 9 de calcium élément par jour, soit deux à trois sachets par jour. Enfants jusqu'à 10 ans: 0,5 g de calcium élément par jour, soit un sachet par jour. Enfants de plus de 10 ans: 1 g de calcium élément par jour, soit deux sachets par jour.\n\n- · MODE ET VOIE D'ADMINISTRATION\n\nVoie orale:\n\ndiluer la\n\npoudre dans\n\nun verre d'eau\n\npuis avaler\n\nimmédiatement.\n\n- · FRÉQUENCE ET MOMENT AUQUEL LE MÉDICAMENT DOIT ~TRE ADMINISTRÉ\n- SE CONFORMER STRICTEMENT À L'ORDONNANCE DU MÉDECIN.\n- · DURÉE DU TRAITEMENT\n- SE CONFORMER STRICTEMENT À L'ORDONNANCE DU MÉDECIN.\n- · CONDUITE À TENIR EN CAS DE SURDOSAGE\n- Symptômes: soif, nausées, vomissements, constipation.\n\nDemander une assistance médicale."", '- CALCIDOS~ 500, poudre pour suspension buvable en sachet.\n- · COMPOSITION QUALITATIVE/COMPOSITION QUANTITATIVE\n- CARBONATE DE CALCIUM\n\n.\n\nQuantité\n\ncorrespondant\n\nà\n\ncalciunî-élérnent.""\n\nExcipients: Arôme agrume, saccharose, pour un sachet de ..\n\n.\n\n..........................................................\n\n.\n\n- · FORME PHARMACEUTIQUE\n- Poudre pour suspension buvable en sachet. Boîte de 30 sachets-dose.\n- · CLASSE PHARMACOTHÉRAPEUTIQUE\n- CALCIUM/SUPPLÉMENT MINÉRAL. (A: Appareil digestif et métabolisme).\n- · EXPLOITANT ET TITULAIRE\n\nLaboratoires\n\nMERINAL\n\n-\n\nVoie\n\nV30\n\nl.1.\n\nOued\n\nS\'mar\n\n-\n\nAlger.\n\nALGÉRIE\n\n- · FABRICANT\n- Laboratoires MERINAL -Voie V30 l.1. Oued S\'mar -Alger. ALGÉRIE.\n- · SOUS LICENCE\n- Laboratoires de l\'OPOCALCIUM -20, rue Louis-Charles Vernin -77190 DAMMARIE-LES-LYS Cedex. FRANCE.', ""Ce médicament NE DOIT PAS ËTRE UTILISÉ dans les cas suivants:\n\n- -Hypercalcémie (taux anormalement élevé de calcium dans le sang).\n- -Hypercalciuries (élimination exagérée de calcium par l'urine).\n- -lithiase calcique (calculs) -calcifications tissulaires.\n- -Immobilisations prolongées s'accompagnant d'hypercalcémie et/ou d'hypercalciurie : le traitement ne doit être utilisé qu'à la reprise de la mobilisation.\n\nEN CAS DE DOUTE, IL EST INDISPENSABLE DE DEMANDER L'AVIS DE VOTRE MÉDECIN OU DE VOTRE PHARMACIEN."", ""Possibilité de bouche sèche.\n\nEn cas de traitement prolongé, risque d'augmentation du taux de calcium dans le sang et les urines. SIGNALEl À VOTRE MÉDECIN OU À VOTRE PHARMACIEN TOUT EFFET NON SOUHAITÉ ET GËNANT QUI NE SERAIT PAS MENTIONNÉ DANS CETTE NOTICE."", '## Oalcidose500', ""- -En cas d'association avec la vitamine 0 à forte dose, des examens de sang et d'urines doivent être pratiqués régulièrement.\n- -Si vous prenez des digrtaliques ou des diurétiques: vous devez consulter régulièrement votre médecin pendant la durée du traitement.\n- -En cas de traitement par tétracyclines par voie orale, il est recommandé de respecter un intervalle de trois heures entre la prise de tétracyclines et la prise de calcium.\n\nAFIN D'ÉVITER D'ÉVENTUELLES INTERACTIONS ENTRE PLUSIEURS MÉDICAMENTS, IL FAUT SIGNALER SYSTÉMATIQUEMENT TOUT AUTRE TRAITEMENT EN COURS À VOTRE MÉDECIN OU À VOTRE PHARMACIEN.\n\n- · LISTE DES EXCIPIENTS DONT LA CONNAISSANCE EST NÉCESSAIRE POUR UNE UTILISATION SANS RISQUE CHEZ CERTAINS PATIENTS: Saccharose.\n- · COMMENT UTILISER CE MÉDICAMENT""]",La notice ne mentionne pas explicitement les signes d'une réaction allergique grave à Calcidose 500.,Aucun signe de réaction allergique grave n'est mentionné dans la notice,1.0,0.0,0.249999999975,1.0,0.9186136956605655,0.6744547826422619,Q3
Quels sont les principes actifs contenus dans Calcidose 500mg sachet dose?,"['- CALCIDOS~ 500, poudre pour suspension buvable en sachet.\n- · COMPOSITION QUALITATIVE/COMPOSITION QUANTITATIVE\n- CARBONATE DE CALCIUM\n\n.\n\nQuantité\n\ncorrespondant\n\nà\n\ncalciunî-élérnent.""\n\nExcipients: Arôme agrume, saccharose, pour un sachet de ..\n\n.\n\n..........................................................\n\n.\n\n- · FORME PHARMACEUTIQUE\n- Poudre pour suspension buvable en sachet. Boîte de 30 sachets-dose.\n- · CLASSE PHARMACOTHÉRAPEUTIQUE\n- CALCIUM/SUPPLÉMENT MINÉRAL. (A: Appareil digestif et métabolisme).\n- · EXPLOITANT ET TITULAIRE\n\nLaboratoires\n\nMERINAL\n\n-\n\nVoie\n\nV30\n\nl.1.\n\nOued\n\nS\'mar\n\n-\n\nAlger.\n\nALGÉRIE\n\n- · FABRICANT\n- Laboratoires MERINAL -Voie V30 l.1. Oued S\'mar -Alger. ALGÉRIE.\n- · SOUS LICENCE\n- Laboratoires de l\'OPOCALCIUM -20, rue Louis-Charles Vernin -77190 DAMMARIE-LES-LYS Cedex. FRANCE.', ""Adultes: 1 à 1,5 9 de calcium élément par jour, soit deux à trois sachets par jour. Enfants jusqu'à 10 ans: 0,5 g de calcium élément par jour, soit un sachet par jour. Enfants de plus de 10 ans: 1 g de calcium élément par jour, soit deux sachets par jour.\n\n- · MODE ET VOIE D'ADMINISTRATION\n\nVoie orale:\n\ndiluer la\n\npoudre dans\n\nun verre d'eau\n\npuis avaler\n\nimmédiatement.\n\n- · FRÉQUENCE ET MOMENT AUQUEL LE MÉDICAMENT DOIT ~TRE ADMINISTRÉ\n- SE CONFORMER STRICTEMENT À L'ORDONNANCE DU MÉDECIN.\n- · DURÉE DU TRAITEMENT\n- SE CONFORMER STRICTEMENT À L'ORDONNANCE DU MÉDECIN.\n- · CONDUITE À TENIR EN CAS DE SURDOSAGE\n- Symptômes: soif, nausées, vomissements, constipation.\n\nDemander une assistance médicale."", '## Oalcidose500', ""Ce médicament NE DOIT PAS ËTRE UTILISÉ dans les cas suivants:\n\n- -Hypercalcémie (taux anormalement élevé de calcium dans le sang).\n- -Hypercalciuries (élimination exagérée de calcium par l'urine).\n- -lithiase calcique (calculs) -calcifications tissulaires.\n- -Immobilisations prolongées s'accompagnant d'hypercalcémie et/ou d'hypercalciurie : le traitement ne doit être utilisé qu'à la reprise de la mobilisation.\n\nEN CAS DE DOUTE, IL EST INDISPENSABLE DE DEMANDER L'AVIS DE VOTRE MÉDECIN OU DE VOTRE PHARMACIEN."", ""- -En cas d'association avec la vitamine 0 à forte dose, des examens de sang et d'urines doivent être pratiqués régulièrement.\n- -Si vous prenez des digrtaliques ou des diurétiques: vous devez consulter régulièrement votre médecin pendant la durée du traitement.\n- -En cas de traitement par tétracyclines par voie orale, il est recommandé de respecter un intervalle de trois heures entre la prise de tétracyclines et la prise de calcium.\n\nAFIN D'ÉVITER D'ÉVENTUELLES INTERACTIONS ENTRE PLUSIEURS MÉDICAMENTS, IL FAUT SIGNALER SYSTÉMATIQUEMENT TOUT AUTRE TRAITEMENT EN COURS À VOTRE MÉDECIN OU À VOTRE PHARMACIEN.\n\n- · LISTE DES EXCIPIENTS DONT LA CONNAISSANCE EST NÉCESSAIRE POUR UNE UTILISATION SANS RISQUE CHEZ CERTAINS PATIENTS: Saccharose.\n- · COMMENT UTILISER CE MÉDICAMENT"", ""Utiliser ce médicament AVEC PRÉCAUTION.\n\n- -En cas de traitement prolongé ou d'insuffisance rénale: il est nécessaire de faire contrôler le taux de calcium dans les urines et dans le sang; réduire ou interrompre le traitement en fonction des résultats, suivant avis médical.\n- EN CAS DE DOUTE NE PAS HÉSITER À DEMANDER L'AVIS DE VOTRE MÉDECIN OU DE VOTRE PHARMACIEN .""]",Le principe actif contenu dans Calcidose 500 est le carbonate de calcium.,la substance active contenue dans ce medicament est Carbonate de calcium,1.0,0.7910988572978933,0.9999999999,1.0,0.8997941261418376,0.5991765045673503,Q4
Quels sont les effets négatifs de Calcidose 500mg sachet dose?,"['- CALCIDOS~ 500, poudre pour suspension buvable en sachet.\n- · COMPOSITION QUALITATIVE/COMPOSITION QUANTITATIVE\n- CARBONATE DE CALCIUM\n\n.\n\nQuantité\n\ncorrespondant\n\nà\n\ncalciunî-élérnent.""\n\nExcipients: Arôme agrume, saccharose, pour un sachet de ..\n\n.\n\n..........................................................\n\n.\n\n- · FORME PHARMACEUTIQUE\n- Poudre pour suspension buvable en sachet. Boîte de 30 sachets-dose.\n- · CLASSE PHARMACOTHÉRAPEUTIQUE\n- CALCIUM/SUPPLÉMENT MINÉRAL. (A: Appareil digestif et métabolisme).\n- · EXPLOITANT ET TITULAIRE\n\nLaboratoires\n\nMERINAL\n\n-\n\nVoie\n\nV30\n\nl.1.\n\nOued\n\nS\'mar\n\n-\n\nAlger.\n\nALGÉRIE\n\n- · FABRICANT\n- Laboratoires MERINAL -Voie V30 l.1. Oued S\'mar -Alger. ALGÉRIE.\n- · SOUS LICENCE\n- Laboratoires de l\'OPOCALCIUM -20, rue Louis-Charles Vernin -77190 DAMMARIE-LES-LYS Cedex. FRANCE.', ""Adultes: 1 à 1,5 9 de calcium élément par jour, soit deux à trois sachets par jour. Enfants jusqu'à 10 ans: 0,5 g de calcium élément par jour, soit un sachet par jour. Enfants de plus de 10 ans: 1 g de calcium élément par jour, soit deux sachets par jour.\n\n- · MODE ET VOIE D'ADMINISTRATION\n\nVoie orale:\n\ndiluer la\n\npoudre dans\n\nun verre d'eau\n\npuis avaler\n\nimmédiatement.\n\n- · FRÉQUENCE ET MOMENT AUQUEL LE MÉDICAMENT DOIT ~TRE ADMINISTRÉ\n- SE CONFORMER STRICTEMENT À L'ORDONNANCE DU MÉDECIN.\n- · DURÉE DU TRAITEMENT\n- SE CONFORMER STRICTEMENT À L'ORDONNANCE DU MÉDECIN.\n- · CONDUITE À TENIR EN CAS DE SURDOSAGE\n- Symptômes: soif, nausées, vomissements, constipation.\n\nDemander une assistance médicale."", ""Ce médicament NE DOIT PAS ËTRE UTILISÉ dans les cas suivants:\n\n- -Hypercalcémie (taux anormalement élevé de calcium dans le sang).\n- -Hypercalciuries (élimination exagérée de calcium par l'urine).\n- -lithiase calcique (calculs) -calcifications tissulaires.\n- -Immobilisations prolongées s'accompagnant d'hypercalcémie et/ou d'hypercalciurie : le traitement ne doit être utilisé qu'à la reprise de la mobilisation.\n\nEN CAS DE DOUTE, IL EST INDISPENSABLE DE DEMANDER L'AVIS DE VOTRE MÉDECIN OU DE VOTRE PHARMACIEN."", '## Oalcidose500', ""Possibilité de bouche sèche.\n\nEn cas de traitement prolongé, risque d'augmentation du taux de calcium dans le sang et les urines. SIGNALEl À VOTRE MÉDECIN OU À VOTRE PHARMACIEN TOUT EFFET NON SOUHAITÉ ET GËNANT QUI NE SERAIT PAS MENTIONNÉ DANS CETTE NOTICE."", ""- -En cas d'association avec la vitamine 0 à forte dose, des examens de sang et d'urines doivent être pratiqués régulièrement.\n- -Si vous prenez des digrtaliques ou des diurétiques: vous devez consulter régulièrement votre médecin pendant la durée du traitement.\n- -En cas de traitement par tétracyclines par voie orale, il est recommandé de respecter un intervalle de trois heures entre la prise de tétracyclines et la prise de calcium.\n\nAFIN D'ÉVITER D'ÉVENTUELLES INTERACTIONS ENTRE PLUSIEURS MÉDICAMENTS, IL FAUT SIGNALER SYSTÉMATIQUEMENT TOUT AUTRE TRAITEMENT EN COURS À VOTRE MÉDECIN OU À VOTRE PHARMACIEN.\n\n- · LISTE DES EXCIPIENTS DONT LA CONNAISSANCE EST NÉCESSAIRE POUR UNE UTILISATION SANS RISQUE CHEZ CERTAINS PATIENTS: Saccharose.\n- · COMMENT UTILISER CE MÉDICAMENT""]",Les effets négatifs de Calcidose 500 peuvent inclure une bouche sèche et une augmentation du taux de calcium dans le sang et les urines en cas de traitement prolongé.,"Les effets négatifs de Calcidose 500 peuvent inclure une bouche sèche et  en cas de traitement prolongé, un risque d'augmentation du taux de calcium dans le sang et les urines. SIGNALER À VOTRE MÉDECIN OU À VOTRE PHARMACIEN TOUT EFFET NON SOUHAITÉ ET GËNANT QUI NE SERAIT PAS MENTIONNÉ DANS CETTE NOTICE",1.0,0.8854932571256576,0.19999999998,1.0,0.8787589134214896,0.9436070822573871,Q5
Quelle est la posologie recommandée de AMODEX-Gé 250MG 5ML pdre pour un enfant de 10 ans?,"[""Posologie\n\nLa présentation en gélule est réservée à l'adulte et l'enfant de plus\nde 6 ans (cf. Mises en garde). Dans certains cas, i existe d'autres\npresemtations d'amoxicilline plus adaptées, en particulier pour\ndes posologies supérieures à 2 g par jour chez l'adulte\n\nDANS TOUS LES CAS, SE CONFORMER STRICTEMENT À L'ORDON\nNANCE DE VOTRE MÉDECIN.\n\nLa posologie varie selon la pathologie qui est traitée\nAtitre indicatif les doses prescrites peuvent varier\n\nChezl'adulte : de 1 gà6 gpar 24 heures\n\nChezl'enfant : de 25 mg/kg à 150 mg/kg par 24 heures\n\nLes doses doivent être modifiées en cas d'insuffisance rénale"", 'Voie orale.\n-GÉLULES: avaler les gélules sans les ouvrir avec un verre d\'eau\n-POUDRE POUR SUSPENSION BUVABLE: Remplir le flacon\navec de l\'eau non gazeuse jusqu\'au trait. Agiter jusqu\'à obtention\nd\'un liquide homogène. Si nécessaire, compléter à nouveau avec\nde l\'eau jusqu\'au trait et agiter Bien agiter le flacon avant chaque\nutilisation\n\n-Amodex” Gé 250 mg, poudre pour suspension buvable :\nUtiliser la cuillère-mesure fournie avec le flacon. La cuillère\nmesure comporte 2 graduations\n\n1 cuillère-mesure contenant 5 ml, soit 250 mg d\'amonicilline.\n\n1/2 cuillère-mesure contenant 2.5 ml, soit 125\nd\'amoxicilline\n\nBien rincer la cuillere-mesure après chaque utilisation\n\n- Amodex"" Gè 500 mg, poudre pour suspension buvable :\nUtiliser la cuillère-mesure fournie avec le flacon en la remplissant\njusqu\'au bord (une cuillère-mesure contient 5 ml soit 500 mg\nd\'amoxicilline). Bien rincer la cuillère-mesure après chaque\nutilisation\n\nFréquence et moment auquel le médicament doit être\nadministré\n\nCe médicament peut être pris indifféremment à jeun, avant,\npendant ou après les repas', 'Amodex Gé 500 mg, gélule\nAmoxialline (sous forme de trihydratel 500 mg\nExcipients : Stéarate de magnésium, gélatine, érythrosine\n{E127), indigotine (E132), dioxyde de titane (E171). oxydes de fer\n(172) a.s.p une gélule\nBoite de 12 gelules\nAmodex"" Gé 250 mg / 5 mi. poudre pour suspension\nbuvable\nAmoxicilline (sous forme de trihydrate) 39\nExipients : Benzoate de sodium, citrate de sodium, silice:\nedétate de sodium, arôme fraise, arôme citron, glycyrhizinate\nd\'ammonium, saccharose q.sp 30g\nFlacon de 30 g de poudre correspondant après reconstitution à\n60 ml de sirop (12 mesures)\nLe conditionnement contient une cuillère- mesure.\nUne cuillère-mesure (5 mi) contient 5 mg de benzoate de sodium\n6 mg de sodium et 2 g de saccharose.\nAmodex"" Gé 500 mg / 5 ml, poudre pour suspension\nbuvable\nAmoxicilline (sous forme de trihydrate) 6g\nExcipients : Benzoate de sodium. citrate de sodium. silice,\nedetate de sodium, arome fraise, arme citron, glycytrhizinate\nd\'ammonium, saccharose q.s p. 309.\nFlacon de 30 g de poudre correspondant après reconstitution à\n60 ml de sirop {12 mesures)\nLe conditionnement contient une cuillère-mesure\nUne cuillére-mesure (5 ml) contient 5 mg de\nsodium, 11 mg de sodium et 1,7 g de saccharose', ""Amodex Gé est indique dans le traitement des infections\nbactériennes à germes sensibles. Ce médicament est indiqué\négalement chez l'adulte dans le traitement de certains ulcères de\nl'estomac ou du duodénum\nAttention !"", ""Prévenirimmédiatement votre médeci\n\nConduite à tenir au cas où l'admi\n\nplusieurs doses a été omise\n\nLe traitement doit être poursuivi normalement, sans tenir\n\ncompte de la dose oubliée."", ""En cas de besoin, ce médicament peut etre pris pendant la \ngrossesse.\nL'allaitement est possible avec la prise de ce médicament. Si le\nnouveau né présente des troubles tels que diarrhée, éruption sur\nla peau, candidose (infection due à certains champignons\nmicroscopiques), avertissez immédiatement votre médecin qui\nvous conseillera sur la conduite à tenir car ces effets sur votre\nenfant sont peut-être düs à ce médicament\n\nD'UNE FAÇON GÉNÉRALE, IL CONVIENT AU COURS DE LA\nGROSSESSE OÙ DE L'ALLAITEMENT DE TOUJOURS DEMANDER\nL'AVIS DE VOTRE MÉDECIN OÙ DE VOTRE PHARMACIEN AVANT\nD'UTILISER UN MÉDICAMENT.\nListe des excipients dont la connaissance est nécessaire\npour une utilisation sans risque chez certains patients :\nBenzoate de sodium, sodium et saccharose (poudre pour\nsuspension buvable)""]","La posologie recommandée pour un enfant de 10 ans dépend de son poids. Pour un enfant de 10 ans, on peut estimer un poids moyen de 30 kg. Ainsi, la dose quotidienne serait de 750 mg à 4,5 g par jour, soit 15 à 90 cuillères-mesures de 5 ml (250 mg) par jour.",la dose recommende pour un enfant de 10 ans est de 25 mg/kg à 150 mg/kg par 24 heures,0.5,0.7319512139218366,0.9999999999,1.0,0.1989422779707754,0.7957691118831016,Q6
Est-il possible d utiliser AMODEX-Gé 250MG 5ML pdre  pendant la grossesse?,"[""En cas de besoin, ce médicament peut etre pris pendant la \ngrossesse.\nL'allaitement est possible avec la prise de ce médicament. Si le\nnouveau né présente des troubles tels que diarrhée, éruption sur\nla peau, candidose (infection due à certains champignons\nmicroscopiques), avertissez immédiatement votre médecin qui\nvous conseillera sur la conduite à tenir car ces effets sur votre\nenfant sont peut-être düs à ce médicament\n\nD'UNE FAÇON GÉNÉRALE, IL CONVIENT AU COURS DE LA\nGROSSESSE OÙ DE L'ALLAITEMENT DE TOUJOURS DEMANDER\nL'AVIS DE VOTRE MÉDECIN OÙ DE VOTRE PHARMACIEN AVANT\nD'UTILISER UN MÉDICAMENT.\nListe des excipients dont la connaissance est nécessaire\npour une utilisation sans risque chez certains patients :\nBenzoate de sodium, sodium et saccharose (poudre pour\nsuspension buvable)"", ""Amodex Gé est indique dans le traitement des infections\nbactériennes à germes sensibles. Ce médicament est indiqué\négalement chez l'adulte dans le traitement de certains ulcères de\nl'estomac ou du duodénum\nAttention !"", 'Voie orale.\n-GÉLULES: avaler les gélules sans les ouvrir avec un verre d\'eau\n-POUDRE POUR SUSPENSION BUVABLE: Remplir le flacon\navec de l\'eau non gazeuse jusqu\'au trait. Agiter jusqu\'à obtention\nd\'un liquide homogène. Si nécessaire, compléter à nouveau avec\nde l\'eau jusqu\'au trait et agiter Bien agiter le flacon avant chaque\nutilisation\n\n-Amodex” Gé 250 mg, poudre pour suspension buvable :\nUtiliser la cuillère-mesure fournie avec le flacon. La cuillère\nmesure comporte 2 graduations\n\n1 cuillère-mesure contenant 5 ml, soit 250 mg d\'amonicilline.\n\n1/2 cuillère-mesure contenant 2.5 ml, soit 125\nd\'amoxicilline\n\nBien rincer la cuillere-mesure après chaque utilisation\n\n- Amodex"" Gè 500 mg, poudre pour suspension buvable :\nUtiliser la cuillère-mesure fournie avec le flacon en la remplissant\njusqu\'au bord (une cuillère-mesure contient 5 ml soit 500 mg\nd\'amoxicilline). Bien rincer la cuillère-mesure après chaque\nutilisation\n\nFréquence et moment auquel le médicament doit être\nadministré\n\nCe médicament peut être pris indifféremment à jeun, avant,\npendant ou après les repas', 'Amodex Gé 500 mg, gélule\nAmoxialline (sous forme de trihydratel 500 mg\nExcipients : Stéarate de magnésium, gélatine, érythrosine\n{E127), indigotine (E132), dioxyde de titane (E171). oxydes de fer\n(172) a.s.p une gélule\nBoite de 12 gelules\nAmodex"" Gé 250 mg / 5 mi. poudre pour suspension\nbuvable\nAmoxicilline (sous forme de trihydrate) 39\nExipients : Benzoate de sodium, citrate de sodium, silice:\nedétate de sodium, arôme fraise, arôme citron, glycyrhizinate\nd\'ammonium, saccharose q.sp 30g\nFlacon de 30 g de poudre correspondant après reconstitution à\n60 ml de sirop (12 mesures)\nLe conditionnement contient une cuillère- mesure.\nUne cuillère-mesure (5 mi) contient 5 mg de benzoate de sodium\n6 mg de sodium et 2 g de saccharose.\nAmodex"" Gé 500 mg / 5 ml, poudre pour suspension\nbuvable\nAmoxicilline (sous forme de trihydrate) 6g\nExcipients : Benzoate de sodium. citrate de sodium. silice,\nedetate de sodium, arome fraise, arme citron, glycytrhizinate\nd\'ammonium, saccharose q.s p. 309.\nFlacon de 30 g de poudre correspondant après reconstitution à\n60 ml de sirop {12 mesures)\nLe conditionnement contient une cuillère-mesure\nUne cuillére-mesure (5 ml) contient 5 mg de\nsodium, 11 mg de sodium et 1,7 g de saccharose', ""Posologie\n\nLa présentation en gélule est réservée à l'adulte et l'enfant de plus\nde 6 ans (cf. Mises en garde). Dans certains cas, i existe d'autres\npresemtations d'amoxicilline plus adaptées, en particulier pour\ndes posologies supérieures à 2 g par jour chez l'adulte\n\nDANS TOUS LES CAS, SE CONFORMER STRICTEMENT À L'ORDON\nNANCE DE VOTRE MÉDECIN.\n\nLa posologie varie selon la pathologie qui est traitée\nAtitre indicatif les doses prescrites peuvent varier\n\nChezl'adulte : de 1 gà6 gpar 24 heures\n\nChezl'enfant : de 25 mg/kg à 150 mg/kg par 24 heures\n\nLes doses doivent être modifiées en cas d'insuffisance rénale"", ""Prévenirimmédiatement votre médeci\n\nConduite à tenir au cas où l'admi\n\nplusieurs doses a été omise\n\nLe traitement doit être poursuivi normalement, sans tenir\n\ncompte de la dose oubliée.""]",Amodex Gé peut être utilisé pendant la grossesse si nécessaire.,"Amodex Gé peut être utilisé pendant la grossesse Amodex Gé peut être utilisé pendant la grossesse en cas de besoin. D'UNE FAÇON GÉNÉRALE, IL CONVIENT AU COURS DE LA grossesse de toujours demander l avis de votre medecin ou de votre pharmacien",1.0,0.726846564724828,0.9999999999,1.0,0.7054601157443037,0.8218404629772149,Q7
Est-ce que AMODEX-Gé 250MG 5ML pdre  peut causer la diarrhée pour un adulte ?,"['CE MÉDICAMENT PEUT, CHEZ CERTAINES PERSONNES\n\nENTRAINER DES EFFETS PLUS OÙ MOINS GÉNANTS\n\nAllergie pouvant se manifester de façon plus où moins grave\n\néruption sur la peau, augmentation de certains globules blancs\n\nædème de Quincke (brusque gonfiement du visage et du cou),\n\ngêne respiratoire, exceptionnellement choc allergique.\n\nTroubles digestifs : nausées, vomissements, diarrhées,\n\ncandidose linfection due à certains champignons\n\nmicroscopiques)\n\n Plus rarement: \n\n-Augmentation modérée et transitoire des enzymes du foie\n\n{transaminases),\n\n-Anèmie, baisse des globules blancs et des plaquettes\n\nAtteinte rénale.\n\nEn cas de diarrhée survenant au cours du traitement par ce\n\nmédicament. prenez rapidement avis auprès de votre médecin\n\nNe jamais prendre de traitement antidiarrhéique\n\nsans prescription médicale.\n\nSIGNALEZ À VOTRE MÉDECIN OÙ À VOTRE PHARMACIEN TOUT\n\nEFFET NON SOUHAITÉ ET GÉNANT QUI NE SERAIT PAS\n\nMENTIONNE DANS CETTE NOTICE', ""Amodex Gé est indique dans le traitement des infections\nbactériennes à germes sensibles. Ce médicament est indiqué\négalement chez l'adulte dans le traitement de certains ulcères de\nl'estomac ou du duodénum\nAttention !"", ""En cas de besoin, ce médicament peut etre pris pendant la \ngrossesse.\nL'allaitement est possible avec la prise de ce médicament. Si le\nnouveau né présente des troubles tels que diarrhée, éruption sur\nla peau, candidose (infection due à certains champignons\nmicroscopiques), avertissez immédiatement votre médecin qui\nvous conseillera sur la conduite à tenir car ces effets sur votre\nenfant sont peut-être düs à ce médicament\n\nD'UNE FAÇON GÉNÉRALE, IL CONVIENT AU COURS DE LA\nGROSSESSE OÙ DE L'ALLAITEMENT DE TOUJOURS DEMANDER\nL'AVIS DE VOTRE MÉDECIN OÙ DE VOTRE PHARMACIEN AVANT\nD'UTILISER UN MÉDICAMENT.\nListe des excipients dont la connaissance est nécessaire\npour une utilisation sans risque chez certains patients :\nBenzoate de sodium, sodium et saccharose (poudre pour\nsuspension buvable)"", 'Voie orale.\n-GÉLULES: avaler les gélules sans les ouvrir avec un verre d\'eau\n-POUDRE POUR SUSPENSION BUVABLE: Remplir le flacon\navec de l\'eau non gazeuse jusqu\'au trait. Agiter jusqu\'à obtention\nd\'un liquide homogène. Si nécessaire, compléter à nouveau avec\nde l\'eau jusqu\'au trait et agiter Bien agiter le flacon avant chaque\nutilisation\n\n-Amodex” Gé 250 mg, poudre pour suspension buvable :\nUtiliser la cuillère-mesure fournie avec le flacon. La cuillère\nmesure comporte 2 graduations\n\n1 cuillère-mesure contenant 5 ml, soit 250 mg d\'amonicilline.\n\n1/2 cuillère-mesure contenant 2.5 ml, soit 125\nd\'amoxicilline\n\nBien rincer la cuillere-mesure après chaque utilisation\n\n- Amodex"" Gè 500 mg, poudre pour suspension buvable :\nUtiliser la cuillère-mesure fournie avec le flacon en la remplissant\njusqu\'au bord (une cuillère-mesure contient 5 ml soit 500 mg\nd\'amoxicilline). Bien rincer la cuillère-mesure après chaque\nutilisation\n\nFréquence et moment auquel le médicament doit être\nadministré\n\nCe médicament peut être pris indifféremment à jeun, avant,\npendant ou après les repas', 'Amodex Gé 500 mg, gélule\nAmoxialline (sous forme de trihydratel 500 mg\nExcipients : Stéarate de magnésium, gélatine, érythrosine\n{E127), indigotine (E132), dioxyde de titane (E171). oxydes de fer\n(172) a.s.p une gélule\nBoite de 12 gelules\nAmodex"" Gé 250 mg / 5 mi. poudre pour suspension\nbuvable\nAmoxicilline (sous forme de trihydrate) 39\nExipients : Benzoate de sodium, citrate de sodium, silice:\nedétate de sodium, arôme fraise, arôme citron, glycyrhizinate\nd\'ammonium, saccharose q.sp 30g\nFlacon de 30 g de poudre correspondant après reconstitution à\n60 ml de sirop (12 mesures)\nLe conditionnement contient une cuillère- mesure.\nUne cuillère-mesure (5 mi) contient 5 mg de benzoate de sodium\n6 mg de sodium et 2 g de saccharose.\nAmodex"" Gé 500 mg / 5 ml, poudre pour suspension\nbuvable\nAmoxicilline (sous forme de trihydrate) 6g\nExcipients : Benzoate de sodium. citrate de sodium. silice,\nedetate de sodium, arome fraise, arme citron, glycytrhizinate\nd\'ammonium, saccharose q.s p. 309.\nFlacon de 30 g de poudre correspondant après reconstitution à\n60 ml de sirop {12 mesures)\nLe conditionnement contient une cuillère-mesure\nUne cuillére-mesure (5 ml) contient 5 mg de\nsodium, 11 mg de sodium et 1,7 g de saccharose', ""Posologie\n\nLa présentation en gélule est réservée à l'adulte et l'enfant de plus\nde 6 ans (cf. Mises en garde). Dans certains cas, i existe d'autres\npresemtations d'amoxicilline plus adaptées, en particulier pour\ndes posologies supérieures à 2 g par jour chez l'adulte\n\nDANS TOUS LES CAS, SE CONFORMER STRICTEMENT À L'ORDON\nNANCE DE VOTRE MÉDECIN.\n\nLa posologie varie selon la pathologie qui est traitée\nAtitre indicatif les doses prescrites peuvent varier\n\nChezl'adulte : de 1 gà6 gpar 24 heures\n\nChezl'enfant : de 25 mg/kg à 150 mg/kg par 24 heures\n\nLes doses doivent être modifiées en cas d'insuffisance rénale""]","Amodex Gé peut causer des troubles digestifs, y compris la diarrhée, chez les adultes.","Oui, il peut causer des troubles digestifs comme la diarrhée ",1.0,0.6111057187209558,0.9999999999,1.0,0.8903222575578404,0.5612890302313617,Q8
 qu'est ce que TOBREX 300000ui colly en solution et dans quels cas est il utiliser?,"[""Ne pas utiliser TOBREX 0,3%, collyre en solution dans les cas suivants:\n\n- · antécédents d'allergie à l'un des constituan s du collyre en solution, notamment à la tobramycine (antibiotique de la famille des aminosides)."", ""Comme tous les médicaments, TOBREX 0,3%, collyre en solution es suscep e d'entraîner des effets indés bles:\n\n- · irritation locale sort sous forme d'irritation passagère lors de l'instillation, soit sous forme de réactions allergiques purement locales: démangeaisons, irritation, gonflement des paupières, rougeur de l'œil.\n- · en raison de la présence de chlorure de benzalkonium : risque d'eczéma, d'irritation.\n\nSi vous remarquez des e ets indésirab es non me 0 ès s ce e · ce. veui lez en Informer vo re édecin ou 0 e pharma"", ""A titre indicatif, la posologie usuelle est:\n\n0,3 g\n\n-\n\n-\n\n<!-- image -->\n\ndes signes cliniques, puis diminuée progressivement, par votre médecin. du collyre, afin de favoriser son action locale, il est conseillé:\n\nla\n\n- Après instillation ou paupière\n\npendant\n\n3 minutes,\n\n- · d'exercer une pression sur la partie haute latérale du nez. Si vous avez l'impression que l'effet de TOBREX 0,3%, collyre en solution est trop fort ou trop faible, consultez votre médecin ou votre pharmacien. Voie ophtalmique.\n\n- • de fermer\n\n<!-- image -->\n\nComme pour tous les collyres, effectuez, dans l'ordre les opérations suivantes:\n\n- 1. Lavez-vous soigneusement les mains.\n- 2. Evitez de toucher l'œil ou les paupières avec l'embout compte-gouttes.\n- 3. Instillez 1 goutte de collyre dans le cul-de-sac conjonctival inférieur en regardant vers le haut et en tirant légèrement la paupière inférieure vers le bas. L'œil fermé, essuyer proprement l'excédent. 4. Refermez le flacon après utilisation.\n\nSi vous utilisez un autre collyre, respec ez un intervalle de 5 u es e e es deux instillations.\n\nDurée du traitement: 5 à 15 jours.\n\nSi vous avez utilisé plus de TOBREX 0,3%, collyre en solution que vous n'auriez dû : consultez immédiatemen votre médecin ou votre pharmacien. Si vous oubliez de prendre TOBREX 0,3%, collyre en solution: ne prenez pas de dose double pour compenser la dose e que vous avez oubliée de prendre."", ""Collyre en solution.\n\nPrésenté sous forme de 5 ml en flacon: boite de 1.\n\nCe médicament contient un antibiotique de la famille des aminosides: la tobramycine.\n\nCe médicament est indiqué dans le tr ement local de certaines infections de l'œil dues à des bactéries pouvant être co battues par ce antibiotique: conjonctivites, kératites (inflammation de la cornée d'origine bacenne) et ulcères de la cornée."", 'La substanclactive est:\n\nTobramycine\n\n.... \\_................................................................................•..........\n\nPour 100 ml', ""- · En cas d'allergie, le tral ement doit être arrêté.\n- · Le collyre ne doit pas être employé en injection péri ou intraoculaire.\n- · En l'absence d'amélioration rapide ou en cas d'apparition de symptômes anormaux, consulter votre médecin.\n- · En cas de traitement prolongé par ce collyre, une surveillance par votre médecin est nécessaire.\n- · En cas de traitement concomitant par un autre collyre, instiller les collyres à 15 minutes d'intervalle.\n- · En raison de la présence de chlorure de benzalkoruum, le port de lentilles de contact souples est déconseillé pendant la durée du traitement.\n- · Ne pas toucher l'œil avec l'extrémité du flacon.\n- · Reboucher celui-ci soigneusement après usage.""]","TOBREX 0,3%, collyre en solution est utilisé pour traiter localement certaines infections de l'œil causées par des bactéries, telles que les conjonctivites, les kératites et les ulcères de la cornée."," TOBREX 0,3 est un collyre en solution est indiqué pour le traitement local de certaines infections de l'œil dues à des bactéries sensibles, telles que les conjonctivites, les kératites et les ulcères de la cornée.",1.0,0.5896118152797409,0.249999999975,1.0,0.8284159655230638,0.913663862092255,Q9
quels sont les effets indésirables possible de forlax 4g sach pdre solution buv pour un enfant ?,"[""Voie orale.\n\nDe 6 mois à 1 an\n\n: 1 sachet par jour.\n\nEntre 1 an et 4 ans: 1 à 2 sachets par jour.\n\nDe 4 ans à 8 ans: 2 à 4 sachets par jour.\n\nLe contenu de chaque sachet doit être dissout dans environ 50 ml d'eau juste avant d'être administré. Le traitement sera pris le matin dans le cas d'une posologie d'un sachet par jour ou réparti entre le matin et le soir dans le cas d'une posologie supérieure. L'effet de FORLAX se manifeste dans les 24 à 48 heures suivant son administration.\n\nChez l'enfant, en l'absence de données cliniques au-delà de 3 mois, la durée du traitement ne devra pas dépasser 3 mois. L'amélioration du transit intestinal induite par le traitement sera maintenue par les mesures hygiéno-diététiques.\n\nLa dose journalière doit être adaptée en fonction des effets cliniques obtenus."", 'FORME ET PRESENTATION\n\nFORLAXe (Macrogol 4000) 4g poudre pour solution buvable en sachet-dose. Boîtes de 20 sachets-dose.', ""Traitement symptomatique de la constipation chez l'enfant de 6 mois à 8 ans.\n\nUne cause organique devra être écartée par le médecin avant d'initier le traitement, en particulier chez l'enfant de moins de 2 ans. FORLAX 4 g doit rester un traitement temporaire de la constipation, d'une durée n'excédant pas 3 mois, en association aux mesures hygiéno-diététiques adaptées. La persistance des troubles au terme du traitement, malgré le maintien des mesures hygiéno-diététiques, devra faire rechercher et traiter une pathologie sousjacente.\n\nDANS TOUS LES CAS SE CONFORMER STRICTEMENT A LA PRESCRIPTION DE VOTRE MEDECIN.\n\n- · Maladies inflammatoires sévères de l'intestin (rectocolite hémorragique, maladie de Crohn) ou mégacôlon toxique,\n- · Perloration digestive ou risque de perloration digestive,\n- · lIeus ou suspicion d'occlusion intestinale, sténose symptomati ue,\n- · Syndromes douloureux abdominaux de cause indéterminée,\n- · Hypersensibilité au macrogol (polyéthylène glycoO ou à l'un des excipients."", 'FORLAX~4g', ""Chez l'enfant les effets indésirables ont été mineurs et transitoires et ont concerné principalement l'appareil digestif:\n\nDouleurs abdominales\n\nDiarrhée ( La diarrhée peut entraîner une douleur périanale).\n\nVomissements\n\nBallonnements\n\nNausée\n\nRéactions d'hypersensibilité\n\nChez l'adulte, les effets indésirables suivants ont été observés lors des études cliniques et lors de la commercialisation du produit\n\nAffections gastro-intestinales:\n\nFréquent: distension abdominales, nausées. Peu fréquent: besoin impérieux d'aller à la selle, incontinence fécale.\n\nTroubles du métabolisme et de la nutrition: Fréquence inconnue: troubles électrolytiques (hyponatrémie, hypokaliémie) et/ou déshydratation en particulier chez le sujet âgé.\n\nAffections du système immunitaire:\n\nTrès rare: réactions d'hypersensibilité (prurit, éruption, œdème de la face, œdème de Quincke, urticaire, choc anaphylactique).\n\nSIGNALER A VOTRE MEDECIN OU A VOTRE PHARMACIEN TOUT EFFET NON SOUHAITE GENANT QUI NE SERAIT PAS MENTIONNE DANS CETTE NOTICE."", ""De très rares cas de réactions d'hypersensibilité (éruption, urticaire, œdème) ont été décrits avec des spécialités contenant du macrogol (polyéthylène glycol). Des cas exceptionnels de choc anaphylactique ont été rapportés.\n\nFORLAX 4g ne contenant pas de quantité significative de sucre ou de polyol, il peut être prescrit aux patients diabétiques ou aux patients soumis à un régime exempt de galactose.\n\nEN CAS DE DOUTE, NE PAS HESITER A DEMANDER L'AVIS DE VOTRE MEDECIN OU VOTRE PHARMACIEN""]","Les effets indésirables possibles de FORLAX 4g pour un enfant incluent des douleurs abdominales, de la diarrhée, des vomissements, des ballonnements, des nausées et des réactions d'hypersensibilité.","les effets indésirables possible de forlax 4g chez l'enfant sont: Douleurs abdominales, Diarrhée , Vomissements, Ballonnements, Nausée, Réactions d'hypersensibilité",1.0,0.8675899769783197,0.19999999998,1.0,0.9862664286360737,0.9450657145442949,Q10
quells sont Indications thérapeutiques de clovir 200mg comp?,"['comprimés 200mg', 'comprimés 200 mg Bte/30\n\nCOMPOSITION:\n\nAcidovir....\n\n.\n\n200 mg.', ""Traitement de l'herpès simplex chez l'adulte:\n\n200mg de clovir 5 fois par jour à environ 4 heures d'intervalles, le traitement doit être poursuivi pendant 5 jours.\n\nChez les patients immunodéprimés ou présentant une altération de l'absorption intestinale, la dose peut être doublée à 400 mg ou envisager un traitement alternativement par voie intraveineuse.\n\nSuppression des infections à herpes simplex chez les patients immunocompétents:\n\n200mg de clovir doit être pris 4 fois par jour à intervalles d'environs 6 heures ou 400 mg de clovir 2 fois par jour à des intervalle d'environ 12 heures.\n\ncertains patients peuvent présenter des infections nécessitant des doses quotidiennes totales de 800 mg de c1ovir.\n\nLe traitement doit être interrompu périodiquement pendant 6 à 12 mois, afin d'observer d'éventuels amélioration de la maladie.\n\nProphylaxie des infections herpétiques simplex chez les patients immunodéprimés: la posologie est de 200 mg 4 fois par jour à des intervalles d'environ 6 heures."", ""800 mg de clovir doit être prise 5 fois par jour à des intervalles d'environ 4 heures.\n\nle traitement doit être poursuivi pendant 7 jours.\n\nChez les patients gravement immunodéprimés ou présentant une altération de t'absorption intestinale , il faut utiliser la forme intraveineuse.\n\nL'administration doit débuter le plutôt possible: le traitement de l'herpes Zoster donne de meilleurs résultats si il est administré des le début de l'éruption.\n\nLe traitement de la varicelle chez les patients immunocompétents devrait commencer dans les 24 heures après le début de l'éruption. Traitement de la varicelle: 6 ans et plus: 800 mg de crow 4 fois par jour.\n\n2-5 ans: 400 mg de clovir 4 fois par jour.\n\nMoins de 2 ans: 200 mg de clovir 4 fois par jour. Le traitement doit être poursuivi pendant 5 jours CONTRE~NDICATIONS:\n\nAntécédents d'hypersensibilité à l'Aciciovir ou â l'un des excipients."", ""Mode d'administration: voie orale\n\nClovir peut être dissous dans un minimum de 50 ml d'eau ou avalé avec un peu d'eau."", ""L'utilisation de probénécide augmente la durée de demi-vie en cas d'association avec un traitement par voie générale d'aciclovir, certains médicament qui affectent la physiologie renale peuvent influer sur la pharmacocinétique de l'aciclovir. L'expérience clinique n'a pas permis d'identifier d'autre médicament ayant une interaction avec l'aciclovir. CONSERVATION:\n\nA conserver à une température inférieure à 25°C.\n\nPRÉSEIffATiONS-,\n\n--\n\nCLOVIR est disponible en 200mg, comprimés,""]","Clovir 200mg est indiqué pour le traitement de l'herpès simplex chez l'adulte, la suppression des infections à herpes simplex chez les patients immunocompétents, la prophylaxie des infections herpétiques simplex chez les patients immunodéprimés, le traitement de la varicelle chez les patients immunocompétents, et le traitement de l'herpès zoster.","CLOVIR 200mg est indiqué dans le traitement de Herpes simplex (incluant les primo-infections génitales et les récurrences ultérieures), des infections virales cutanées et de la membrane muqueuse, dans la prévention des infections à virus Herpes simplex chez les sujets immunodéprimés , et dans le traitement de l'Herpes Zoster",0.6,0.7486794596842395,0.3333333333,0.6666666666666666,0.7031312822732521,0.8125251290930087,Q11
"Quels sont les médicaments à ne pas utiliser avec ENCOFLUIDE ADULTE 0,25g ?","[""Evitez l'administration de l'Encofluide adultes:\n\n- Chez les sujets en cure de désintoxication alcoolique.\n\n- Chez les Diabétiques.\n\n- Chez les enfants de moins de 15 ans.\n\n- En cas de toux asthmatique.\n\n- En cas d'insuffisance respiratoire.\n\n- En cas de régime sans sel."", ""Par prudence, éviter l'administration du produit:\n\n- Pendant toute la dorée de la grossesse, et durant l'allaitement.\n\n- L'attention est appelée sur les risques de somnolence attachés à l'emploi de ce médicament."", 'Interactions possibles avec les médicaments à effet antabuse et les psychotropes.', ""- Terpine (D.C.l)\n\n0,25g.\n\n- Eucalyptol (D.C.I)\n\nO,Olg.\n\n- Benzoate de sodium (D.c.I)\n\n2g.\n\n- Guaifenesine (D.c.I)\n\nO,20g.\n\n- Codéine (base) (D.C.I)\n\nO,048g.\n\n- Teinture d'Ipéca (D.C.I)\n\n19.\n\nExcipients:\n\nAcide benzoïque, alcool éthylique, propylène glycol, saccharose ( 3,6 glC à S),\n\nbleu patente V,jaune orange S\n\n- Eau purifiée q.s.p\n\n100 ml."", 'Alcool éthylique, Acide benzoïque, propylène glycol, saccharose.', ""Terpine, Eucalyptol, Benzoate de sodium, Guaifenesine, Codéine, Teinture d'Ipéca""]",Encofluide adultes ne doit pas être utilisé avec des médicaments à effet antabuse et les psychotropes.,Encofluide adulte ne doit pas etre utiliser avec les médicaments à effet antabuse et les psychotropes.,1.0,0.7128782482417014,0.3333333333,1.0,0.99597797893708,0.98391191574832,Q12
Est-ce qu il existe un risque d'un surdosage de doliprane 300mg suppo ?,"[""2. QUELLESSONT LESINFORMATIONSA CONNAITREAVANTO'UTlUsa DOUPRANE 300 mg, suppositoire 1"", ""Corn tous ie5m ost wsupb d·a.oir dos.t!ets ndéua bien le · soit ···· SUjet.\n\n- · Dans certains as rares, il est possible que sun ~ &amp;lI ou Ulle cutanée ou une réaction allergique pouvant se mamfester par un brusque gonflement du visage et du cou ou par un malaise brutal avec chute de la pression artérielle. Il faut immédiatement arrêter le traitement, avertir votre médecin et ne plus jamais reprendre de médicaments contenant du paracétamol.\n- · Exceptionnellement, des modifications biologiques nécessitant un contrôle du bilan sanguin ont pu être observées: taux anormalement bas de certains globules blancs ou de certaines cellules du sang comme les plaquettes pouvant se traduire par des saignements de na ou des gencives. Dans ce cas, consultez un médecin.\n\n· Avec la forme suppositoire. il ya un risque d'irritation rectale ou anale (voir Mises en garde).\n\nSi vous remarquez des effets indésirables non mentionnés dans cette notice, ou si certains effets indb;jrables deviennent graves, veuillez en informer votre médecin ou voire pharmacien.\n\n5. COMMENTCO 5ERVERDOUPRANE 300 mg, suppositoire 7\n\nTenir ho« do la port~ et de la vue des enfants.\n\nnate de e ···· utiliser DOUPRANE 300 mg, suppositoire après la date de péremption mmDonMe sur la boite.\n\nConditions de conservation\n\nCe médÎGI ent doit être conservé à une température ne dépassant pas °3OC.\n\nSi nkessa-re, mises\n\nen garde contre\n\ncertains signes\n\nvisibles de détérioration\n\nles médicaments ne doivent pas être jetés au tout a l'égout ou avec les ordures mënagëres, Demandez a votre pharmacien ce qu'il faut faire des médicaments inutitisës, Ces mesures permettront de protéger l'environnement.\n\n6. INFORMATIONSSUPPLEMENTAIRES\n\ntiste complète des substances actives et des excipients\n\nQue contient DOliPRANE 300 mg, suppositoire 7\n\nUlUlHtance active es .\n\nParacétamol\n\n•.•.•.•.•.•.•.....•...............................................•...........•...•.•.•.•.\n\n300 mg Pour\n\nun suppositoire.\n\nles autres composants sont:\n\nglycérides herni-synthêtiques solides.\n\nForme pharmaceutique et contenu\n\nSuppositoire Boite de 10,"", '- N\'utilisez jamais DOUPRANE300 mg, suppositoire dans\'"" as suivants\n- · allergie connue au paracétamol ou autres constituants,\n- · maladie ~ du foie,\n- · inflammatJon rëœnte anale ou rectale ou saignemen dœal du rectum.\n\nENCASDE00lITL Il EST 1 DISPE SABLEDEDEMANDERLA DE VOTRE EDEO OU DEVOTREPHARMiIOE\'i.\n\nspéciales PréautiMs l\' Fme \\_\\_ ····~ garde\n\nE &amp;vée, consulta\n\nCe mldia.rnent (rautres médicaments contiennent. Ne 1 es associez pas, afin de ne ···· ~ la dose quotidienne reœenmandëe (voir Posologie).\n\nAvec les suppositoires, il y a un osque d\'irritalion locale, d\'auta plus fréquent et intense que la durée du trait ern ent est prolongée, le rythme d\'~ inistration est élevé et la posologie est forte.\n\nPrécautions d\'emploi\n\n· Si la douleur persiste plus de 5 jours ou la fièvre plus de 3 jours ou en cas d\'efficacité insuffisante ou de survenue de tout autre signe, ne pas continuer le traitement sans l\'avis de votre médecin.\n\n- · n cas e malaClie""\'g""ra""\'ve·""â~u-&lt;o""\'l·e-;;o""u·d\'~es~re\'""on;;;sc-"" Il es néCeSsaire de c médecin avant de donner du paracétamol a votre enfant. er votre\n\n~ \\_\\_ d\' P\'rise \\_ · ·\n\nEN CASDE DOUTE E PAS HESITERA DEMANDERL\'AVISDE VOTREMEDEO OU DE \\\'I()TRf PHARJoIA(]EN. ..u\' ts d\'DIres \\_\n\nprmd cr méchament si votre médecin vous prescrit un ~ du QW( d ~ nque cD"", le Soing.\n\nSi vous pœnu 00 ~ pris rëœmment un autre mëdkarnent, y compris un médicament obtenu sans ordonnance, partez-en a votre médecin ou a votre pharmacien.\n\nUtilisation pendant la grossesse et l\'allaitement', 'A titre informatif: le paracétamol, dans les conditions normales d\'utilisation, peut être utilisé pendant la grossesse ainsi qu\'au cours de l\'allailement.\n\nDemandez conseil a votre médecin ou a votre pharmacien avant de prendre tout médicament.\n\n3. COMMENTUTIUSER DOUPRANE 300 ml, suppositoire 7\n\nPosologie, Mode et/ou voie{s) d\'administntion, Fréquence d\'M inistration et üurêe du traitement posolotie\n\nLa posologie de paracétamol dépend du poid&gt; de l\'enfant; les ages """"\'1 mentionnés a titre d\'information.\n\nSivous ne connaissez pas le poids de l\'enfant, il faut le peser afin de lui donner la dose la mieux adaptée,\n\nLe paracétamol existe sous de nombreux dosages, permettant d\'adapter le traitement au poids de chaque enfant.\n\nLa dose quotidienne de paracétamol recommandée dépend du poids de l\'enfant : elle est d\'environ 60 mg/kg/jour, a répartir en 4 prises, soit environ 15 mg/kg toutes les 6 heures.\n\nEn raison du risque d\'irritation rectale, l\'administration de suppositoire doit être la plus courte possible, ne doit pas dépasser 4 prises par jour"" sera remplacée dès que possible par un traitement par voie orale.\n\nEn cas de diarrhée, la forme suppositoire n\'est pas adaptée.\n\nCene présentation estadaptée aux enfants pesant de 15 a 24kg (environ 4a 9ans), la posologie est d\'un suppositoire à 300 mg, à renouveler si besoin au bout de 6 heures sans dépasser"" suppositoires par jour.\n\n<!-- image -->\n\nENCASDEDOUTE,DEMANDElCONSEILAVOTREMEDECINOUAVOTREPHARMACIEN Mode et voie d\'administration irm W~\\_~, 0\n\nDe plus, si votrore~::::::;:::,:::\'"" n8.5( \\_ ··· """" ··· :.1 ····· efficacité du Il ··· mesu ····\n\n- · eëœuvrez vo~\n- · brtes le boire,\n- · ne laissez ···· \\_,..rIIoo01C\\_ ···· md trop chaud.\n\nfréquence d\'ad"",\n\nLes prises systéoNtiques permettent d\'éviter les oscillations de douleur ou de fi~ Chez l\'enfant, etl es doivent être régulièrement espacées, y compris la nuit, de préférence de 6 heures et d\'au moins 4 heures.\n\nEn as de maladie grave des reins (Insuffisance rénale sévère), les prises seront esoacëes de 8 heures minimum.\n\n6mos et instructions en ca&gt; de surdosage\n\nSi \\_\\_ .-.oz os do DOUPRAM 300 mg, suppositoire que &gt;ous n\'auriez dO : En as do~ ou d ~.,......., en utJeX!\' un I ···· &gt;«IIL 4. QUElS SO\'iT US EFFUS 1 DE5DAIIUS EVENTUElS? \\_"":~.==~', ""a~ ph ·· muoth~r.tpeutique\n\nAUTllESANALGESIQUES et ANTIPYRETIQUES\n\n1 · tnpevti u··\n\nCr amm con d p.J~\n\nost ni! en as do et/ou finoro telles que maux de ~~,don~~~~ ~ lUts grippaux, cm., pRset ost~~ l'enfanl delsa 24kg (environ 419\\_). Lire ~ enti-mnent PI&gt;soIogie.\n\nPour les enfants ayant un poids inférieur ~ 15 kg ou supérieur a 24 présentations de paracétamol. Demandez conseil A votre pharmacien. existe d'autres ou à votre"", 'La température normale du corps est variable d\'une personne a l\'autre et comprise entre 36,S"" C et 37,5"" C Une élévation de température au-delà de 38"" Cpeul être considérée comme une fièvre.\n\nCe rnëdicarnent est destiné au nourrisson de 3 a B kg (environ de la naissance à 9 mois).\n\nSi les troubles que la fièvre entraîne sont trop gênants, vous pouvez utiliser ce médicament qui contient du paracétamol en respectant les posologies indiquées. Pour éviter tout risque de déshydratation, pensez a faire boire l\'enfant fréquemment. Avec ce médicament, la fièvre doit baisser rapidement. Néanmoins:\n\n- · si d\'autres signes inhabituels apparaissent,\n- · si la fièvre persiste plus de 3 jours ou si elle s\'aggrave,\n- · si les maux de tête deviennent violents, ou en cas de vomissements. CONSULTElIMMEDIATEMENT VOTREMEDECIN.\n\nQUEFAIREENCASDEDOULEUR?\n\nl\'intensité de la perception de la douleur et la capacité à lui résister varient d\'une personne à l\'autre\'.\n\n- · S\'il n\'y a pas d\'amélioration au bout de 5 jours de traitement.\n- · Si la douleur est violente, inattendue et survient de façon brutale (notamment une douleur forte dans la poitrine) et/ou au contraire revient régulièrement.\n- · Si elle s\'accompagne d\'autres signes comme un étal de malaise général, de la fièvre, un gonflement inhabituel de la zone douloureuse, une diminution de la force dans un membre.\n- · Si elle réveille l\'enfant la nuit.\n- CONSULTElIMMEDIATEMENT VOTREMEDECIN.\n\n.&gt;!!\'.&gt;il\' .sjl;.J~\n\n~ s ~ z\n\nWUllI••• ~,~\n\n("".!JIJ\'~\';""""\n\n<!-- image -->\n\n""\'lai i.Lu ,.s;~~\n\n""j.o\n\n~.).\n\n38.5°.;,.,.,.s.w.\n\ni.)l~\n\n\':\',j~\n\nUll\n\n,,,,WI\n\n. &lt;k """""",~I tjl .\n\n. •LlI&lt;lu...!.\n\ni)~Ie\'l.&gt;"".:.~J"";""; r""""']","Il existe un risque de surdosage avec DOUPRANE 300 mg, suppositoire, et des mesures doivent être prises en cas de surdosage.","Oui,Il existe un risque de surdosage avec DOUPRANE 300 mg, suppositoireIl existe un risque de surdosage avec DOUPRANE 300 mg, suppositoire, et en cas de surdosage, un traitement symptomatique est nécessaire..",1.0,0.7604514417644027,0.6388888888675925,0.5,0.6040878217854029,0.9163512871416115,Q13
est ce que je peux utiliser doliprane 300mg suppo si j'ai une inflammation annale?,"['- N\'utilisez jamais DOUPRANE300 mg, suppositoire dans\'"" as suivants\n- · allergie connue au paracétamol ou autres constituants,\n- · maladie ~ du foie,\n- · inflammatJon rëœnte anale ou rectale ou saignemen dœal du rectum.\n\nENCASDE00lITL Il EST 1 DISPE SABLEDEDEMANDERLA DE VOTRE EDEO OU DEVOTREPHARMiIOE\'i.\n\nspéciales PréautiMs l\' Fme \\_\\_ ····~ garde\n\nE &amp;vée, consulta\n\nCe mldia.rnent (rautres médicaments contiennent. Ne 1 es associez pas, afin de ne ···· ~ la dose quotidienne reœenmandëe (voir Posologie).\n\nAvec les suppositoires, il y a un osque d\'irritalion locale, d\'auta plus fréquent et intense que la durée du trait ern ent est prolongée, le rythme d\'~ inistration est élevé et la posologie est forte.\n\nPrécautions d\'emploi\n\n· Si la douleur persiste plus de 5 jours ou la fièvre plus de 3 jours ou en cas d\'efficacité insuffisante ou de survenue de tout autre signe, ne pas continuer le traitement sans l\'avis de votre médecin.\n\n- · n cas e malaClie""\'g""ra""\'ve·""â~u-&lt;o""\'l·e-;;o""u·d\'~es~re\'""on;;;sc-"" Il es néCeSsaire de c médecin avant de donner du paracétamol a votre enfant. er votre\n\n~ \\_\\_ d\' P\'rise \\_ · ·\n\nEN CASDE DOUTE E PAS HESITERA DEMANDERL\'AVISDE VOTREMEDEO OU DE \\\'I()TRf PHARJoIA(]EN. ..u\' ts d\'DIres \\_\n\nprmd cr méchament si votre médecin vous prescrit un ~ du QW( d ~ nque cD"", le Soing.\n\nSi vous pœnu 00 ~ pris rëœmment un autre mëdkarnent, y compris un médicament obtenu sans ordonnance, partez-en a votre médecin ou a votre pharmacien.\n\nUtilisation pendant la grossesse et l\'allaitement', ""2. QUELLESSONT LESINFORMATIONSA CONNAITREAVANTO'UTlUsa DOUPRANE 300 mg, suppositoire 1"", ""Corn tous ie5m ost wsupb d·a.oir dos.t!ets ndéua bien le · soit ···· SUjet.\n\n- · Dans certains as rares, il est possible que sun ~ &amp;lI ou Ulle cutanée ou une réaction allergique pouvant se mamfester par un brusque gonflement du visage et du cou ou par un malaise brutal avec chute de la pression artérielle. Il faut immédiatement arrêter le traitement, avertir votre médecin et ne plus jamais reprendre de médicaments contenant du paracétamol.\n- · Exceptionnellement, des modifications biologiques nécessitant un contrôle du bilan sanguin ont pu être observées: taux anormalement bas de certains globules blancs ou de certaines cellules du sang comme les plaquettes pouvant se traduire par des saignements de na ou des gencives. Dans ce cas, consultez un médecin.\n\n· Avec la forme suppositoire. il ya un risque d'irritation rectale ou anale (voir Mises en garde).\n\nSi vous remarquez des effets indésirables non mentionnés dans cette notice, ou si certains effets indb;jrables deviennent graves, veuillez en informer votre médecin ou voire pharmacien.\n\n5. COMMENTCO 5ERVERDOUPRANE 300 mg, suppositoire 7\n\nTenir ho« do la port~ et de la vue des enfants.\n\nnate de e ···· utiliser DOUPRANE 300 mg, suppositoire après la date de péremption mmDonMe sur la boite.\n\nConditions de conservation\n\nCe médÎGI ent doit être conservé à une température ne dépassant pas °3OC.\n\nSi nkessa-re, mises\n\nen garde contre\n\ncertains signes\n\nvisibles de détérioration\n\nles médicaments ne doivent pas être jetés au tout a l'égout ou avec les ordures mënagëres, Demandez a votre pharmacien ce qu'il faut faire des médicaments inutitisës, Ces mesures permettront de protéger l'environnement.\n\n6. INFORMATIONSSUPPLEMENTAIRES\n\ntiste complète des substances actives et des excipients\n\nQue contient DOliPRANE 300 mg, suppositoire 7\n\nUlUlHtance active es .\n\nParacétamol\n\n•.•.•.•.•.•.•.....•...............................................•...........•...•.•.•.•.\n\n300 mg Pour\n\nun suppositoire.\n\nles autres composants sont:\n\nglycérides herni-synthêtiques solides.\n\nForme pharmaceutique et contenu\n\nSuppositoire Boite de 10,"", ""a~ ph ·· muoth~r.tpeutique\n\nAUTllESANALGESIQUES et ANTIPYRETIQUES\n\n1 · tnpevti u··\n\nCr amm con d p.J~\n\nost ni! en as do et/ou finoro telles que maux de ~~,don~~~~ ~ lUts grippaux, cm., pRset ost~~ l'enfanl delsa 24kg (environ 419\\_). Lire ~ enti-mnent PI&gt;soIogie.\n\nPour les enfants ayant un poids inférieur ~ 15 kg ou supérieur a 24 présentations de paracétamol. Demandez conseil A votre pharmacien. existe d'autres ou à votre"", 'La température normale du corps est variable d\'une personne a l\'autre et comprise entre 36,S"" C et 37,5"" C Une élévation de température au-delà de 38"" Cpeul être considérée comme une fièvre.\n\nCe rnëdicarnent est destiné au nourrisson de 3 a B kg (environ de la naissance à 9 mois).\n\nSi les troubles que la fièvre entraîne sont trop gênants, vous pouvez utiliser ce médicament qui contient du paracétamol en respectant les posologies indiquées. Pour éviter tout risque de déshydratation, pensez a faire boire l\'enfant fréquemment. Avec ce médicament, la fièvre doit baisser rapidement. Néanmoins:\n\n- · si d\'autres signes inhabituels apparaissent,\n- · si la fièvre persiste plus de 3 jours ou si elle s\'aggrave,\n- · si les maux de tête deviennent violents, ou en cas de vomissements. CONSULTElIMMEDIATEMENT VOTREMEDECIN.\n\nQUEFAIREENCASDEDOULEUR?\n\nl\'intensité de la perception de la douleur et la capacité à lui résister varient d\'une personne à l\'autre\'.\n\n- · S\'il n\'y a pas d\'amélioration au bout de 5 jours de traitement.\n- · Si la douleur est violente, inattendue et survient de façon brutale (notamment une douleur forte dans la poitrine) et/ou au contraire revient régulièrement.\n- · Si elle s\'accompagne d\'autres signes comme un étal de malaise général, de la fièvre, un gonflement inhabituel de la zone douloureuse, une diminution de la force dans un membre.\n- · Si elle réveille l\'enfant la nuit.\n- CONSULTElIMMEDIATEMENT VOTREMEDECIN.\n\n.&gt;!!\'.&gt;il\' .sjl;.J~\n\n~ s ~ z\n\nWUllI••• ~,~\n\n("".!JIJ\'~\';""""\n\n<!-- image -->\n\n""\'lai i.Lu ,.s;~~\n\n""j.o\n\n~.).\n\n38.5°.;,.,.,.s.w.\n\ni.)l~\n\n\':\',j~\n\nUll\n\n,,,,WI\n\n. &lt;k """""",~I tjl .\n\n. •LlI&lt;lu...!.\n\ni)~Ie\'l.&gt;"".:.~J"";""; r""""', '· J,.14-I.,.J1.}&lt; "",..1""\'"" w\'--\'-\n\n,uu...~1t"""" ,Ijl""wtl v-\'""""I ,t\'......J1 . ..,..1)1 rti ;Jl. ~I ,II, 1i\'.:.&gt;\'I.. J ~ ,~I r\'iill\n\n(\':\'1"".... 9.). .:.1""....4 ~ JI""..) tJS 24.}. 15 ~ ~..,--.;.. r&lt;.&gt;.iiIII· .:.! .· ,~~4 0..............1 ill if iol.,l..,.,..&gt;!\' ,J,.u;""\'!.ll ··.,al.:.l.;.w ~\'"" \'tJS 24 ~ ""lS\\\'1}tJS 15 ~Ji\\\'1 ~ \'!-\'14 .J..,..JI}~.,.:.1-!\n\n~ 300 Ol~j.l JlW..!J.,olIf:iÂ~Yi""lI ~I.::oLtj1a11 ~Lt.2 ~ ~']","L'utilisation de DOUPRANE 300 mg, suppositoire est contre-indiquée en cas d'inflammation anale ou rectale.","Non, ce médicament ne doit pas être utilisé en cas d inflammation recente anale.",1.0,0.5496600649592609,0.8333333332916666,1.0,0.6322052056045204,0.5288208224180817,Q14
Quels sont les cas à ne pas utiliser DEXOREN 0.25mg comp ,"['DEXOREN ® 0,25 mg\n\n: comprimé sécable ; boîte de 20', ""Mode d'emploi et posologie du médicament DEXOREN ®"", 'p cp\n\nDigoxine\n\n0,25 mg', ""Ce médicament ne doit pas être utilisé dans les cas suivants :\n\n- \uf0a7 certaines anomalies du fonctionnement cardiaque,\n- \uf0a7 en association avec le sultopride ou des injections intraveineuses de calcium.\n- \uf0a7 Il faut se référer à la notice de l'emballage pour tout effet notoire d'un des excipients du médicament."", ""Il n'a pas été mis en évidence de problème particulier lors de l'utilisation de ce médicament chez la femme enceinte. Toutefois, au cours des 3 derniers mois de la grossesse, il peut être nécessaire d'adapter la posologie."", ""Ce médicament ne doit pas être associé au calcium injectable par voie intraveineuse ni au sultopride : risque de troubles du rythme cardiaque graves.\n\nInformez par ailleurs votre médecin si vous prenez un médicament susceptible de favoriser une hypokaliémie , un pansement digestif , un médicament contenant l'une des substances suivantes : charbon, kaolin, colestyramine, hydroquinidine, quinidine, sucralfate, amiodarone, sulfasalazine, vérapamil, clarithromycine, érythromycine, carbamazépine, calcium (par voie orale).""]","DEXOREN ne doit pas être utilisé en cas de certaines anomalies du fonctionnement cardiaque, ni en association avec le sultopride ou des injections intraveineuses de calcium.",Ce médicament ne doit pas être utilisé dans les cas de certaines anomalies du fonctionnement cardiaque et en association avec le sultopride ou des injections intraveineuses de calcium.,1.0,0.6767561568434569,0.2916666666520833,1.0,0.9527865802119868,0.8111463208479474,Q15
quels sont les Effets indésirables possibles de cital 50mg comp?,"['p cp\n\nClomifène citrate\n\n50 mg', 'CITAL ® : comprimé sécable\n\n; boîte de 10', ""Ce médicament ne doit pas être utilisé dans les cas suivants :\n\n- \uf0a7 maladie grave ou récente du foie,\n- \uf0a7 certaines causes de saignements entre les règles,\n- \uf0a7 cancer des organes génitaux,\n- \uf0a7 certains kystes de l'ovaire,\n- \uf0a7 troubles de la vue pendant le traitement ou lors de traitements précédents,\n- \uf0a7 grossesse .\n- \uf0a7 Il faut se référer à la notice de l'emballage pour tout effet notoire d'un des excipients du médicament."", 'Ce médicament peut provoquer une stimulation excessive des ovaires : en cas de douleurs dans le bas-ventre, de sensation de gonflement ou de prise de poids, prévenez votre médecin.', ""Troubles de la vision.\n\nBouffées de chaleur, maux de tête, étourdissement, vertiges.\n\nTroubles digestifs .\n\nRègles plus abondantes, saignement entre les règles.\n\nNervosité, insomnie, état dépressif .\n\nEnvie d'uriner fréquente.\n\nRéaction allergique cutanée.\n\nAugmentation de la probabilité d'une grossesse multiple."", ""Ce médicament est un inducteur de l'ovulation : il provoque la formation de l'ovule par l'ovaire. Il agit sur l' hypothalamus , qui sécrète les hormones indispensables au déclenchement de l'ovulation.\n\nIl est utilisé dans :\n\n- \uf0a7 le traitement des stérilités dues à un dérèglement hormonal;\n- \uf0a7 le diagnostic et le traitement de certaines aménorrhées, notamment celles qui peuvent suivre l'arrêt d'une contraception orale (pilule).""]","Les effets indésirables possibles de CITAL 50mg comprimé incluent des troubles de la vision, des bouffées de chaleur, des maux de tête, des étourdissements, des vertiges, des troubles digestifs, des règles plus abondantes, des saignements entre les règles, de la nervosité, de l'insomnie, un état dépressif, une envie fréquente d'uriner, des réactions allergiques cutanées et une augmentation de la probabilité d'une grossesse multiple.","Les effets indésirables possibles de CITAL 50mg comprimé incluent : troubles de la vision ; bouffées de chaleur, maux de tête, étourdissement, vertiges ; troubles digestifs ; règles plus abondantes, saignement entre les règles ; nervosité, insomnie, état dépressif ; envie d'uriner fréquente ; réaction allergique cutanée ; et augmentation de la probabilité d'une grossesse multiple.",1.0,0.921730957566155,0.19999999998,1.0,0.8906554999131834,0.9911934282241622,Q16
Quels sont les signes d'un surdosage du médicament DEXOREN 0.25mg comp ?,"[""Mode d'emploi et posologie du médicament DEXOREN ®"", 'DEXOREN ® 0,25 mg\n\n: comprimé sécable ; boîte de 20', 'p cp\n\nDigoxine\n\n0,25 mg', ""Ils sont le plus souvent le signe d'un surdosage :\n\n- \uf0a7 nausées, vomissements, diarrhée , perte de l'appétit ;\n- \uf0a7 coloration en jaune de la vision ;\n- \uf0a7 vertiges, maux de tête ;\n- \uf0a7 troubles psychiques, notamment chez la personne âgée ;\n- \uf0a7 troubles du rythme cardiaque variés, palpitations .\n\nExceptionnellement : gynécomastie , éruption cutanée ."", ""Ce produit est très toxique en cas de surdosage : tenez-le hors de portée des enfants.\n\nEn cas de palpitations récentes survenues sous traitement, prévenez votre médecin.\n\nDes précautions sont nécessaires en cas d' insuffisance rénale ou d' hypothyroïdie et chez la personne âgée.\n\nTout médicament susceptible de faire baisser la kaliémie , notamment les diurétiques ou les laxatifs stimulants , devra être utilisé sous contrôle médical strict.\n\nEn cas d'intervention chirurgicale, l'anesthésiste doit être prévenu de la prise de ce médicament."", ""Traitement d'attaque : une forte dose est parfois prescrite par le médecin pendant quelques jours, sous surveillance médicale.\n\nTraitement d'entretien : la posologie est adaptée par le médecin en fonction de l'effet recherché ; une analyse de sang permet de connaître la concentration du médicament dans le sang : en effet, le risque de surdosage est important.""]","Les signes d'un surdosage du médicament DEXOREN 0.25mg comp incluent des nausées, vomissements, diarrhée, perte de l'appétit, coloration en jaune de la vision, vertiges, maux de tête, troubles psychiques, et troubles du rythme cardiaque variés, palpitations.","Les effets indésirables sont le plus souvent le signe d un surdosage : nausées, vomissements, diarrhée, perte de l appétit, coloration en jaune de la vision, vertiges, maux de tête, troubles psychiques (notamment chez la personne âgée), troubles du rythme cardiaque variés, palpitations.",1.0,0.9991606924395352,0.249999999975,1.0,0.9157225723329467,0.6628902893317871,Q17
Est-ce que je peux prendre le médicament ipnodis 5mg ml sol inj si j'si des troubles respiratoires?,"[""Le médicament  vous  sera admènestré par un  médecin  ou  une  infumière I] est donc peu  probable que  vous receviez plus d'IpnodiS que vous  ne  devnez. Toutefois,  si par erreur vous avez 1eçu plus d'IpnociS que vous  n'aunez  dû, us pourriez vo présenter Jes troubles suivants\n\n- -  Somnolence  éflexes et perte de la coomiination et des r\n- - Troubles  la parole et  mouvements  anormaux  yeux de des\n- » Pression  arténelle basse Cela  peut  entrainer des  étouuchssements  ou  des vertiges\n- - Ralentissement  la respiration  battements du cœur  e conscience (coma) ou  arrêt de ou des et perte d\n- Si vous recevez I pnodiS en soins intensifs pour une sédation, pendant  une longue durée :\n- - IpnockS  pourait  étre moins  efficace\n- -Vous  pouvez  devenir dépendant  à  ce médicament, et ressentir des symptômes  de  sevrage à  l'acrét du  traitement (voir le paragraphe : Si vous  arrêtez d'utiliser  IpnodiS )\n\nSi vous avez oublié  d'utiliser IpnodiS\n\nSans objet"", '## IpnodiS  5mg/1ml  -  IpnodiS  2mg/2ml IpnodiS  25mg/5ml  -  IpnodiS  50mg/10ml', '- Prévenez  votre médecin  ou  votre  infirmière  avant  de  recevoir IpnodiS  st :\n\n-  Vous êtes âgé de plus de 60 ans\n\n- -Vous avez une maladie chronique (de longue durée), pas exemple des troubles respiratoires ou des troubles du  rein, du  foie  ou  du cœur\n- -Vous avez une malactie   vous  donne le sentiment  d\'être très faible, abattu et sans énergie qui :\n- -  Vous  souffiez  d\'une \'myasthénie"" (malache  caracténsée  par une  faiblesse musculaire) ;\n- Vous  avez  déjà  eu  des problèmes  avec  l\'alcool\n- -  Vous  av ot pre  mes  u en cas de doute, n\'hésitez pas de demander l\'avis de votie médecin  ou de diogue Si vous êtes Gans l\'une des situsvtions ci-dessus  o de  vote  infirmiéte avant  recevoir  ]pnocS de\n- St votre  enfant  doit  recevoir  ce  médicament :\n- -  Prévenez vote médecin ou vote nfemière  s1 vote enfant  touve  uations ci-dessus se dans l\'une des sit\n\nEn particulier, prévenez votre médecin  nfummère si votre enfant  woubles carthaques ou respiratoires\n\nou vote i a des\n\nPrise  d\'entre sideumets\n\nSi vous prenez ou  avez  puis récemment  un  autre médicament, y  compns  un  mécament  obtenu  sans ordonnance  où  un médicament  à base  de\n\ntes, parlez-en  à  votre médecin  à  vote  infmmuère ou\n\nIl est à noter  u\'IpnociS q peut mocbfier Jes effets des autres  méchcaments  et certains  euvent modifier autres médicaments p les effets d\'IpnociS\n\nSd an  pievenez Ne  ee   venez l\'un des mécicaments suivants Se\n\n- éccaments  contre la\n- 2  fara er  (pour  vous  corn :\n- fs  (pour vous rendre calme  ou  sommolert) .\n- -Tranquillisants (contre l\'arvuété ou  pour vous  encore)\n- Catamazépine  ou  ng  Narre   vent étre utilisés pour les convulsions) =peu ;\n- -  Rifampicine (contre  La tube\n\n- Mécicaments  contre le VIH  3\n\nms  lohibiteus de  Protease (par  exemple  le saquinavu)\n\nà\n\n- -Antibiotiques  gr  ec M s  pour talter une infection per des bactéries (par exemple  lérytuomycine ou la clanthromycine\'\n- -Mécicaments  ti  raiter les mfectons  à  champignons (par exemple  le ketoconazole, le voriconazole, le faconazole, t }taconazole, le posacorezole)\n- -Antalgiques puissants (contre  la  douleux) ;\n- - Atorvestatine (contre l\'hypercholestéiolénue) ;\n- Beppe ae  (contre les reactions alle\n- - Extrait  mullepertus (médicament  à base &amp;  a Ce  depress de e conte la\n- - Médicaments  contre  l\'Hyper  \'Tension Artenielle  appelés  inhibiteurs Cal  iques  (par  exemple  le  ciltnazem) Calc\n\nSi vous êtes dans  l\'une des situations ci-dessus ou en cas  de  doute, n\'hésitez pas de  over  evis de  voue  médecin\n\nl\n\nou\n\n- de  vote  mnfmuère  avant  de  recevoir  IpnodS', '|                    | IpnodisS® 5 mg/1 ml   | IpnodiS* 2 mg/2 ml   | 1 25 mg/5 ml   | IpnodiS®* 50 mg/10 ml   |\n|--------------------|-----------------------|----------------------|----------------|-------------------------|\n| Principe actif     |                       |                      |                |                         |\n| Midazolam          | 50me                  | 20 mg                | 25 me          | 50 mg                   |\n| Chiorure de sodium | 90 me                 | 180 mg               | 45 mg          | 90 mg                   |\n| EPPL               | asp lm                | asp tm               | qsp Sm         | asp. 10m                |\n\nQu\'est-ce  que  IpnodiS  et  contenu  l\'emballage  extérieur de\n\n- *[peochS* 5 mg /  1  ri  -  Mickeoken   soluton myectable dans des ampoules de |  mi corbtoreées cars des  boîtes de 10 ampoules +IpooiS"" 2 me/2 mi - Midecolam  : solubon miectable dans des ampoules de 2 mi concitormées dans des boîtes de 10 ampoules *[pemrhS* 25 me / 5 mi -  Mickenlam solution wyectable durs des ampoules de 5  ri conchtcenées ches des boîtes de O5 ampoules *IpmodS"" 50 me /  10 ml  - Micezolam:  solution syectable dams des ampoules  de 10 mi  conckuonnres cams des boites ce 06 ampoules Conditions  délivrance de :\n- Liste    médicament  réservé à I, L\'usage hospitalier\n\nd\'AMM : Présentations et numéros\n\n| Spécialités        | N°AMM.     | Présentations                |\n|--------------------|------------|------------------------------|\n| [pnodiS 5 mg/l     | 923 328 IH | Boîte de 10 ampoules de | mi |\n| [pnodiS 2 mg/2ml   | 923 328 2H | Boite de 10 ampoules de 2 ml |\n| IpnoS 25 mg/Smil   | 923 328 3H | Boîte de 5 ampoules de 5 mi  |\n| IpnodiS 50 mg/]Oml | 923 328 4H | Boite de 6 ampoules de 10 ml |', ""- -Si vous êtes allergique (hypersensible) au  nudazolam  ou  à l'un des auties composants contenus dans ce médicament (voir rubrique 6  :  Informations s ntaues) Si vous  êtes allergique à  d'autres benzocbazépines, par exemple  le chazépam  ou  le mutraépaun\n- -Si vous  avez  des  cf icultes respiratoires sévères à  cause  d'une  maladie  des poumons  (insuf  france  respiratoire  sévère)  et f =  allez recevoir [pnodiS  pour  obtenir  une  sedation  vigile\n\nne devez  pas  recevoir  [pnodiS  si vous  êtes dans  l'une des  situations ci-dessus er  pin n'hésitez pas de demander l'avis de vote médecin ou de vote infimmére avant de recevou ce"", ""S  vois jecevez ]pnociS penciant une  longue  divée, par exemple  en unité de soins intensifs,  vous  pourrez présenter des symptômes  de  sevrage  l'arêt s symptômes sont les swvants à du méchcament Ce\n\n- -Mochfcations  de l'humeur\n- -Convulsions\n- - Maux  de  tête\n- Douleurs musculanes\n- - Troubles  du  sommeil (insomnie)\n- -Sensation  grande inqusétude (ansuété),  de  tension. d'agitation, de confusion  ou  de  mnnvaise humeur (uritabilité) de\n- - Impression  de  voir  et  peut-être  dentenche  des  choses  qui  n'existent  pas  réellement  (hallucinations) Vour  médecin  réduira  progressivement  la  dose  afin  d'éviter  l'appantion  de  symptômes  de  sevrage\n- 4. QUELS  SONT  LES  EFFETS  INDESIRABLES  EVENTUELS ?\n- Comune  tous Jes mécicaments, IpnodiS est susceptible d'avoir des effets indésirables, bien  que  tout le monde  n'y  soit pas sujet\n\nLes effets indésirables suivants peuvent  prodiure lors de l'admunistration  (avec une fréquence non se du midazolam déterminée ne pouvant  éte  este  sur la bese  des  données  disponibles) Anétez  d'utiliser IpnochS  et  consultez umméchatement  un  médecin  s1 vous présentez l'un  des  effets mdésirables  survants\n\nCes  effets peuvent menacer  le pronostic vital owniez  avoir besoin d'un traitement médical et  vous p\n\nen urgence\n\n-Réaction  allergique sévére (choc  anaphylactique)  Les  signes  peuvent  éte  une  éruption  cutanée  d'appairuon  brutale, des démangeaisons ou une  rticaire  ee   langue  parties ducorps u des  levies.  de  la ou d'autres Vous pournez  g é une respiration  sifflamte ou des fficultés  à  respirer\n\n- -Crise cardiaque  (arrêt carchaque).  Las  signes peuvent inclue des  doulews  thoraciques.\n\n-\n\nTroubles sespurataues, parfois responsables  d'un  arrét de la respiration\n\n-\n\nSpasme  musculaie (contraction) autour de la gorge, responsable d¥touffement\n\nLes effets indésirables mettant en danger la vie peuvent être plus fréquents chez Jes adultes  plus de 60 ans et chez  les de personres ayant  des toubles  respiratoires où  cardiaques préexistants, particulidrement  lorsque  l'uyection  est  réalisée top oe   lorsqu'une dose élevée est  acministée ou""]","Si vous avez des troubles respiratoires, vous devez en informer votre médecin ou infirmière avant de recevoir IpnodiS.",vous devez informer le medecin avant de prendre Ipnodis si vous avez des difficultés respiratoires,1.0,0.5837771664665223,0.733333333315,1.0,0.956744761736263,0.8269790469450522,Q18
"est-il possible de prendre Cerazette 0,75 mg comp durant la grossesse ?","[""Cerazette peut être utilisé pendant l'allaitement. Cerazette est dépourvu d'effet sur la production ou la qualité du lait maternel. Une faible quantité de la substance active de Cerazette passe toutefois dans le lait maternel.\n\nLa santé des enfants ayant été allaités pendant 7 mois et dont les mères utilisaient Cerazette a été étudiée pendant 2,5 ans. Aucun effet sur la croissance ou le développement de ces enfants n'a été observé.\n\nSi vous allaitez et souhaitez utiliser Cerazette, demandez conseil à votre médecin."", ""Cerazette peut être utilisé pendant l'allaitement. Cerazette est dépourvu d'effet sur la production ou la qualité du lait maternel. Une faible quantité de la substance active de Cerazette passe toutefois dans le lait maternel.\n\nLa santé des enfants ayant été allaités pendant 7 mois et dont les mères utilisaient Cerazette a été étudiée pendant 2,5 ans. Aucun effet sur la croissance ou le développement de ces enfants n'a été observé.\n\nSi vous allaitez et souhaitez utiliser Cerazette, demandez conseil à votre médecin."", ""Vous pouvez commencer à prendre Cerazette le jour où vous devriez normalement recevoir l'injection suivante ou le jour du retrait de l'implant ou du stérilet. Vous n'avez pas besoin d'utiliser de moyen contraceptif supplémentaire.\n\n- · Après un accouchement\n- Commencez à prendre Cerazette entre le 21e et le 28e jour après l'accouchement. Si vous débutez plus tardivement, vous devez utiliser un moyen contraceptif supplémentaire (méthode de barrière) pendant les 7 premiers jours de prise des comprimés. Si vous\n- avez eu des rapports sexuels, il est nécessaire d'exclure une\n- grossesse avant de commencer à prendre Cerazette. Des informations supplémentaires pour les femmes qui allaitent figurent à la rubrique 2 « Grossesse et allaitement ». Votre médecin peut également vous conseiller.\n- · Après une fausse couche ou une interrupüon de grossesse Conformez-vous aux recommandations de votre médecin."", ""Vous pouvez cesser de prendre Cerazette lorsque vous le souhaitez. A partir du jour où vous arrêtez, vous n'êtes plus protégée contre une grossesse.\n\nSi vous avez d'autres questions sur l'utilisation de ce médicament, demandez plus d'infonmations à votre médecin ou à votre pharmacien."", ""N'utilisez pas Cerazette si vous êtes enceinte ou pensez l'être."", 'Comme tous les médicaments, ce médicament peut provoquer des effets indésirables, mais ils ne surviennent pas systématiquement chez tout le monde.\n\nLes effets indésirables sérieux associés à l\'utilisation de Cerazette sont décrits dans les paragraphes ""Cancer du sein"" et ""Thrombose"" dans la rubrique 2 ""Dans quel cas, vous ne pouvez pas prendre ce médicament ou les cas où vous devriez être extrêmement prudent"". Pour plus d\'informations veuillez lire cette rubrique et, si nécessaire, consultez immédiatement votre médecin.\n\nIl est possible que vous présentiez au cours de l\'utilisation de Cerazette de légers saignements vaginaux à intervalles irréguliers. Ceux-ci peuvent se limiter à quelques gouttes ou être des pertes de sang plus importantes, ressemblant à un léger saignement menstruel et nécessitant l\'utilisation d\'une protee ion. Il est également possible que les saignements demeurent totalement absents. Des saignements irréguliers ne sont pas une indication d\'une moins bonne protection contre une grossesse. En général, vous ne devez rien faire de spécial et pouvez continuer à prendre normalement Cerazette. Cependant, si la perte de sang est importante ou persiste longtemps, vous devez consulter votre médecin.\n\nN\'utilisez pas ce médicament après la date de péremption indiquée sur l\'emballage après « EXP ». La date de péremption fait référence au dernier jour du mois.\n\nIl n\'y a pas de conditions particulières de conservation pour ce médicament. Conserver la plaquette thermoformée dans le sachet d\'origine à l\'abri de la lumière et de l\'humidité. Durée de conservation après ouverture du sachet: 1 mois.\n\nNe jetez aucun médicament au out à l\'égout ni avec les ordures ménagères. Demandez à votre pharmacien d\'éliminer les médicaments que vous n\'utilisez plus. Ces mesures contribueront à protéger l\'environnement.']",Il est déconseillé de prendre Cerazette pendant la grossesse ou si vous pensez être enceinte.,Il est déconseillé de prendre Cerazette pendant la grossesse,1.0,0.7210111592999034,0.19999999998,1.0,0.7021847493405553,0.8087389973622212,Q19
quels sont les effects indesirables du maalox maux destomac?,"[""Comme tous les médicaments, MMlO ,suspension buvable en Hacon est susceptible d'avoir des effets indésirables, bien que tout le monde n'y soit pas sujet Possibilité de:\n\n- · troubles digestifs (diarrhées ou constipation),\n- · diminution du taux de phosphore dans le sang en cas d'utilisation prolongée ou à fortes doses.\n\nSivous remarquez des eftets indésorables non mentionnés dans cette notice, ou si certains effets indësirebles deviennent graves, veuillez en informer votre médecin ou votre pharmacien ."", ""Vous ne devez utiITserce médicament qu'après avis de votre médecin:\n\n- · si VOl troubles sont associés à une perte de poids,\n- · si vous avez des difficultés à avaler ou une gêne abdominale persistante,\n- · SI vous soufrez de troubles de la digestion pour la première fois ou si ces troubles se sont modifiés récemment,\n- · si vous avez une maladie des reins ~nsuffisante rénale) ou si vous êtes dialysé, vous devez consulter un médecin car MMLOX', suspension buvable en Hacon contient de l'aluminium et du magnésium. l'accumulation de d'aluminium et de magnésium peut entramer une ~aladle neurol~lque grave (encéphalopathie).\n\nl'utilisation de ce médicament est dëconseillëe chez les patients présentant une intolérance au fructose (maladie héréditaire rare).\n\nCe médicament contient du parahydroxybenzoate de méthyle et de propyle et peut provoquer des réactions allergiques."", ""Veuillez lire attentivement cette notice avant d'utiliser ce médicament. Elle contient des informations importantes pour votre traitement.\n\nSi vous avez d'autres questions, si vous avez un doute, demandez plus d'informations à votre médecin ou à votre pharmacien.\n\n- · Gardez cette notice, vous pourriez avoir besoin de la relire.\n- · Si vous avez besoin de plus d'informations et de conseils, adressez-vous à votre pharmacien.\n- · Si les symptômes s'aggravent ou persistent, consultez un médeci n.\n- · Si vous remarquez des effets indésirables non mentionnés\n- dans cette notice, ou si vous ressentez un des effets mentionnés comme étant grave, veuillez en informer votre médecin ou votre pharmacien.\n\n1.QU'ESHE QUEMAALOX',suspension buvable en flacon ETDANSQUELSCAS ..fSUi UTtLlSE? \\_ \\_\\_\n\ntndications tlWrapeutiques: Ce médicament est indiqué chez l'adulte (à partir de 15 ans) dans les brûlures d'estomac et remontées acides."", ""Date de péremption\n\nNe pas utiliser\n\nMAALOX',suspension buvable en flacon après la date de péremption\n\nmentionnée sur\n\nle conditionnement\n\nextérieur.\n\nCondillons de conservation: Pas de précautions particulières de conservation, Si nécessaire, mises en garde contre certains signes visibles de détérioration médicaments ne doivent pas être jetés au tout à l'égout ou avec les ordures ménagères. Demandez à votre pharmacien ce qu'il faut faire des médicaments mutilisés. Ces mesures permettront de protéger l'environnement.\n\n6, INFORMATIONS SUPPLEMENTAIRES\n\nListe complète des substances actives et des excipients Que contient MAALOX,suspension buvabfe en flacon? Les substances actives sont:\n\nHydroxyde de magnésium\n\n4,00 g\n\nHydroxyde d'aluminium\n\n3,50 g\n\nPour 100 ml."", ""1 cuillère à soupe au moment des brûlures d'estomac ou des remontées acides. sans dépasser 6 cuillères à soupe par jour.\n\nLa durée d'utilisation est limitée à 10 jours.\n\nSymptômes et instructions en cas de surdosage\n\nSI vous avez pris plus de MAALOX,suspension buvable en flacon que vous n'auriez dû: Consultez votre médecin ou votre pharmacien. -\\_\n\nle surdosage de magnésium par voie orale n'entraîne pas. en général. de réactions toxiques en cas de lonctionnement normal du rein. l'intoxication au magnésium peut, toutefois, se développer en cas d'insuffisance rénale."", ""Liste des informations nécessaires avant la prise du médicament\n\nSivotre médecin vous a informé(e) d'une intolérance à certains sucres contactez-te avant de prendre ce médicament. 'les\n\nContre-indications: Ne prenez jamais MMLOX', suspension buvable en flacon en cas:\n\n- · d'antécédents d'allergie à l'un des composants de la suspension buvable, · maladie grave du ren.\n\nEncas de doute, il est indispensable de demander l'avis de votre médecin ou de votre pharmacien.\n\nPrécautions d'emploi;\n\nmises en garde spéciales\n\nFaites atientiOn avec MMlOXo;suspension buvable en Hacon:""]","MAALOX, suspension buvable en flacon peut provoquer des troubles digestifs tels que des diarrhées ou de la constipation, ainsi qu'une diminution du taux de phosphore dans le sang si utilisé de manière prolongée ou à fortes doses.","Les effets indésirables possibles de Maalox incluent : troubles digestifs comme la diarrhées ou la constipation et, en cas d'utilisation prolongée ou à fortes doses, une diminution du taux de phosphore dans le sang. ",1.0,0.5906060628719236,0.9999999999,1.0,0.9322154612031602,0.7288618448126409,Q20
est ce que je peux  injecter le medicament insuman rapid 100ui sol dans la veine a la maison?,"[""Insuman Rapid est une solution destinée à être injectée sous la peau ou, dans des circonstances exceptionnelles, dans une veine (vaisseau sanguin).\n\nVotre médecin vous montrera dans quelle zone cutanée vous devez injecter votre insuline. A chaque injection d'insuline, vous devez changer de point de piqûre au sein d'une zone cutanée donnée.\n\nL'administration d'insuline dans la veine par exemple pour traiter une hyperglycémie sévère et une acidocétose, exige de l'expérience et des précautions rigoureuses. Pour ces raisons, cela doit être fait en milieu hospitalier ou dans une structure spécialisée similaire.\n\nN'utilisez jamais Insuman Rapid dans des pompes à insuline - des préparations d'insuline spéciales sont disponibles pour de tels dispositifs. Ne l'utilisez pas non plus dans des pompes péristaltiques équipées de sondes en silicone."", ""Insuman Rapid contient 100 UI d'insuline par ml. Seules les seringues d'injection conçues pour cette concentration d'insuline (100 UI/ml) doivent être utilisées. Les seringues d'injection ne doivent contenir aucun autre médicament ni trace de médicament (telles que des traces d'héparine).\n\nAvant le premier prélèvement d'insuline, vous devez retirer l'opercule de sécurité détachable.\n\nInsuman Rapid ne doit être utilisé que si la solution est claire, incolore, sans particules solides visibles, et qu'elle a la consistance de l'eau.\n\nNe pas agiter vigoureusement le flacon car cela pourrait entraîner la formation de mousse. La mousse peut alors gêner la mesure correcte de la dose."", ""Insuman Rapid est une solution injectable claire, incolore, sans particules solides visibles et qui a la consistance de l'eau.\n\nInsuman Rapid est fourni en flacon contenant 5 ml de solution injectable (équivalent à 500 UI) ou 10 ml de solution injectable (équivalent à 1000 UI). Des boîtes de 1 et 5 flacons de 5 ml ou 10 ml sont disponibles. Toutes les présentations peuvent ne pas être commercialisées."", ""- - la substance active est l'insuline humaine. Un ml d'Insuman Rapid contient 100 UI (Unités\n\nInsuman Rapid    © Pharma.be\n\nInternationales) de la substance active insuline humaine.\n\n- - Les autres composants sont : métacrésol, phosphate monosodique dihydraté, glycérol, hydroxyde de sodium (voir rubrique 2 « Informations importantes concernant certains composants d'Insuman Rapid »), acide chlorhydrique (pour ajustement du pH) et eau pour préparations injectables."", ""Avant l'injection, ôtez toute bulle d'air. Veillez à ce que l'insuline ne soit contaminée ni par de l'alcool, ni par d'autres désinfectants, ni par toute autre substance. Ne mélangez l'insuline avec aucun autre médicament sauf avec des préparations d'insuline humaine comme détaillé ci-dessous.\n\nInsuman Rapid peut être mélangé avec toutes les préparations d'insuline humaine SAUF celles particulièrement conçues pour les pompes à insuline. De même, il ne doit PAS être mélangé avec des insulines d'origine animale ou des analogues de l'insuline.\n\nVotre médecin vous précisera si vous aurez à mélanger les préparations d'insuline humaine. Si vous\n\nInsuman Rapid    © Pharma.be\n\ndevez vous injecter un mélange, prélevez d'abord Insuman Rapid dans la seringue avant l'autre insuline. Injectez immédiatement après avoir procédé au mélange. Ne pas mélanger des insulines de concentration différente (par exemple 100 UI/ml et 40 UI/ml)."", ""La substance active contenue dans Insuman Rapid est l'insuline humaine, qui est produite par biotechnologie et est identique à l'insuline de l'organisme\n\nInsuman Rapid est une solution d'insuline dont l'action débute rapidement et est de courte durée.\n\nInsuman Rapid est utilisé pour diminuer le taux élevé de sucre dans le sang de patients qui souffrent de diabète sucré et ont besoin d'un traitement par insuline. Dans cette maladie, l'organisme ne produit pas assez d'insuline pour contrôler le taux de sucre dans le sang (glycémie). Insuman Rapid peut aussi être utilisé pour traiter le coma hyperglycémique (coma causé par un taux de sucre dans le sang trop élevé) et l'acidocétose (accumulation d'acide dans le sang car l'organisme utilise les graisses au lieu du sucre) aussi bien que pour équilibrer la glycémie avant, pendant et après une opération chirurgicale.""]","L'injection de Insuman Rapid dans une veine doit être réalisée par des professionnels expérimentés dans un environnement médical approprié, comme un hôpital ou une structure spécialisée.","Non, l'administration d'insuline dans la veine exige de l'expérience et des précautions rigoureuses. Pour ces raisons, cela doit être fait en milieu hospitalier ou dans une structure spécialisée similaire, et non à domicile.",1.0,0.5340909980034607,0.9999999999,1.0,0.7173725447726845,0.6194901790907386,Q21
"C est quoi la thrombose associée avec Cerazette 0,75 mg comprimé ?","[""- -Si vous êtes allergique au désogestrel ou à l'un des autres composants de Cerazette (mentionnés dans la rubrique 6)\n- -Si vous souffrez de thrombose. Une thrombose est la formation d'un caillot de sang dans un vaisseau sanguin [par exemple au niveau d'une jambe (thrombose veineuse profonde) ou des poumons (embolie pulmonaire)].\n- -Si vous avez ou avez eu la jaunisse Gaunissement de la peau) ou une maladie grave du foie et que votre fonction hépatique n'est toujours pas normale.\n- -Si vous avez ou suspecté d'avoir un cancer sensible aux hormones sexuelles, comme certains types de cancers du sein.\n- Si vous présentez des saignements vaginaux inexpliqués.\n\nAvertissez votre médecin avant de commencer à prendre Cerazette si l'une de ces situations s'applique à vous. Votre médecin vous conseillera alors peut-être une méthode contraceptive non hormonale.\n\nConsultez immédiatement votre médecin si l'une de ces situations apparaît pour la première fois alors que vous utilisez Cerazette."", ""Contactez immédiatement votre médecin si vous constatez subitement des symptômes susceptibles d'indiquer une thrombose (voir également « Contrôles réguliers »).\n\nUne thrombose est la formation d'un caillot de sang susceptible d'obstruer un vaisseau sanguin. Une thrombose survient parfois au niveau d'une veine profonde de la jambe (thrombose veineuse profonde). Si le caillot se détache, il peut parvenir dans les artères des poumons et provoquer à cet endroit l'obstruction d'un vaisseau sanguin (embolie pulmonaire). Cela peut dans certains cas avoir une issue fatale. La thrombose veineuse profonde est rare.\n\nElle peut survenir tant chez les utilisatrices de la pilule que chez les non-utilisatrices. Elle peut également survenir durant une grossesse. Le risque de thrombose est plus élevé chez les utilisatrices de la pilule que chez les non-utilisatrices. Le risque associé aux pilules contenant uniquement un progestatif, comme Cerazette, serait plus faible que chez les utilisatrices d'une pilule combinée contenant également des œstrogènes."", 'Comme tous les médicaments, ce médicament peut provoquer des effets indésirables, mais ils ne surviennent pas systématiquement chez tout le monde.\n\nLes effets indésirables sérieux associés à l\'utilisation de Cerazette sont décrits dans les paragraphes ""Cancer du sein"" et ""Thrombose"" dans la rubrique 2 ""Dans quel cas, vous ne pouvez pas prendre ce médicament ou les cas où vous devriez être extrêmement prudent"". Pour plus d\'informations veuillez lire cette rubrique et, si nécessaire, consultez immédiatement votre médecin.\n\nIl est possible que vous présentiez au cours de l\'utilisation de Cerazette de légers saignements vaginaux à intervalles irréguliers. Ceux-ci peuvent se limiter à quelques gouttes ou être des pertes de sang plus importantes, ressemblant à un léger saignement menstruel et nécessitant l\'utilisation d\'une protee ion. Il est également possible que les saignements demeurent totalement absents. Des saignements irréguliers ne sont pas une indication d\'une moins bonne protection contre une grossesse. En général, vous ne devez rien faire de spécial et pouvez continuer à prendre normalement Cerazette. Cependant, si la perte de sang est importante ou persiste longtemps, vous devez consulter votre médecin.\n\nN\'utilisez pas ce médicament après la date de péremption indiquée sur l\'emballage après « EXP ». La date de péremption fait référence au dernier jour du mois.\n\nIl n\'y a pas de conditions particulières de conservation pour ce médicament. Conserver la plaquette thermoformée dans le sachet d\'origine à l\'abri de la lumière et de l\'humidité. Durée de conservation après ouverture du sachet: 1 mois.\n\nNe jetez aucun médicament au out à l\'égout ni avec les ordures ménagères. Demandez à votre pharmacien d\'éliminer les médicaments que vous n\'utilisez plus. Ces mesures contribueront à protéger l\'environnement.', ""- -Si vous êtes allergique au désogestrel ou à l'un des autres composants de Cerazette (mentionnés dans la rubrique 6)\n- -Si vous souffrez de thrombose. Une thrombose est la formation d'un caillot de sang dans un vaisseau sanguin [par exemple au niveau d'une jambe (thrombose veineuse profonde) ou des poumons (embolie pulmonaire)].\n- -Si vous avez ou avez eu la jaunisse (jaunissement de la peau) ou une maladie grave du foie et que votre fonction hépatique n'est toujours pas normale.\n- -Si vous avez ou suspecté d'avoir un cancer sensible aux hormones sexuelles, comme certains types de cancers du sein.\n- -Si vous présentez des saignements vaginaux inexpliqués.\n\nAvertissez votre médecin avant de commencer à prendre Cerazette si l'une de ces situations s'applique à vous. Vot're médecin vous conseillera alors peut-être une méthode contraceptive non hormonale.\n\nConsultez immédiatement votre médecin si l'une de ces situations apparaît pour la première fois alors que vous utilisez Cerazette."", ""- 1. Qu'est-ce que Cerazette et dans quel cas est-il utilisé\n- 2. Dans quel cas, vous ne pouvez pas prendre ce médicament ou les cas où vous devriez être extrêmement prudent\n- 3. Comment prendre Cerazette\n- 4. Effets indésirables éventuels\n- 5. Comment conserver Cerazette\n- 6. Contenu de l'emballage et Autres informations"", ""La plaquette de Cerazette contient 28 comprimés. Sur la face avant de la plaquette, entre les comprimés, il y a de petites flèches. Sur la pellicule située à l'arrière de la plaquette sont indiqués les jours de la semaine. A chaque jour correspond un comprimé.\n\nCommencez chaque nouvelle plaquette en prenant un comprimé de la rangée supérieure. Veillez à prendre le bon comprimé. Par exemple, si vous commencez un mercredi, prenez le comprimé de la rangée supérieure pour lequel est indiqué (à l'arrière) MER. Suivez le sens des flèches et prenez chaque jour un comprimé jusqu'à ce que la plaquette soit vide. En examinant l'arrière de la plaquette, vous pouvez aisément contrôler si vous avez déjà pris votre comprimé quotidien. ------\n\nPrenez les comprimés chaque jour à peu près à la même heure, en les avalant avec un peu d'eau et sans les mâcher. Pendant l'utilisation de Cerazette, il est possible que vous ayez des saignements mais vous devez continuer à prendre vos comprimés comme d'habitude. Lorsqu'une plaquette est vide, entamez immédiatement une nouvelle plaquette de Cerazette le lendemain, donc sans interruption et sans attendre de saignements.""]","La thrombose associée à Cerazette est la formation d'un caillot de sang qui peut obstruer un vaisseau sanguin, souvent au niveau d'une veine profonde de la jambe (thrombose veineuse profonde) ou des poumons (embolie pulmonaire). Le risque de thrombose est plus élevé chez les utilisatrices de pilules contraceptives, mais il est plus faible avec Cerazette, qui contient uniquement un progestatif, comparé aux pilules combinées contenant des œstrogènes."," Une thrombose est la formation d'un caillot de sang susceptible d'obstruer un vaisseau sanguin, souvent dans une veine profonde de la jambe (thrombose veineuse profonde) ou dans les poumons (embolie pulmonaire) Le risque de thrombose est plus élevé chez les utilisatrices de pilules contraceptives, mais il est plus faible avec Cerazette, qui contient uniquement un progestatif, comparé aux pilules combinées contenant des œstrogènes.",0.8181818181818182,0.7658940384795908,0.9166666666361111,1.0,0.9496046179268189,0.9412756145644192,Q22
 ce que Risperdal Consta LP 25mg est un medicament psychotrope?,"['RISPERDALCONSTA L.P. 25 mg/2 ml, poudre et solvant pour suspension injectable à libération prolongée en seringue préremplie appartient à un groupe de médicaments appelés « antipsychotiques ».', ""1. QU'EST-CE QUE RISPERDALCONSTA L.P. 25 mg/2 ml, poudre et solvant pour suspension injectable à libération prolongée en seringue préremplie ET DANS QUELS CAS EST-IL UTILISE ?"", ""RISPERDALCONSTA L.P. 25 mg/2 ml, poudre et solvant pour suspension injectable à libération prolongée en seringue préremplie est utilisé dans le traitement d'entretien de la schizophrénie, au cours de laquelle vous pouvez voir, entendre ou ressentir des choses qui ne sont pas là, avoir des croyances erronées, ou ressentir une suspicion inhabituelle, ou vous sentir confus.\n\nRISPERDALCONSTA L.P. 25 mg/2 ml, poudre et solvant pour suspension injectable à libération prolongée en seringue préremplie est destiné aux patients qui sont actuellement traités par des antipsychotiques oraux (par exemple, comprimés, gélules).\n\nRISPERDALCONSTA L.P. 25 mg/2 ml, poudre et solvant pour suspension injectable à libération prolongée en seringue préremplie peut aider à atténuer les symptômes de votre maladie et empêcher vos symptômes de réapparaître."", 'Ce que contient RISPERDALCONSTA L.P. 25 mg/2 ml, poudre et solvant pour suspension injectable à libération prolongée en seringue préremplie\n\n- · La substance active est :\n\nRispéridone............................................................................................................................ 25 mg\n\nPour un flacon.\n\n- · Les autres composants sont :', '3. COMMENT UTILISER RISPERDALCONSTA L.P. 25 mg/2 ml, poudre et solvant pour suspension injectable à libération prolongée en seringue préremplie ?', ""RISPERDALCONSTA L.P. 25 mg/2 ml, poudre et solvant pour suspension injectable à libération prolongée en seringue préremplie ne doit pas être utilisé chez les personnes âgées démentes.\n\nUn traitement médical doit être immédiatement mis en place si vous ou la personne qui s'occupe de vous constatez une modification soudaine de votre état mental ou une soudaine faiblesse ou insensibilité au niveau du visage, des bras ou des jambes, en particulier d'un seul côté, ou une élocution confuse, même pendant une période de temps courte. Ceci peut être le signe d'un accident vasculaire cérébral.""]","RISPERDALCONSTA L.P. 25 mg/2 ml, poudre et solvant pour suspension injectable à libération prolongée en seringue préremplie est un médicament antipsychotique, ce qui implique qu'il est utilisé pour traiter des troubles psychotiques.","Oui, Risperdal Consta LP 25mg est un medicament psychotrope ",1.0,0.6955157658309211,0.8055555555287036,1.0,0.47349463077554754,0.6939785231021901,Q23
Est-ce que je peux utiliser voltarene emulgel 0.01 pour traiter l'eczema?,"['Comment prendre Voltarene Emulgel 1 %, gel', 'Prendre des précautions particulières avec Voltarene Emulgel 1%, gel:', ""Ne pas utiliser Voltarene Emulgel 1 %, gel dans les cas suivants:\n\n- - à partir de la 2Sème semaine d'aménorrhée (début du 6ème mois de grossesse) ;\n- -en cas d'allergie à ce médicament ou à un médicament apparenté, notamment autres anti-inflammatoires non stéroïdiens, aspirine;\n- - en cas d'allergie à l'un des excipients;\n- -sur peau lésée, quelque soit la lésion: lésions suintantes, eczéma, lésion infectee. brûlure ou plaie.\n\nEn cas de doute il est indispensable de demander l'avis de votre médecin ou de votre pharmacien"", 'Voltarene"" Emulgel"" 1 %, gel', ""Comme tous les médxarneots. Voltarene Emulgel l 'Ib, gel, est susceptible d'avoir des effets indésirables.\n\nExceptionnellement peuvent survenir des réactions pouvant être sévères:\n\n- -réactions allergiques cutanées: éruption (boutons), urticaire, bulles,\n- -problèmes respiratoires de type crise cfasthme (souffle bruyant et court, impression de capacité respiratoire diminuée),\n- -manifestations générales de type anaphylaxie (gonflement de la face, des lèvres, de la langue, de la gorge). .\n- Il faut immédiatement interrompre le t@itement et avertir votre médecin ou votre pharmacien\n\nPlus fréquemment, peuvent survenir des effets indésirables, généralement légers et passagers:\n\n- o des effets locaux cutanés de type rougeur, démangeaisons, irritation cutanée, érosion ou ulcérations locales ;\n- o très exceptionnellement, une augmentation de la sensibilité au Soleil,\n- o d'autres effets généraux des anti-inflammatoires non stéroïdiens, fonction de 1a quantité de gel appliquée, de ta surface traitée et de son état, de la durée du traitemen et de Putilisation ou non d'un pansement fermé.\n- fi faut en avertir votre médecin ou votre pharmacien\n- Si vous remarquez des effets indésirables non mentionnés dans cette notice, veutllez en informer votre médecin ou pharmacien."", 'La substance active est:\n\nDidofénac de diéthylamine\n\n.........................•..........•.........\n\nQuantité correspondant à didofenac diethylamine\n\n.......•.........•.•\n\nPour l00g']","Voltarene Emulgel 1 %, gel ne doit pas être utilisé sur des zones de peau affectées par l'eczéma.", Voltarene Emulgel gel ne doit pas être utilisé sur des zones de peau affectes par des lésions comme l'eczéma,1.0,0.6099565535494528,0.5888888888692593,1.0,0.7094758129549541,0.8379032518198166,Q24
quels sont les médicaments qui peuvent affecter l'activité d'IRESSA 250mg comp pelli  ?,"['IRESSA 250 mg, comprimés pelliculés', ""Informez votre médecin ou votre pharmacien si vous prenez, avez récemment pris, ou pourriez prendre tout autre médicament.\n\nVotre médecin ou votre pharmacien doit en particulier savoir si vous prenez un des médicaments suivants :\n\n- -Phénytoïne ou carbamazépine (pour l'épilepsie).\n- -Rifampicine (pour la tuberculose).\n- -Itraconazole (pour des affections fongiques).\n- -Barbituriques (médicament utilisé pour des problèmes de sommeil).\n- -Des remèdes à base de plantes contenant du Millepertuis ( Hypericum perforatum , pour la dépression et l'anxiété).\n- -Inhibiteurs de la pompe à protons, antagonistes des récepteurs H2 et anti-acides (pour les ulcères, les indigestions, les brûlures d'estomac et pour diminuer l'acidité de l'estomac).\n\nCes médicaments peuvent affecter l'activité d'IRESSA.\n\n- -Warfarine (un anticoagulant oral destiné à prévenir la formation de caillots sanguins). Si vous prenez un médicament contenant cette substance active, il se peut que votre médecin vous demande de faire plus souvent un examen sanguin.\n\nSi l'une des situations ci-dessus vous concerne, ou si vous avez un doute, vérifiez avec votre médecin ou votre pharmacien avant de prendre IRESSA."", ""Veillez à toujours prendre ce médicament en suivant exactement les indications de votre médecin. Vérifiez auprès de votre médecin ou pharmacien en cas de doute.\n\n- \uf0b7 La dose recommandée est de un comprimé à 250 mg par jour.\n- \uf0b7 Prenez le comprimé chaque jour à peu près au même moment.\n- \uf0b7 Vous pouvez prendre le comprimé avec ou sans aliments.\n- \uf0b7 Ne prenez pas d'anti-acides (pour diminuer le taux d'acidité de votre estomac) 2 heures avant ou dans l'heure qui suit la prise d'IRESSA.\n\nSi vous avez des difficultés à avaler le comprimé, il peut être dissout dans un demi verre d'eau plate (non pétillante). Aucune autre boisson ne doit être utilisée. N'écrasez pas le comprimé. Remuez jusqu'à dissolution du comprimé. Cela peut prendre jusqu'à 20 minutes. Buvez le liquide en une fois. Pour être sûr que vous avez bu tout le médicament, rincez correctement le verre avec un demi-verre d'eau et buvez-le."", ""- \uf0b7 Bouche sèche\n- \uf0b7 Sécheresse oculaire, yeux rouges ou avec démangeaison\n\n- \uf0b7 Paupières rouges et douloureuses\n- \uf0b7 Problèmes au niveau des ongles\n- \uf0b7 Perte de cheveux\n- \uf0b7 Fièvre\n- \uf0b7 Saignement (tel que saignement du nez ou sang dans vos urines)\n- \uf0b7 Protéines dans vos urines (révélées par un test urinaire)\n- \uf0b7 Augmentation de la bilirubine ou d'une autre enzyme hépatique appelée aspartate aminotransférase lors d'un bilan sanguin ; si les taux sont trop élevés, votre médecin peut être amené à arrêter IRESSA.\n- \uf0b7 Augmentation du taux de créatinine lors d'un bilan sanguin (en relation avec la fonction rénale)\n- \uf0b7 Cystite (sensation de brûlure lors des mictions et besoin fréquent et urgent d'uriner)"", ""IRESSA se présente sous la forme d'un comprimé brun et rond, gravé « IRESSA 250 » sur une face et lisse sur l'autre.\n\nIRESSA est présenté en étui de 30 comprimés. La plaquette peut être pré-découpée ou non pré-découpée."", ""- \uf0b7 Réactions allergiques (fréquentes), en particulier si les symptômes incluent un gonflement du visage, des lèvres, de la langue ou de la gorge, des difficultés pour avaler, de l'urticaire et des difficultés pour respirer.\n- \uf0b7 Essoufflement important ou aggravation soudaine d'un essoufflement, éventuellement avec toux ou fièvre. Cela peut signifier que vous avez une inflammation des poumons, appelée « affection pulmonaire interstitielle ».  Cela peut  concerner  environ  1  patient  sur 100  prenant  IRESSA  et peut mettre en danger votre vie.\n- \uf0b7 Réactions cutanées sévères (rares) s'étendant sur des surfaces importantes de votre corps. Les signes peuvent comprendre rougeur, douleur, ulcérations, cloques et décollement de la peau. Les lèvres, le nez, les yeux et les parties génitales peuvent aussi être atteints.\n- \uf0b7 Déshydratation (fréquente)  suite  à  une  diarrhée  sévère  ou  persistante,  des  vomissements,  des nausées (envie de vomir) ou une perte d'appétit.\n- \uf0b7 Troubles oculaires (peu fréquents), tels que douleur, rougeur, yeux larmoyants, sensibilité à la lumière, troubles de la vision ou pousse de cils incarnés. Ceci peut signifier que vous avez une ulcération de la surface de l'œil (cornée).\n\nSi  vous  constatez  l'un  des  effets  indésirables  suivants,  informez-en  votre  médecin  dès  que possible :""]","Les médicaments suivants peuvent affecter l'activité d'IRESSA : Phénytoïne, carbamazépine, rifampicine, itraconazole, barbituriques, remèdes à base de plantes contenant du Millepertuis, inhibiteurs de la pompe à protons, antagonistes des récepteurs H2 et anti-acides.","Les médicaments qui peuvent affecter l'activité d'IRESSA sont : la phénytoïne, la carbamazépine, la rifampicine, l'itraconazole, les barbituriques, les remèdes à base de plantes contenant du Millepertuis, les inhibiteurs de la pompe à protons, les antagonistes des récepteurs H2 et les anti-acides.",1.0,0.739715279897814,0.49999999995,1.0,0.9941956842795093,0.9767827371180374,Q25
Le medicament eprex 40000ui ml est utiliser pour traiter quelles maladies ?,"['EPREX 40000 UI/mL, solution injectable en seringue préremplie Epoétine alfa', ""- 1. Qu'est-ce que EPREX et dans quels cas est-il utilisé ?\n- 2. Quelles sont les informations à connaître avant d'utiliser EPREX ?\n- 3. Comment utiliser EPREX ?\n- 4. Quels sont les effets indésirables éventuels ?\n- 5. Comment conserver EPREX ?\n- 6. Contenu de l'emballage et autres informations."", ""Ils peuvent survenir chez plus de 1 personne sur 10 traitées par EPREX.\n\n- · Diarrhées.\n- · Malaise gastrique.\n- · Vomissements.\n- · Fièvre.\n- · Congestion des voies respiratoires, tel que nez bouché ou mal de gorge, a été rapportée chez des patients souffrant d'une maladie rénale et non encore dialysés."", ""- o chez les enfants en hémodialyse,\n- o chez les adultes en hémodialyse ou dialyse péritonéale,\n- o chez les adultes non encore dialysés ayant une anémie sévère.\n\nSi vous souffrez d'une maladie rénale, vous pouvez présenter un manque de globules rouges si votre rein ne produit pas suffisamment d'érythropoïétine (qui est nécessaire à la production des globules rouges). EPREX vous est prescrit pour stimuler votre moelle osseuse afin de produire plus de globules rouges.\n\n- · EPREX est utilisé dans le traitement de l'anémie chez les adultes recevant une chimiothérapie pour des tumeurs solides, un lymphome malin ou un myélome multiple (cancer de la moelle osseuse) et pouvant avoir besoin d'une transfusion de sang. EPREX peut réduire le besoin de transfusion sanguine chez ces patients.\n- · EPREX  est  utilisé  chez  les  adultes  modérément  anémiques  qui  donnent  leur  sang  avant  une intervention chirurgicale, afin que celui-ci puisse leur être réinjecté pendant ou après l'intervention. EPREX stimulant la production de globules rouges, les médecins peuvent prélever plus de sang chez ces patients.\n\nEPREX est utilisé chez les adultes modérément anémiques devant avoir une intervention chirurgicale orthopédique majeure (par exemple en cas de chirurgie pour prothèse de hanche ou de genou), afin de diminuer le besoin éventuel de transfusions sanguines.\n\n- · EPREX  est  utilisé  pour  traiter  l'anémie  chez  les  adultes  atteint  de  syndromes  myélodysplasiques. EPREX peut réduire le besoin de réaliser des transfusions sanguines."", ""2. QUELLES SONT LES INFORMATIONS A CONNAITRE AVANT D'UTILISER EPREX ?"", ""Classe pharmacothérapeutique : autres ANTI-ANEMIQUES/ERYTHROPOIETINE - code ATC : B03XA01.\n\nEPREX contient la substance active époétine alfa : une protéine qui stimule la moelle osseuse pour produire plus de globules rouges qui contiennent l'hémoglobine (une substance qui transporte l'oxygène). L'époétine alfa est une copie de la protéine humaine érythropoïétine (e-rith-ro-po-yeh-tine) et elle agit de la même façon.""]","EPREX 40000 UI/mL est utilisé pour traiter l'anémie chez les patients recevant une chimiothérapie pour des tumeurs solides, un lymphome malin ou un myélome multiple, chez les adultes modérément anémiques avant une intervention chirurgicale, et chez les adultes atteints de syndromes myélodysplasiques.","EPREX est utilisé pour traiter l'anémie symptomatique due à des maladies du rein (chez les enfants en hémodialyse, adultes en hémodialyse ou dialyse péritonéale, et adultes non encore dialysés avec anémie sévère). Il est aussi utilisé dans le traitement de l'anémie chez les adultes sous chimiothérapie pour des tumeurs solides, lymphome malin ou myélome multiple, chez les adultes modérément anémiques donnant leur sang avant une chirurgie, et chez les adultes devant avoir une intervention chirurgicale orthopédique majeure pour diminuer le besoin de transfusions sanguines. Enfin, EPREX est utilisé pour traiter l'anémie chez les adultes atteints de syndromes myélodysplasiques.",1.0,0.7183724172644367,0.249999999975,1.0,0.6334923290949727,0.8196836020941765,Q26
 quels sont les hormones peuvent etre affecter par le medicament Risperdal Consta LP 25mg ?,"[""- · Si vous êtes enceinte ou que vous allaitez, si vous pensez être enceinte ou planifiez une grossesse, demandez conseil à votre médecin ou pharmacien avant d'utiliser ce médicament. Votre médecin décidera si vous pouvez l'utiliser.\n- · Les symptômes suivants peuvent apparaître chez les nouveau-nés dont les mères ont utilisé RISPERDALCONSTA L.P. 25 mg/2 ml, poudre et solvant pour suspension injectable à libération prolongée en seringue préremplie durant le dernier trimestre (les trois derniers mois de leur grossesse) : tremblement, raideur et/ou faiblesse musculaire, endormissement, agitation, problème de respiration et difficultés à s'alimenter. Si votre bébé développe l'un de ces symptômes, vous devez contacter votre médecin.\n- · RISPERDALCONSTA L.P. 25 mg/2 ml, poudre et solvant pour suspension injectable à libération prolongée en seringue préremplie peut augmenter votre taux d'une hormone appelée «prolactine» qui peut avoir un impact sur la fertilité (voir QUELS SONT LES EFFETS INDESIRABLES EVENTUELS ?)."", ""1. QU'EST-CE QUE RISPERDALCONSTA L.P. 25 mg/2 ml, poudre et solvant pour suspension injectable à libération prolongée en seringue préremplie ET DANS QUELS CAS EST-IL UTILISE ?"", ""Bien que la rispéridone par voie orale ait été étudiée, RISPERDALCONSTA L.P. 25 mg/2 ml, poudre et solvant pour suspension injectable à libération prolongée en seringue préremplie n'a pas été étudié chez les patients avec des problèmes de reins ou de foie. RISPERDALCONSTA L.P. 25 mg/2 ml, poudre et solvant pour suspension injectable à libération prolongée en seringue préremplie doit être administré avec précaution dans ce groupe de patients."", ""2. QUELLES SONT LES INFORMATIONS A CONNAITRE AVANT D'UTILISER RISPERDALCONSTA L.P. 25 mg/2 ml, poudre et solvant pour suspension injectable à libération prolongée en seringue préremplie ?"", '3. COMMENT UTILISER RISPERDALCONSTA L.P. 25 mg/2 ml, poudre et solvant pour suspension injectable à libération prolongée en seringue préremplie ?', ""Des sensations de vertige, une fatigue et des problèmes de vision peuvent survenir au cours du traitement par RISPERDALCONSTA L.P. 25 mg/2 ml, poudre et solvant pour suspension injectable à libération prolongée en seringue préremplie. Vous ne devez pas conduire ou utiliser des machines avant d'en avoir parlé avec votre médecin.""]","RISPERDALCONSTA L.P. 25 mg/2 ml, poudre et solvant pour suspension injectable à libération prolongée en seringue préremplie peut affecter le taux de l'hormone prolactine.",Risperdal Consta peut augmenter les taux du hormone prolactine.,1.0,0.7356514213195858,0.9999999999,1.0,0.6592764801110289,0.6371059204441156,Q27
"Est-ce que je peux utiliser BRONCHOCALM enfants 0,1 sirop pour un nouveau-né ?","[""Ce médicament est contre-indiqué en association avec certains médicaments utilisés dans la dépression (IMAO).\n\nBRONCHOCALM Enfants contient un antitussif, le dextrométhorphane. D'autres médicaments en contiennent ou contiennent un autre antitussif. Ne les associez pas, afin de ne pas dépasser les doses maximales conseillées (voir posologie et mode d'administration).\n\nAFIN D'EVITER D'EVENTUELLES INTERACTIONS ENTRE PLUSIEURS MEDICAMENTS, notamment avec l'alcool, IL FAUT SIGNALER SYSTEMATIQUEMENT TOUT AUTRE TRAITEMENT EN COURS A VOTRE MEDECIN OU A VOTRE PHARMACIEN."", ""RESERVE A L'ENFANT DE PLUS DE 20 kg (soit environ 6 ans) En l'absence d'efficacité, n'augmentez pas les doses au-delà de ce qui est prèconisé, ne prenez pas conjointement un autre antitussif, mais consultez votre médecin.\n\nLa posologie est fonction du poids de votre enfant, soit à titre indicatif:\n\n- - enfant de moins de 8 ans: conformez-vous à l'avis de votre médecin.\n- - enfant de 25 à 30 k environ 8 à 10 ans: 1cuillère-mesure par pnse, renouve er en cas e esom au bout de 4 heures, sans dépasser 4 cuillères-mesure par jour.\n- - enfants de 30 à 40 k environ 10 à 12 ans: 1 cuillère-mesure par pnse, renouve er en cas e esom au out de 4 heures, sans dépasser 6 cuillères-mesure par jour.\n- -enfant de 40 à 50 k~ (environ 12 à 15 ans): 2 cuillères-mesure par prise, à renouve er en cas de beSOinau bout de 4 heures, sans dépasser 8 cuillères-mesure par jour.\n\nEn cas d'insuffisance hépatique, consultez votre médecin afin d'adapter la posologie.\n\n- CE MEDICAMENT VOUS A ETE PERSONNELLEMENT DELIVRE DANS UNE SITUATION PRECISE:\n- -IL PEUT NE PAS ETRE ADAPTE A UN AUTRE CAS.\n- -NE PAS LE CONSEILLER A UNE AUTRE PERSONNE."", ""Ce médicament est préconisé pour calmer les toux sèches et les toux d'inritation chez l'enfant de plus de 20 kg (soit environ 6 ans)."", 'Bromhydrate de dextrométhorphane 0.1 POURCENT', 'Sirop. Flacon de 125 ml.', ""En cas de grossesse ou d'allaitement, l'usage de ce médicament est déconseillé.\n\nD'une façon générale, il convient, au cours de la grossesse ou de l'allaitement de toujours demander l'avis de votre médecin ou de votre pharmacien avant de prendre un médicament.""]","BRONCHOCALM Enfants est réservé aux enfants de plus de 20 kg, soit environ 6 ans.","Non, ce médicament ne peut pas etre utiliser pour un nouveau-ne.",1.0,0.6013850379278155,0.5833333333041666,1.0,0.05990935004650272,0.23963740018601087,Q28
"Quels sont les médicaments à ne pas associer avec BRONCHOCALM enfants 0,1 sirop ?","[""Ce médicament est contre-indiqué en association avec certains médicaments utilisés dans la dépression (IMAO).\n\nBRONCHOCALM Enfants contient un antitussif, le dextrométhorphane. D'autres médicaments en contiennent ou contiennent un autre antitussif. Ne les associez pas, afin de ne pas dépasser les doses maximales conseillées (voir posologie et mode d'administration).\n\nAFIN D'EVITER D'EVENTUELLES INTERACTIONS ENTRE PLUSIEURS MEDICAMENTS, notamment avec l'alcool, IL FAUT SIGNALER SYSTEMATIQUEMENT TOUT AUTRE TRAITEMENT EN COURS A VOTRE MEDECIN OU A VOTRE PHARMACIEN."", ""- Ce médicament NE DOIT PAS ETRE UTILISE dans les cas suivants:\n- -en cas d'allergie à l'un des constituants,\n- -en cas de toux chez l'asthmatique,\n- -en cas d'insuffisance respiratoire,\n- -en association avec certains médicaments utilisés dans la dépression (IMAO).\n\nCe mèdicament NE DOIT GENERALEMENT PAS ETRE UTILISE en association avec l'alcool.\n\nEN CAS DE DOUTE, IL EST INDISPENSABLE DE DEMANDER L'AVIS DE VOTRE MEDECIN OU DE VOTRE PHARMACIEN."", ""RESERVE A L'ENFANT DE PLUS DE 20 kg (soit environ 6 ans) En l'absence d'efficacité, n'augmentez pas les doses au-delà de ce qui est prèconisé, ne prenez pas conjointement un autre antitussif, mais consultez votre médecin.\n\nLa posologie est fonction du poids de votre enfant, soit à titre indicatif:\n\n- - enfant de moins de 8 ans: conformez-vous à l'avis de votre médecin.\n- - enfant de 25 à 30 k environ 8 à 10 ans: 1cuillère-mesure par pnse, renouve er en cas e esom au bout de 4 heures, sans dépasser 4 cuillères-mesure par jour.\n- - enfants de 30 à 40 k environ 10 à 12 ans: 1 cuillère-mesure par pnse, renouve er en cas e esom au out de 4 heures, sans dépasser 6 cuillères-mesure par jour.\n- -enfant de 40 à 50 k~ (environ 12 à 15 ans): 2 cuillères-mesure par prise, à renouve er en cas de beSOinau bout de 4 heures, sans dépasser 8 cuillères-mesure par jour.\n\nEn cas d'insuffisance hépatique, consultez votre médecin afin d'adapter la posologie.\n\n- CE MEDICAMENT VOUS A ETE PERSONNELLEMENT DELIVRE DANS UNE SITUATION PRECISE:\n- -IL PEUT NE PAS ETRE ADAPTE A UN AUTRE CAS.\n- -NE PAS LE CONSEILLER A UNE AUTRE PERSONNE."", ""Ce médicament est préconisé pour calmer les toux sèches et les toux d'inritation chez l'enfant de plus de 20 kg (soit environ 6 ans)."", ""PREVENEZ VOTRE MEDECIN, en cas de maladie au long cours du foie.\n\nLa prise de boissons alcoolisées durant ce traitement est déconseillée.\n\nIl conviendra de ne pas associer un médicament fluidifiant des sécrétions bronchiques (expectorant, mucolytique).\n\nEn cas de diabète ou de régime hypoglucidique (pauvre en sucre), tenir compte de la teneur en saccharose (2,9 g par cuillère-mesure ).\n\nEN CAS DE DOUTE NE PAS HESITER A DEMANDER L'AVIS DE VOTRE MEDECIN OU DE VOTRE PHARMACIEN."", 'Bromhydrate de dextrométhorphane 0.1 POURCENT']","BRONCHOCALM Enfants ne doit pas être associé avec certains médicaments utilisés dans la dépression, notamment les IMAO.",Il ne faut pas associer ce médicament avec les IMAO (antidépresseurs) ni avec d autres antitussifs.,1.0,0.8092488192468409,0.99999999995,1.0,0.536356397888536,0.6454255915541436,Q29
Quelle est la dose recommandée de BRONCHOCALM enfants sirop pour un enfant de 45 kg ?,"[""RESERVE A L'ENFANT DE PLUS DE 20 kg (soit environ 6 ans) En l'absence d'efficacité, n'augmentez pas les doses au-delà de ce qui est prèconisé, ne prenez pas conjointement un autre antitussif, mais consultez votre médecin.\n\nLa posologie est fonction du poids de votre enfant, soit à titre indicatif:\n\n- - enfant de moins de 8 ans: conformez-vous à l'avis de votre médecin.\n- - enfant de 25 à 30 k environ 8 à 10 ans: 1cuillère-mesure par pnse, renouve er en cas e esom au bout de 4 heures, sans dépasser 4 cuillères-mesure par jour.\n- - enfants de 30 à 40 k environ 10 à 12 ans: 1 cuillère-mesure par pnse, renouve er en cas e esom au out de 4 heures, sans dépasser 6 cuillères-mesure par jour.\n- -enfant de 40 à 50 k~ (environ 12 à 15 ans): 2 cuillères-mesure par prise, à renouve er en cas de beSOinau bout de 4 heures, sans dépasser 8 cuillères-mesure par jour.\n\nEn cas d'insuffisance hépatique, consultez votre médecin afin d'adapter la posologie.\n\n- CE MEDICAMENT VOUS A ETE PERSONNELLEMENT DELIVRE DANS UNE SITUATION PRECISE:\n- -IL PEUT NE PAS ETRE ADAPTE A UN AUTRE CAS.\n- -NE PAS LE CONSEILLER A UNE AUTRE PERSONNE."", ""Ce médicament est préconisé pour calmer les toux sèches et les toux d'inritation chez l'enfant de plus de 20 kg (soit environ 6 ans)."", ""Ce médicament est contre-indiqué en association avec certains médicaments utilisés dans la dépression (IMAO).\n\nBRONCHOCALM Enfants contient un antitussif, le dextrométhorphane. D'autres médicaments en contiennent ou contiennent un autre antitussif. Ne les associez pas, afin de ne pas dépasser les doses maximales conseillées (voir posologie et mode d'administration).\n\nAFIN D'EVITER D'EVENTUELLES INTERACTIONS ENTRE PLUSIEURS MEDICAMENTS, notamment avec l'alcool, IL FAUT SIGNALER SYSTEMATIQUEMENT TOUT AUTRE TRAITEMENT EN COURS A VOTRE MEDECIN OU A VOTRE PHARMACIEN."", 'Sirop. Flacon de 125 ml.', ""En cas de grossesse ou d'allaitement, l'usage de ce médicament est déconseillé.\n\nD'une façon générale, il convient, au cours de la grossesse ou de l'allaitement de toujours demander l'avis de votre médecin ou de votre pharmacien avant de prendre un médicament."", '4. COMMENT UTILISER CE MEDICAMENT?']","Pour un enfant de 45 kg, la dose recommandée de BRONCHOCALM Enfants sirop est de 2 cuillères-mesure par prise, renouvelable en cas de besoin toutes les 4 heures, sans dépasser 8 cuillères-mesure par jour.","la dose recommandée pour enfant de 45 kg  est de:  2 cuillères-mesure par prise, à renouveler en cas de besoin au bout de 4 heures, sans dépasser 8 cuillères-mesure par jour.",1.0,0.9888960848538787,0.9999999999,1.0,0.9470530759208828,0.7882123036835313,Q30
Quelle est la classe pharma du médicament kyncept 10mg comp orodispersible?,"[""LE MARCHE?\n\nEn pharmacie, uniquement sur ordonnance médicale,\n\nKYNCEPT® exisle sous forme de\n\nComprimés oro-dispersible à 5mg : Chaque boite en carton contient 30 comprimés.\n\nComprimés oro-dispersible à 10mg : Chaque boite en carton contient 30 comprimés,\n\nListe |\nDécision d'enregistrement N° :\n\nKYNCEPT® 5 mg, comprimés oro-dispersib|\nKYNCEPT® 10 mg, comprimés oro-dispersible : 17/15F104/352\n\nLa dernière date à laquelle cette notice a été révisée : 05/2017\n\nFabricant, conditionneur et détenteur de la décision d'enregistrement :\nEL KENDI industrie du médicament\n\nSiège social : Haouch Kaouch N°2, villa N° 14, Dely Brahim Alger.\nUsine : Z.A. Sidi Abdellah, Zéralda — Alger.\n\nRSS\nRE:\nLL\nSRE\nSE\nE\nE\nS\nFa\n&\nä\næ\n\nINO118.02"", ""La substance active est dénommée : Donépézil chlorhydrate.\n\nKYNCEPT® 5mg, comprimés oro-dispersible : Chaque comprimé contient 5mg de donépézi\nchlorhydrate.\n\nExciplents : dioxyde de silicium colloïdal, stéaryifumarate de sodium, crospovidone, carraghénane,\nlauryisulfate de sodium, mannitol, aspartame, arôme de fraise.\n\nExcipient à effet notoire: aspartame.\nChaque comprimé oro-dispersible de KYNCEPT® 5mg contient 346mg d'aspartame\n\nKYNCEPT® 10mg, comprimés oro-dispersible : Chaque comprimé contient 10mg de donépézi\nchlorhydrate.\n\nExciplents : mannitol, cellulose microcristalline, hydroxypropyicelulose faiblement substitué, dioxyde\nde silicium colloïdal, carraghénane, crospovidone, stéarate de magnésium, silcate de calcium,\naspartame, arôme de menthe.\n\nExcipient à effet notoire : aspartame.\nChaque comprimé oro-dispersible de KYNCEPT® 10mg contient 1.50mg d'aspartame."", 'KYNCEPT\n\nDonépézil chlorhydrate\n\nDonépézil chlorhydrate, comprimés oro-dispersible à 5 mg / vole orale.\nDonépézil chlorhydrate, comprimés oro-dispersible à 10 mg / voie orale.', ""Veuillez indiquer à votre médecin ou à votre pharmacien si vous prenez ou avez pris récemment un\nautre médicament, y compris un médicament obtenu sans ordonnance. Ceci s'applique aussi aux\nmédicaments que vous pouvez prendre ultérieurement pendant votre traitement par KYNCEPT®, Ces\nmédicaments peuvent en effet diminuer ou augmenter l'effet de KYNCEPT®.\n\nPrévenez votre médecin notamment si vous prenez un des traitements suivants\n\n* Autre traitement pour la maladie d'Alzheimer, par exemple galantamine\n\n: Traitements ant-douleur ou anti-arthrose, par exemple aspirine, ant-inflammatoires non stéroïdiens\n{AINS) comme l'ibuprofène ou le diclofénac.\n\n+ Traitement anticholinergique, par exemple toitérodine.\n\n: Traitement antibiotique, par exemple érythromicyne, rfampicine.\n\n+ Traitement antifongique, par exemple Kéloconazole.\n\n* Traitement anti-dépresseur, par exemple fuoxétine,\n\n+ Traitement ant-convuisivant, par exemple Phénytoine, carbamazépine.\n\n+ Traitement pour une maladie cardiaque, par exemple quinidine, bêta-bloquant (propanolol, aténolol).\n* Traïtement relaxant musculaire, par exemple diazépam, succinyicholine.\n\n* Anesthésiques par voie générale.\n\n+ Traitements obtenus sans ordonnance, par exemple Phytothérapie.\n\nSi vous avez besoin d'une opération nécessitant une anesthésie générale, vous devez informer le\nmédecin que vous prenez KYNCEPT®. Votre traitement peut modifier la quantité d'anesthésique\nnécessaire\n\nKYNCEPT® peut être utilisé chez les patients avec une maladie des reins ou une maladie légère à\nmodérée du foie, Prêvenez voire médecin si vous présentez une maladie des reins ou du foie. Les\npatients atteints d'une maladie grave du foie ne doivent pas prendre KYNCEPT®."", ""KYNCEPT® appartient à une classe de médicaments appelés «inhibiteurs de l'acétyicholnestérase »\nLe donézépil augmente les concentrations dans le cerveau dune substance (acétyicholine) qui\npartkipe dans le processus de la mémoire en diminuant la destruction de l'acétyicholine."", ""Comme tous les médicaments, KYNCEPT® est susceptible d'avoir des effets indésirables, bien que\nfout le monde n'y soit pas sujet.\n\nLes effets indésirables suivants ont été rapportés par les personnes prenant le donépézi\n\nPrévenez votre médecin si vous avez un de ces effets indésirables pendant que vous prenez\nKYNCEPT*.\n\nEffets indésirables graves :\n\nSi vous ressentez les symptômes suivants après avoir pris ce médicament, veuillez en informer votre\nmédecin. Vous pouriez avoir besoin d'un traitement médical d'urgence.\n\n* Atteinte du foie, par exemple hépatie. Les symptômes de l'hépatite sont : nausées, vomissements,\nparte de l'appétit, mauvais état général, fièvre, démangeaison, coloration jaune de la peau et des\nYeux, urines foncées (pouvant toucher 1 à 10 patients sur 10 000).\n\n* Ulcère gastrique ou duodénal. Les symptômes des ulcères gastriques ou duodénaux sont douleur\nOu inconfort (indigestion) entre le nombril et le stemum (pouvant toucher 1 à 10 patients sur 1 000)\n\n* Hémorragie gastrique ou intestinale. Ceci peut être responsable de selles noires ou de la présence\nde sang dans les selles (pouvant toucher 1 à 10 patients sur 1 000)\n\n* Gonvuisions (pouvant toucher 1 à 10 patients sur 1 000).\n\n* Fièvre avec raideur musculaire, transpiration ou altération de la conscience (trouble appelé «\nsyndrome malin des neurolepliques ») (pouvant toucher moins de 1 personne sur 10 000)\n\nEffets indésirables très fréquents (pouvant toucher plus de 1 patient sur 10)\n\n* Diarrhée\n\n* Nausées, vomissements.\n\n* Maux de tête\n\nEffets indésirables fréquents (pouvant toucher 1 à 10 patients sur 100)\n\n+ Crampes musculaires\n\n* Fatigue.\n\n* Difficulté à trouver le sommeil (insomnie)\n\n* Rhume.\n\n* Perte de l'appétit\n\n* Hallucinations (voir ou entendre des choses qui n'existent pas),\n\n+ Agitation.\n\n* Agressivité.\n\n* Réves anormaux et cauchemars.\n\n* Syncope.\n\n+ Vertiges.\n\n* Douleurs abdominales.\n\n* Eruption cutanée.\n\n+ Démangeaison.\n\n* Incontinence urinaire\n\n+ Douleurs\n\n* Accidents (les patients sont plus susceptibles de tomber et de se faire ma).\n\nEffets indésirables peu fréquents (pouvant toucher 1 à 10 patients sur 1 000)\n\n: ralentissement du rythme cardiaque.\n\nEffets indésirables rares (pouvant toucher 1 à 10 patients sur 10 000)\n\n* ngidité et difficulté à réaliser des mouvements, mouvements incontrôlables spécialement de la face\net de la langue mais aussi des membres.\n\nSi vous remarquez des effets indésirables non mentionnés dans cette notice, ou si certains effets\nindésirables deviennent graves, veuillez en informer votre médecin ou votre pharmacien.""]",KYNCEPT 10mg comprimés oro-dispersibles appartient à la classe des inhibiteurs de l'acétylcholinestérase.,KYNCEPT 10mg appartient à la classe des médicaments appelés inhibiteurs de l'acétylcholinestérase,1.0,0.7809305772278873,0.36666666664833336,1.0,0.9710351558513057,0.8841406234052229,Q31
Zyloric 100mg comp est utilisé pour traiter quels problemes de sante ?,"[""- 1. Qu'est-ce que ZYLORIC 100 mg, comprimé et dans quels cas est-il utilisé ?\n- 2. Quelles sont les informations à connaître avant de prendre ZYLORIC 100 mg, comprimé ?\n- 3. Comment prendre ZYLORIC 100 mg, comprimé ?\n- 4. Quels sont les effets indésirables éventuels ?\n- 5. Comment conserver ZYLORIC 100 mg, comprimé ?\n- 6. Contenu de l'emballage et autres informations."", 'ZYLORIC 100 mg, comprimé Allopurinol', ""N'arrêtez pas de prendre ZYLORIC 100 mg, comprimé sans en avoir parlé avec votre médecin.\n\nSi vous avez d'autres questions sur l'utilisation de ce médicament, demandez plus d'informations à votre médecin ou à votre pharmacien."", ""Dans de rares cas, la prise de ce médicament peut entraîner des étourdissements, des vertiges, ou des problèmes de coordination. Si c'est le cas, ne conduisez pas ou n'utilisez pas d'outils ou de machines.\n\nZYLORIC 100 mg, comprimé contient du lactose.\n\nSi votre médecin vous a dit que vous aviez une intolérance à certains sucres, contactez votre médecin avant de prendre ce médicament."", ""- · Occasionnellement, les comprimés de ZYLORIC 100 mg, comprimé peuvent avoir des effets sur votre sang qui peuvent être responsables de l'apparition d'ecchymose plus facilement que d'habitude, ou de la survenue de maux de gorge ou d'autres signes d'infection. Ces effets apparaissent généralement chez des patients qui ont des problèmes hépatiques ou rénaux. Parlez-en à votre médecin le plus rapidement possible."", ""Si vous êtes enceinte ou que vous allaitez, si vous pensez être enceinte ou planifiez une grossesse, demandez conseil à votre médecin ou pharmacien avant de prendre ce médicament.\n\nL'utilisation de ce médicament est déconseillée, sauf avis contraire de votre médecin, pendant la grossesse.\n\nEn raison du passage de ce médicament dans le lait maternel, il est donc conseillé de ne pas prendre ZYLORIC 100 mg, comprimé au cours de l'allaitement.""]","ZYLORIC 100 mg, comprimé est utilisé pour traiter des problèmes de santé liés à l'accumulation d'acide urique dans le corps, souvent associés à la goutte et à certains types de calculs rénaux.","ZYLORIC 100 mg, comprimé est utilisé pour réduire la formation de dépôts d’acide urique responsables de la goutte, de certains types de calculs rénaux ZYLORIC 100 mg, comprimé est utilisé pour réduire ou prévenir la formation de dépôts d’acide urique responsables de la goutte, de certains types de calculs rénaux .",0.0,0.7494597543146444,0.0,0.0,0.6620671022601243,0.8482684090404975,Q32
 quels sont les contre indication de lamitor 5mg comp dispers ?,"[""Les comprimés dispersibles LAMITOR ®  5 mg peuvent être avalés tels quels, croqués ou dissous dans un peu d'eau (pour l'enfant de moins de 6 ans, ils doivent être dissous). Ils peuvent être pris indifféremment au cours ou en dehors des repas."", 'Dans quel cas le médicament LAMITOR ®', 'LAMITOR ® 25 mg\n\n: comprimé; boîte de 60\n\nLAMITOR ® 50 mg\n\n: comprimé ; boîte de 40\n\nLAMITOR ®  5 mg\n\n: comprimé dispersible ; boîte de 30', '|             | p cp   | p cp   | p cp   |\n|-------------|--------|--------|--------|\n| Lamotrigine | 25 mg  | 50 mg  | 5 mg   |', ""Ce médicament ne doit pas être utilisé dans les cas suivants :\n\n- \uf0a7 enfant de moins de 2 ans (en l'absence d'études),\n- \uf0a7 en association avec le millepertuis,\n- \uf0a7 allaitement .\n- \uf0a7 Il faut se référer à la notice de l'emballage pour tout effet notoire d'un des excipients du médicament."", ""Ce médicament peut provoquer des éruptions cutanées parfois graves. Ces éruptions sont plus fréquentes en cas de posologie initiale trop élevée ou d'augmentation trop rapide des doses. L'association (fréquente) de ce médicament à d'autres antiépileptiques peut augmenter sa concentration dans le sang et constitue un facteur de risque supplémentaire. Il est indispensable de respecter scrupuleusement la posologie prescrite.\n\nSi malgré ces précautions, une éruption cutanée survient sans cause évidente (varicelle, moustiques, orties...), consultez immédiatement un médecin. De même, la survenue d'une conjonctivite , d'un gonflement du visage ou d'une fièvre inexpliquée peut nécessiter un avis médical rapide.\n\nDes précautions sont nécessaires chez les personnes souffrant d' insuffisance rénale , d' insuffisance hépatique ou ayant présenté une éruption de boutons lors de la prise d'un autre antiépileptique.\n\nSignalez à votre médecin d'éventuels antécédents de réaction allergique aux médicaments.\n\nNe modifiez ni n'interrompez jamais votre traitement sans l'accord de votre médecin : risque de réapparition des convulsions , même si aucune crise n'est survenue depuis une longue période. L'arrêt du traitement doit être progressif par diminution de la posologie sur une durée de 15 jours.\n\nLa conduite automobile et l'utilisation de machines dangereuses sont contre-indiquées chez les épileptiques lorsque les crises persistent malgré un traitement préventif . Par ailleurs, ce médicament peut être à l'origine de vertiges ou de troubles visuels.""]","LAMITOR ® 5 mg ne doit pas être utilisé chez les enfants de moins de 2 ans, en association avec le millepertuis, ou pendant l'allaitement.","Lamitor 5mg comprimé dispersible ne doit pas être utilisé chez l'enfant de moins de 2 ans, en association avec le millepertuis, et pendant l'allaitement. ",1.0,0.6394462010623684,0.19999999998,1.0,0.9759399793988313,0.903759917595325,Q33
comment conserver le medicament zinnat 250mg comp?,"[""- 1. Qu'est-ce que ZINNAT 250 mg, comprimé pelliculé et dans quels cas est-il utilisé ?\n- 2. Quelles sont les informations à connaître avant de prendre ZINNAT 250 mg, comprimé pelliculé?\n- 3. Comment prendre ZINNAT 250 mg, comprimé pelliculé?\n- 4. Quels sont les effets indésirables éventuels ?\n- 5. Comment conserver ZINNAT 250 mg, comprimé pelliculé ?\n- 6. Informations supplémentaires."", ""Ne prenez pas de dose double pour compenser la dose que vous avez oublié de prendre. Prenez simplement la dose suivante à l'heure habituelle.\n\nSi vous arrêtez de prendre ZINNAT 250 mg, comprimé pelliculé"", 'ZINNAT 250 mg, comprimé pelliculé Céfuroxime', ""Tenir ce médicament hors de la vue et de la portée des enfants.\n\nN'utilisez pas ce médicament après la date de péremption indiquée sur la boîte après EXP. La date de péremption fait référence au dernier jour du mois mentionné.\n\nA conserver à une température ne dépassant pas 30°C.\n\nNe jetez aucun médicament au tout-à-l'égout ni avec les ordures ménagères. Demandez à votre pharmacien d'éliminer les médicaments que vous n'utilisez plus. Ces mesures contribueront à protéger l'environnement."", 'Adressez-vous à votre médecin ou à votre pharmacien avant de prendre Zinnat 250 mg, comprimé pelliculé Enfants\n\nZinnat est déconseillé chez les enfants âgés de moins de 3 mois car la sécurité et l\'efficacité ne sont pas connues dans cette tranche d\'âge.\n\nAu cours de votre traitement par Zinnat, vous devez être attentif à la survenue de certains symptômes tels que des réactions allergiques, des infections fongiques (par exemple une candidose) et des diarrhées sévères (colite pseudomembraneuse). Cela permettra une prise en charge adaptée afin de réduire les risques liés à ces symptômes. Voir ""Situations nécessitant votre vigilance"" à la rubrique 4.', ""Veillez à toujours prendre ce médicament en suivant exactement les indications de votre médecin ou de votre pharmacien. Vérifiez auprès de votre médecin ou de votre pharmacien en cas de doute.\n\nPrenez Zinnat après un repas. Ceci contribuera à rendre le traitement plus efficace.\n\nAvalez les comprimés de Zinnat entiers avec un peu d'eau.\n\nNe mâchez pas, n'écrasez pas et ne coupez pas les comprimés : ceci peut diminuer l'efficacité du traitement.\n\nDose recommandée\n\nAdultes\n\nLa dose recommandée de Zinnat est de 250 mg à 500 mg deux fois par jour, en fonction de la sévérité et du type d'infection.""]","ZINNAT 250 mg, comprimé pelliculé doit être conservé à une température ne dépassant pas 30°C.",Conservez-le à une température ne dépassant pas 30°C,1.0,0.666954672351271,0.249999999975,1.0,0.8826763692933648,0.5307054771734593,Q34
"Que contient le médicament trois B 125MG 125MG 0,55MG ?","['Thiamine (DCI) chlorhydrate ou vitamine B1………......... .125 mg Pyridoxine (DCI) chlorhydrate ou vitamine B6……….........125 mg Cyanocobalamine (DCI) ou vitamine B12…………......…..0,55 mg Excipients : Mannitol, gélatine, talc, stéarate de magnésium, silice colloïdale et amidon de blé, éthylcellulose 50 CPS, polyéthylèneglycol  20000,  HP  55,  talc  blanc  et  silice  colloïdale,  dichlorométhane et alcool 95° q.s.p. 1 comprimé enrobé. Excipient à effet notoire : Amidon de blé.', 'Vitamines B1, B6, B12', ""<!-- image -->\n\nEtant donné que la vitamine B12 peut stimuler la croissance de tumeurs malignes, ce médicament ne devrait pas être administré chez les patients cancéreux.\n\n<!-- image -->\n\nLa vitamine B6 accélère la dégradation de la lévodopa médicamenteuse et réduit ainsi son efficacité. Aucune donnée sur le traitement par Trois B ®   n'est  disponible  chez  les  enfants  et  les  adolescents. Trois B ® peut être administré en cas de maladie cœliaque. L'amidon de blé peut contenir du gluten, mais seulement à l'état de trace, et est donc considéré comme sans danger pour les sujets atteint d'une maladie cœliaque.\n\nNe pas hésiter à demander l'avis de votre médecin ou de votre pharmacien."", ""<!-- image -->\n\nPour les doses journalières élevées de vitamines B1, B6 et B12, comme  elles  sont  administrées  avec  Trois  B ® ,  aucune  étude contrôlée  chez  l'animal  ou  la  femme  enceinte  n'est  disponible. Pendant la grossesse, TROIS B ®  ne devrait pas être administré sauf en cas d'indication absolue.\n\nD'une façon générale, il convient, au cours de la grossesse ou de l'allaitement de toujours demander l'avis de votre médecin ou de votre pharmacien avant d'utiliser un médicament."", '<!-- image -->\n\nComprimé enrobé. Boite de 30.', ""<!-- image -->\n\nComme tout principe actif, ce médicament peut, chez certaines personnes, entraîner des effets plus ou moins gênants : De fortes doses de vitamine B12 peuvent induire une acné. Lors de la prise de doses journalières très élevées de vitamine B6 (500 mg ou plus pendant plus de cinq mois), il peut se produire dans de rares cas  des  neuropathies  sensitives  périphériques,  qui  sont  toutefois généralement réversibles après l'arrêt de la médication.\n\nSignalez à votre médecin ou à voter pharmacien tout effet non souhaité et gênant qui ne serait pas mentionné dans cette notice.""]","Le médicament Trois B® contient 125 mg de vitamine B1, 125 mg de vitamine B6 et 0,55 mg de vitamine B12.","Il contient 125 mg de vitamine B1, 125 mg de vitamine B6 et 0,55 mg de vitamine B12. ",1.0,0.5992629789351761,0.99999999995,1.0,0.939620040225525,0.7584801609020999,Q35
"TROIS B 125MG 125MG 0,55MG nécessite-t-il une ordonnance médicale ?","[""<!-- image -->\n\nPour les doses journalières élevées de vitamines B1, B6 et B12, comme  elles  sont  administrées  avec  Trois  B ® ,  aucune  étude contrôlée  chez  l'animal  ou  la  femme  enceinte  n'est  disponible. Pendant la grossesse, TROIS B ®  ne devrait pas être administré sauf en cas d'indication absolue.\n\nD'une façon générale, il convient, au cours de la grossesse ou de l'allaitement de toujours demander l'avis de votre médecin ou de votre pharmacien avant d'utiliser un médicament."", 'Thiamine (DCI) chlorhydrate ou vitamine B1………......... .125 mg Pyridoxine (DCI) chlorhydrate ou vitamine B6……….........125 mg Cyanocobalamine (DCI) ou vitamine B12…………......…..0,55 mg Excipients : Mannitol, gélatine, talc, stéarate de magnésium, silice colloïdale et amidon de blé, éthylcellulose 50 CPS, polyéthylèneglycol  20000,  HP  55,  talc  blanc  et  silice  colloïdale,  dichlorométhane et alcool 95° q.s.p. 1 comprimé enrobé. Excipient à effet notoire : Amidon de blé.', ""<!-- image -->\n\nEtant donné que la vitamine B12 peut stimuler la croissance de tumeurs malignes, ce médicament ne devrait pas être administré chez les patients cancéreux.\n\n<!-- image -->\n\nLa vitamine B6 accélère la dégradation de la lévodopa médicamenteuse et réduit ainsi son efficacité. Aucune donnée sur le traitement par Trois B ®   n'est  disponible  chez  les  enfants  et  les  adolescents. Trois B ® peut être administré en cas de maladie cœliaque. L'amidon de blé peut contenir du gluten, mais seulement à l'état de trace, et est donc considéré comme sans danger pour les sujets atteint d'une maladie cœliaque.\n\nNe pas hésiter à demander l'avis de votre médecin ou de votre pharmacien."", ""<!-- image -->\n\nNe pas dépasser la date limite d'utilisation.\n\nGarder à l'abri de l'humidité et à une température ne dépassant pas 25°C. Ne pas laisser un médicament à la portée des enfants.\n\nDate de révision de la notice : Mai 2011 D.E Algérie N° : 293/14H212/2006\n\nFabriqué par SIPHAT, Foundouk Choucha 2013 Ben Arous, Tunisie. Détenteur de D.E et conditionné par Les Laboratoires BIOCARE\n\n<!-- image -->"", '<!-- image -->\n\nComprimé enrobé. Boite de 30.', ""<!-- image -->\n\nMode et voie d'administration\n\nVoie orale.\n\nPosologie\n\nLa posologie moyenne est de 2 comprimés par prise 2 à 3 fois par jours. La durée maximale de traitement est de 04 semaines.\n\nDans tous les cas, se conformer strictement à l'ordonnance de votre médecin.""]",Trois B® nécessite une ordonnance médicale.,"Oui , il necessite une ordonnance medicale.",0.0,0.4696187174668561,0.16666666665,1.0,0.9032939274061371,0.6131757096245484,Q36
"Quels sont les dangers de prendre des doses élevées de TROIS B 125MG 125MG 0,55MG ?","[""<!-- image -->\n\nPour les doses journalières élevées de vitamines B1, B6 et B12, comme  elles  sont  administrées  avec  Trois  B ® ,  aucune  étude contrôlée  chez  l'animal  ou  la  femme  enceinte  n'est  disponible. Pendant la grossesse, TROIS B ®  ne devrait pas être administré sauf en cas d'indication absolue.\n\nD'une façon générale, il convient, au cours de la grossesse ou de l'allaitement de toujours demander l'avis de votre médecin ou de votre pharmacien avant d'utiliser un médicament."", ""<!-- image -->\n\nComme tout principe actif, ce médicament peut, chez certaines personnes, entraîner des effets plus ou moins gênants : De fortes doses de vitamine B12 peuvent induire une acné. Lors de la prise de doses journalières très élevées de vitamine B6 (500 mg ou plus pendant plus de cinq mois), il peut se produire dans de rares cas  des  neuropathies  sensitives  périphériques,  qui  sont  toutefois généralement réversibles après l'arrêt de la médication.\n\nSignalez à votre médecin ou à voter pharmacien tout effet non souhaité et gênant qui ne serait pas mentionné dans cette notice."", ""<!-- image -->\n\nEtant donné que la vitamine B12 peut stimuler la croissance de tumeurs malignes, ce médicament ne devrait pas être administré chez les patients cancéreux.\n\n<!-- image -->\n\nLa vitamine B6 accélère la dégradation de la lévodopa médicamenteuse et réduit ainsi son efficacité. Aucune donnée sur le traitement par Trois B ®   n'est  disponible  chez  les  enfants  et  les  adolescents. Trois B ® peut être administré en cas de maladie cœliaque. L'amidon de blé peut contenir du gluten, mais seulement à l'état de trace, et est donc considéré comme sans danger pour les sujets atteint d'une maladie cœliaque.\n\nNe pas hésiter à demander l'avis de votre médecin ou de votre pharmacien."", ""<!-- image -->\n\nMode et voie d'administration\n\nVoie orale.\n\nPosologie\n\nLa posologie moyenne est de 2 comprimés par prise 2 à 3 fois par jours. La durée maximale de traitement est de 04 semaines.\n\nDans tous les cas, se conformer strictement à l'ordonnance de votre médecin."", '<!-- image -->\n\nComprimé enrobé. Boite de 30.', ""Administrée à fortes doses, la vitamine B6 inhibe l'effet de la lévodopa Afin d'éviter d'éventuelles interactions entre plusieurs médicaments, signalez systématiquement tout autre traitement en cours à votre médecin ou à votre pharmacien.""]",Les doses élevées de TROIS B ® peuvent provoquer une acné et stimuler la croissance de tumeurs malignes.,"De fortes doses de vitamine B12 peuvent induire une acné.De très fortes doses prolongées de vitamine B6 (≥ 500 mg pendant plus de 5 mois) peuvent entraîner des neuropathies sensitives périphériques, généralement réversibles après arrêt du traitement.",1.0,0.6321031459002037,0.5833333333041666,1.0,0.42087631246762847,0.48350524987051374,Q37
quelle est la dose recommende par jour de curacne 5mg caps?,"[""Prenez toujours CURACNE en suivant à la lettre les recommandations de votre médecin. En cas de doute, consultez votre médecin ou votre pharmacien.\n\nLa dose initiale usuelle est de 0,5 mg par kilogramme par jour (0,5 mg/Kg/jour).\n\nSi vous avez l'impression que votre traitement est trop fort ou trop faible, parlez-en à votre médecin.\n\nPour la plupart des patients, la dose sera comprise entre 0,5 et 1,0 mg/Kg/jour.\n\nLes capsules doivent être prises au cours des repas une ou deux fois par jour. Avalez-les entières, sans les mâcher ni les sucer."", 'CURACNE 5 mg, capsule molle Isotrétinoïne', '3. COMMENT PRENDRE CURACNE 5 mg, capsule molle ?', ""1. QU'EST-CE QUE CURACNE 5 mg, capsule molle ET DANS QUELS CAS EST-IL UTILISE ?"", '2. QUELLES SONT LES INFORMATIONS A CONNAITRE AVANT DE PRENDRE CURACNE 5 mg, capsule molle ?', ""| Modalités de prescription                                                                        | Avant la prescription   | 1 ère prescription CURACNE   | Après 1 mois   | Tous les 3 mois   |\n|--------------------------------------------------------------------------------------------------|-------------------------|------------------------------|----------------|-------------------|\n| Notice d'information - remise                                                                    | <                       |                              |                |                   |\n| Dosage des transaminases, Chol., T.G. (4) - prescription du dosage -vérification de la normalité | <                       | < <                          | <              | <                 |\n| Examen clinique                                                                                  | <                       |                              | <              | <                 |\n\n- (4) Dosages à réaliser tous les 3 mois en suivi, sauf lorsque des circonstances médicales particulières justifient des contrôles plus fréquents\n\nLes patients doivent être avertis qu'ils ne devront jamais donner ce médicament à une personne de leur entourage, et qu'ils doivent rapporter toutes les capsules non utilisées à leur pharmacien à la fin du traitement.""]","La dose recommandée par jour de CURACNE 5 mg, capsule molle est de 0,5 mg par kilogramme de poids corporel, avec une plage de 0,5 à 1,0 mg/Kg/jour pour la plupart des patients."," La dose usuelle de CURACNE est de 0,5 mg par kilogramme par jour . Pour la plupart des patients, une plage de 0,5 à 1,0 mg/Kg/jour.",0.5,0.7779862611948044,0.9999999999,1.0,0.9785993096049317,0.9143972384197268,Q38
Quels sont les médicaments à ne pas utiliser avec METRONIDAZOLE BEKER 250mg ?,"[""Grane  gee  cer: ae    me i  EN  ane -\\_ a  o   Sone de ane, ay de  rune, ae. nam ) Sept,rye e tae,  ge 129 12), émane  C ple,\n\n500  mg elcamosino  2),  u  patent,  onde  do  tae,  nye  oen, éaine. (E1 22 D d Aronbineamaisne  1 pate V do one g\n\n'Azorubinelcarmoisine (E122)\n\nde  25009.\n\n'Azorubinelearmoisine (E122)\n\n3-CLASSE  THERAPEUTIQUE; B\n\nMeronduole  EKER® es un  andoique ahecéen anjpastae appart à  Lalande des si\n\nINDICATIONS  THERAPEUTIQUES: Font faut là  let sde ans Ce  médicament est rates)\n\nEnel\n\nLes tmes amas    S ps  ates Éd O D tf flea à RO  se\n\nSYSTEMATIQUEMENT  TOUT AUTHETRATEMENTEN\n\nCOURS  AVOTREMEDECI OU AVOTRE\n\nNALER\n\nAFIN  D\n\nNTUELLES  INTERACTIONS  ENTRE PLUSIEURS  MEDICAMENTS,  IL. FAUT\n\nPHARMACIEN. En particulier:\n\nRe  and ye  cadans, moele), + Du  Géulirame (utisé dans la  prévention des rechues au  cour de falcooo-dépendnce). sez  avec précauton  Metronidazole BEKER® vec: fampicne nm, tes niconiisvantsnducteurs e a\n\nazymatiques tls quel carbamazepine."", 'Gélules 250  mg  et 500  mg', ""Rene nn Pme e  onne a se  de ce médicament. c dérier  'latement  pendant  la  pri"", '0-CONDUCTEURS    vehicules els uisateus de machines, surles risques ET UTILISATEURS DE  MACHINES; L\'atnbon  est airée notamment  chez les  conducteur de de  vertiges,  sion, halucnatons, contu\n\n\'UEFFETS INDESIRABLES:\n\n\'Feu tt on  g rat appa, ""Fanci  du ana) rte ard tae\n\n\'Comme tous les médeamens, nice es \\_cetanes personnes pl ges  es  durs  au  ea  de  rc,  nausées sommets  Gare\n\nKE  90 or  oe  seme  mpératvemnt re\n\n* Boutées   rugour  Gu    visage, émangeaisons,  sur  la peau is  accompag  née de chaleur avec rougeur  du visage, éuplon sur la peau pais do uptin par tt\n\nieee\n\n+ Uricae (6 vogue ap ; exons seer  æ   rougeur généralsant  à  toute de  pustules grée  de Fr fe elie  rete stk Mn  COM  wt, mème LE  de ER ote tement era srs fel  sur cao ps  arr yore  gular 3\n\narmes  ete  ens  nas.  press lasse a RENE: S Croate une  ax sis que va médecn  vous aura spline, e\n\nCas particule: a dure de ratement de tratement de a era ur \'cele del tichomonase (infection due  à  un parasite) est de 10 jours.', ""a  EST  INDISPENSABLE  DE  DEMANDER EN  CAS  DE  DOUTE,  IL L'AVIS DE VOTRE MEDECIN OÙ DE  VOTRE PHARMACIEN."", ""* Des  tetas  nen bes,  congas ov  qu  OUEN,\n\n'Ba\n\nETS rares  cas de se à 'cos  avc des pustules et accompa (pssubse exannématque  aigue généralisée) * Maux dette;\n\n: des oui de Le consience,d ou pouvant unas  ses  oa  wei  als rare, des mowers  inoenaies es  yx, 8 tant  généralement réversbls à  Tart dy vatement, \\_ +Néningtononmiobiene\n\nHal + robles  (parno dea  personnal ale\n\ness\n\nTous  vues  passage dou, changement dans von  de  ends: *ateliammatonduner opique.\n\nTs  aes\n\n* Tes rates cas danomales Aus, sanguin,\n\nes as pro pent antécédents de méninges sous pees mat re  non  SU\n\namet  par\n\n*  Coloration  brun-ougedte des unes due  au médicament eo  eae arn soins  en e  SOUHAITE GENANT QUI NE SERAIT PAS MENTIONNE DANS CETTE NOTICE. SIGNALER A VOTRE MEDECIN OU A VOTRE PHARMACIEN TOUT EFFET NON\n\nnet   rouge  ce gloat  à jot  le cps eee des puss, de tement, dune serpent  de fre.  Soi ne Sac  Ub  eo appelée  pustulose Es CLR  Part Van  cot arora  1-CONSERVATION:  mbalage externe doigine, à une température ne dépassant  pas 25°C. 'Aconserver dans  l'e\n\nBiss ae  cm C x res 7 ES  rates ou anussemens, vertes  passage ou en Sez  cretine surcrsct arbore  RDOSAGE:  ements, dic à coordonner  les mouvements, désoientaion,consuiezvore ca  aro men  dg t  En  cas de vomiss corals natenen 12SU médecin. put tre  amené  rescre à vous p un ate  traitement\n\nEves api ve  nave conan  ds maneers  vies,  Spat veri do es  a tier aps a date de prenpion quant  sul bot, 15/3  089/47.\n\nA p lement à risque pour le ières prises du traitement, eee  n  pn, te re ne de D  mnt er  o\n\nDetenteur\n\nFumileens, cute  à re era,  de  ere, 68 co de  prévenir votre fs mon\n\n(NFS). Prévenez. (Re  eee on  sara un a Nt).  e de réactions à type de rougeur oi rps oe  lemons  siecuetes  oe risqu\n\nCité seal\n\nDarel  eida  6100,  Alger.\n\nB\n\n1\n\nLaboratoires Beker Algérie\n\nFabricant/Conditionneur:\n\nZA, extension Der  El Bede,  cé  Fatma  NSoumer\n\n-\n\nVilla N°18 Dar  Beida 16100, Alger.\n\nel\n\nDale Novembre 2014\n\nMET 250/N-O1 et  METS00/N-Ot\n\n'existe\n\n<!-- image -->""]","METRONIDAZOLE BEKER ne doit pas être utilisé avec le Géulirame (utilisé dans la prévention des rechutes au cours de la falcooo-dépendance), la fampicilline, et les inducteurs enzymatiques tels que la carbamazépine.","Il ne faut pas associer ce médicament avec : Le disulfirame (utilisé dans le traitement de l’alcoolo-dépendance),le busulfan ( utiliser pour traiter certaines maladies du sang et dans la préparation à la greffe de moelle).Certains inducteurs enzymatiques comme la carbamazépine.",0.25,0.8109291593021594,0.0,0.6666666666666666,0.3076412349791983,0.5638982732501265,Q39
Quels sont les signe d'un surdosage accidentel de oxynorm 20mg 2ml sol pour inj?,"[""Si  vous  avez  utilisé  ou  pris  trop  d'OxyNorm,  prenez  immédiatement  contact  avecvotre médecin, votre pharmacien ou le centre Anti-poison (070/245.245).\n\nLorsque vous avez consommé plus d'OxyNorm que nécessaire, les symptômes suivants peuvent se produire :\n\n- \uf0b7 pupilles dilatées\n- \uf0b7 insuffisance respiratoire (dépression respiratoire)\n- \uf0b7 somnolence\n- \uf0b7 pouls ralenti\n- \uf0b7 déficience musculaire\n- \uf0b7 hypotension\n\nDans les cas les plus sévères, une perte de conscience (coma), une accumulation de liquide dans les poumons et un collapsus circulatoire peuvent se développer. Ceux-ci peuvent entraîner la mort.\n\nÉvitez les activités nécessitant une attention supplémentaire (ex: conduire un véhicule).\n\nSi vous oubliez d'utiliser  OxyNorm Si une dose plus faible d'OxyNorm a été administrée ou si l'administration a été oubliée, cela peut résulter en un soulagement insuffisant de la douleur.\n\nPoursuivez le traitement tel qu'il a été recommandé. N'utilisez-pas de dose double pour compenser la dose que vous avez oublié d'utiliser."", ""- \uf0b7 un état dans lequel la respiration est plus lente et plus faible qu'à l'habitude (dépression respiratoire)\n- \uf0b7 dépendance physique symptômes de désintoxication inclus (voir rubrique 3 « Si vous arrêtez d'utiliser OxyNorm »),  douleur  (p.ex.  douleur  au  niveau  de  la  poitrine), sensation générale de malaise\n- \uf0b7 gonflement  des  mains,  des  chevilles  et  des  pieds  (œdème  périphérique,  œdème), fourmillement ou insensibilité\n- \uf0b7 blessure due à de petits accidents\n- \uf0b7 modifications des perceptions, par exemple hallucinations, déréalisation), évanouissement\n- \uf0b7 réactions allergiques (hypersensibilité)\n- \uf0b7 perte de mémoire, diminution de la concentration, sensation d'une joie extrême, migraine, troubles de l'humeur\n- \uf0b7 agitation, raideur musculaire inhabituelle, contractions musculaires non contrôlées, diminution de la sensibilité à l'effleurement ou à la douleur, trouble de la coordination\n- \uf0b7 épilepsie ou convulsions\n- \uf0b7 diminution de l'audition, sensation d'étourdissement (vertiges)\n- \uf0b7 rétractation des pupilles, vision floue\n- \uf0b7 rythme cardiaque rapide, palpitations (comme symptôme de manque)\n- \uf0b7 changement de voix, toux\n- \uf0b7 rougeur de la peau, peau sèche, tremblements\n- \uf0b7 assèchement, modification du goût, déglutition difficile, petits ulcères dans la bouche, difficulté à parler, bouche douloureuse, soif\n- \uf0b7 renvois, flatulences, maladie qui perturbe le bon fonctionnement des intestins (ileus)\n- \uf0b7 impuissance, diminution de la libido\n- \uf0b7 incapacité de vider entièrement la vessie\n- \uf0b7 aggravation de la fonction hépatique (constatée dans un examen sanguin)\n- \uf0b7 besoin  de  toujours  augmenter  la  dose  d'OxyNorm  Instant  pour  atteindre  le  même niveau analgésique (tolérance)"", ""Ne cessez pas brutalement OxyNorm sans avis médical. Si vous cessez de prendre OxyNorm, il se peut que vous souffriez de symptômes de sevrage tels que agitation, excitation, sueurs, douleurs musculaires. Demandez toujours l'avis de votre médecin afin de diminuer lentement la dose.\n\nSi vous avez d'autres questions sur l'utilisation de ce médicament, demandez plus\n\nd'informations à  votre médecin ou à votre pharmacien."", 'OxyNorm 10 mg/ml est une solution limpide, incolore.', ""Une dose initiale de 2 mg de chlorhydrate d'oxycodone est recommandée."", ""Informez votre médecin ou votre pharmacien si vous utilisez, avez récemment utilisé ou pourriez utiliser tout autre médicament\n\nLes effets indésirables d'OxyNorm peuvent se manifester plus fréquemment et de manière plus sévère si vous prenez OxyNorm simultanément avec de l'alcool. Ceci est également le cas avec les médicaments agissant au niveau cérébral. Des exemples d'effets indésirables résultant de ces associations comprennent une respiration lente et superficielle (dépression respiratoire), une constipation, une sécheresse buccale ou des problèmes pour uriner.\n\nCe médicament ne peut être utilisé en combinaison avec un inhibiteur de la MAO ou si vous en avez pris au cours des 2 dernières semaines (voir rubrique 2 « Avertissements et précautions »).\n\nSignalez à votre médecin ou votre pharmacien si :\n\n- · vous utilisez des médicaments pour vous endormir ou vous calmer (hypnotiques ou sédatifs, par exemple) ;\n- · vous utilisez des médicaments pour traiter une dépression (paroxétine, par exemple) ;\n- · vous utilisez des médicaments contre une allergie ou les vomissements (antihistaminiques, antiémétiques) ;\n- · vous utilisez des médicaments pour traiter des troubles psychiatriques ou une maladie mentale (psychotropes, phénothiazines ou neuroleptiques, par exemple) ;\n- · vous utilisez des médicaments pour le traitement de la maladie de Parkinson ;\n- · vous utilisez d'autres puissants antidouleurs ;\n- · vous utilisez de la quinidine (pour traiter un rythme cardiaque rapide) ;\n- · vous utilisez de la cimétidine (pour traiter des ulcères d'estomac, des indigestions ou des brûlures d'estomac) ;\n- · vous utilisez des médicaments pour traiter des infestions fongiques (kétoconazol, voriconazol, itraconazol ou posaconazol, par exemple) ;\n- · vous utilisez des médicaments pour traiter des infections (clarithromycine, érythromycine ou télithromycine, par exemple) ;\n- · vous utilisez des médicaments appartenant au groupe des inhibiteurs de protéase pour traiter le VIH (bocéprévir, ritonavir, indinavir, nelfinavir ou saquinavir, par exemple) ;\n- · vous utilisez de la rifampicine pour traiter la tuberculose ;\n- · vous utilisez de la carbamazépine (pour traiter une épilepsie, des convulsions ou une douleur déterminée) ;\n- · vous utilisez de la phénytoïne (pour traiter une épilepsie ou des convulsions) ;\n- · vous utilisez du millepertuis (également appelé Hypericum perforatum) ;\n- · vous  utilisez certains médicaments  contre  la formation de caillots sanguins (anticoagulants, appelés anticoagulants coumariniques, par exemple la warfarine).""]","Les signes d'un surdosage accidentel de OxyNorm incluent des pupilles dilatées, une insuffisance respiratoire, une somnolence, un pouls ralenti, une déficience musculaire, et une hypotension. Dans les cas les plus graves, cela peut entraîner une perte de conscience, une accumulation de liquide dans les poumons, et un collapsus circulatoire, pouvant conduire à la mort.","Les signes d'un surdosage d'OxyNorm peuvent être : pupilles dilatées, insuffisance respiratoire, somnolence, déficience musculaire, pouls ralenti, hypotension. Dans les cas les plus sévères, une perte de conscience , une accumulation de liquide dans les poumons et un collapsus circulatoire peuvent se développer, pouvant entraîner la mort.",1.0,0.6537273933311553,0.9999999999,1.0,0.9892311118216706,0.9569244472866822,Q40
quelle la psologie recommendee de stagid 700mg comp sec,"['## STAGID® 700 mg, comprimé sécable', ""-\n\n-\n\nLes doses utiles de STAGID sont déterminées individuellement par votre medecin en fonction des resultats d'examens de laboratoire (glycemie, glycosurie). En moyenne, la posologie usuelle est de 1 comprime 3 fois par jour.\n\nMode et Voie d'administration\n\n<!-- image -->\n\n- Fréquence - Lescomprimes sont et moment auxquels le médicament doit être administré à avaler, sans les croquer, au cours ou à la fin des repas: par exemple, 1 comprime au petit dejeuner, 1 comprime au repas du midi et du soir si la posologie est de 3 comprimés par jour. Dans tous les cas se conformer strictement à l'ordonnance de votre médecin. Durée du traitement\n\nVoie orale\n\nSTAGID doit être pris chaque jour sans interruption sauf recommandation particulière du médecin.\n\nConduite\n\nà\n\ntenir au cas où\n\nl'administration d'une\n\nou plusieurs\n\nprises a été\n\nomise\n\nPrenez la dose suivante au moment habituel, ne prenez pas une double dose de metformine."", ""10. DÉCISION D'ENREGISTREMENT W : 09/99/14 A 00S/062\n\nde secables\n\npar comprime\n\n.......................... 700\n\nmg\n\n......................... 280 mg\n\n....................... 791,5mg par boîte de 30\n\n21 g\n\n8.4 g\n\n<!-- image -->\n\npar boîte de 100\n\n70 g\n\n28 g\n\n1235957-B 1436\n\n<!-- image -->"", ""Au début du traitement, quelques troubles digestifs peuvent se manifester (nausées, vomissements, selles liquides ou diarrhée) surtout si les comprimés de STAGID sont absorbes en dehors des repas. Ces troubles sont en general passagers (une dizaine de jours) et réduits par l'absorption des comprimes au cours ou à la fin des repas. Si ces troubles persistent, arrêtez le traitement et consultez votre médecin.\n\nAu cours du traitement, la survenue de vomissements, de douleurs abdominales, accompagnes de crampes musculaires ou de malaise qénèral avec sensation de grande fatigue, peut-être le signe d'un desequilibre grave de votre diabète. Prevenir aussitôt votre medecin ~ prendre de nouvelle dose de STAGID avant sa visite.\n\n28 SIGNALEZ À VOTRE MÉDECIN OU À VOTRE PHARMACIEN TOUT EFFETNON SOUHAITÉ ET GÊNANT QUI NE SERAIT PAS MENTIONNÉ DANS CmENOTICE."", ""Votre medecin vous demandera periodiquement un contrôle de laboratoire (dosage de la créatinine dans le sang) pour verifier votre fonction renale. Celle-ci doit être satisfaisante car l'élimination des antidiabetiques oraux se fait en grande partie par les reins (vous devez boire au moins un litre et demi de liquide par jour).\n\nLa survenue de certaines\n\nmaladies ou\n\nla prise\n\nde certains medicaments\n\n(corticoïdes, contraceptifs\n\noraux, danazol,\n\net certains\n\ndiurétiques)\n\npeuvent déséquilibrer\n\nplus ou\n\nmoins gravement\n\nle diabète\n\net nécessiter\n\nun recours transitoire\n\nà\n\nl'insuline.\n\nVous devez faire appel\n\nà\n\nvotre medecin\n\npour tout\n\ntraitement associe et\n\ntoute maladie\n\ninfectieuse ou virale:\n\ngrippe, infection\n\nbroncho-pulmonaire, infection\n\nurinaire.\n\nPour certains examens radiologiques avec produits de contraste iodés, votre medecin vous demandera d'interrompre ce médicament avant ou au moment de cet examen et de ne le reprendre que 48 heures après l'examen, après s'être assuré de la normalite de la fonction renale. En cas d'hospitalisation pour examens, pour une intervention chirurgicale ou pour une complication comme une maladie cardiaque, informez le medecin que vous prenez du STAGID.\n\nEvitez toute consommation importante de boissons alcoolisees.\n\nEN CAS DE DOUTE, NE PAS HÉSITER À DEMANDER L'AVIS DE VOTRE MÉDECIN OU DE VOTRE PHARMACIEN.\n\nInteractions médicamenteuses et autres interactions\n\nAFIN D'EVITER D'EVENTUELLES INTERACTIONS ENTRE PLUSIEURS MÉDICAMENTS, notamment le danazol, les contraceptifs oraux, les diurétiques ou l'olcool, IL FAUT SIGNALER SYSTÉMATIQUEMENT TOUT AUTRE TRAITEMENT EN COURS À VOTRE MÉDECIN OU À VOTRE PHARMACIEN."", ""- Ce médicament NE DOIT PAS ÊTREUTILISÉdans les cas suivants :\n- -insuffisance rénale même si elle est modérée (augmentation excessive de la creatinine dans le sang).\n- -diarrhée persistante, vomissements répétés,\n- -maladies infectieuses avec fièvre élevée (infection broncho-pulmonaire, infection urinaire),\n- -desequilibre important du diabète (acido-cétosel,\n- -insuffisance cardiaque, insuffisance respiratoire,\n- -insuffisance hépatocellulaire,\n- -avant et pendant les 2 jours qui suivent une opération chirurgicale, une radiographie de l'appareil urinaire (urographie intraveineuse) ou une radiographie de l'appareil circulatoire (angiographie).\n\nCe medicament NE DOIT GÉNÉRALEMENT PAS ÊTREUTILISÉsauf avis contraire de votre médecin:""]","La posologie recommandée de STAGID 700 mg, comprimé sécable est généralement de 1 comprimé trois fois par jour, mais elle peut être ajustée par le médecin en fonction des résultats des examens de laboratoire.","La posologie recommandée de STAGID 700 mg, comprimé sécable est généralement de 1 comprimé trois fois par jour. Elle peut être determinees par le médecin en fonction des résultats d'examens de laboratoire.",1.0,0.7504066411401329,0.49999999995,1.0,0.5468265355971279,0.9873061423885114,Q41
Est-ce que je peux utiliser Nexavar 200mg avec mes médicaments d épilepsie ?,"[""Certains médicaments peuvent avoir un effet sur Nexavar, ou leur effet peut être modifié par ce dernier. Informez votre médecin ou votre pharmacien si vous prenez, avez récemment pris ou pourriez prendre l'un ou plusieurs des médicaments mentionnés ci-dessous ou tout autre médicament, y compris un médicament obtenu sans ordonnance :\n\n- -La rifampicine, la néomycine ou d'autres médicaments utilisés pour traiter les infections ( antibiotiques )\n- -Le millepertuis, un traitement de la dépression à base de plante\n- -La phénytoïne, la carbamazépine ou le phénobarbital, des traitements pour l' épilepsie et d'autres affections\n- -La dexaméthasone, un corticoïde utilisé pour de nombreuses affections\n- -La warfarine ou la phenprocoumone, des anticoagulants utilisés pour prévenir la formation de caillots sanguins\n- -La doxorubicine, la capécitabine, le docétaxel, le paclitaxel et l'irinotécan, des traitements pour le cancer\n- -La digoxine, un traitement de l' insuffisance cardiaque légère à modérée"", ""Les comprimés de Nexavar 200 mg sont des comprimés ronds, pelliculés, de couleur rouge portant la croix Bayer gravée sur une face et la mention '200' sur l'autre face. Ils sont conditionnés par boîtes de 112 comprimés : quatre plaquettes transparentes de 28 comprimés chacune."", ""- 1. Qu'est-ce que Nexavar et dans quel cas est-il utilisé\n- 2. Quelles sont les informations à connaître avant de prendre Nexavar\n- 3. Comment prendre Nexavar\n- 4. Quels sont les effets indésirables éventuels\n- 5 Comment conserver Nexavar\n- 6. Contenu de l'emballage et autres informations"", ""La dose recommandée de Nexavar chez l'adulte est de deux comprimés à 200 mg, deux fois par jour.\n\nCeci équivaut à une dose totale journalière de 800 mg soit quatre comprimés par jour.\n\nAvalez les comprimés de Nexavar avec un verre d'eau, soit en dehors des repas soit au cours d'un repas pauvre ou modérément riche en graisses. Ne prenez pas ce médicament en même temps qu'un repas riche en graisses, car cela pourrait diminuer l'efficacité de Nexavar. Si vous avez l'intention d'avoir un repas riche en graisses, prenez les comprimés au moins 1 heure avant ou 2 heures après le repas.\n\nVeillez à toujours prendre ce médicament en suivant exactement les indications de votre médecin. Vérifiez auprès de votre médecin ou pharmacien en cas de doute.\n\nIl est important de prendre ce médicament à peu près à la même heure chaque jour, afin qu'il y ait une quantité constante du médicament dans votre sang.\n\nGénéralement, vous continuerez à prendre ce médicament tant que vous en tirerez des bénéfices cliniques et que vous ne ressentirez pas d'effets indésirables inacceptables."", ""Informez immédiatement votre médecin si vous avez pris (ou si quelqu'un d'autre) a pris plus de Nexavar que la dose prescrite. Le fait de prendre trop de Nexavar peut induire plus d'effets indésirables ou des effets indésirables plus sévères, en particulier diarrhées et réactions cutanées. Votre médecin peut vous demander d'arrêter de prendre ce médicament."", ""- -Si vous avez des problèmes cutanés. Nexavar peut entraîner des éruptions et des réactions cutanées, en particulier au niveau des mains et des pieds. De tels effets peuvent être généralement traités par votre médecin. Dans le cas contraire, votre médecin pourra interrompre le traitement ou l'arrêter complètement.\n- -Si vous avez une pression artérielle élevée. Nexavar peut augmenter la pression artérielle et votre médecin surveillera généralement votre pression artérielle et pourra vous donner un médicament pour traiter celle-ci.\n\n- -Si vous présentez des problèmes de saignements ou si vous prenez de la warfarine ou de la phenprocoumone . Un traitement par Nexavar peut augmenter le risque de saignements. Si vous prenez de la warfarine, ou de la phenprocoumone, médicaments qui fluidifient le sang afin de prévenir la formation de caillots, il peut y avoir une augmentation du risque de saignements.\n- -Si vous avez des douleurs dans la poitrine ou des problèmes cardiaques. Votre médecin pourra décider d'interrompre votre traitement ou de l'arrêter complètement.\n- -Si vous avez des problèmes cardiaques , tels qu'un signal électrique anormal encore appelé « allongement du QT ».\n- -Si vous devez subir une intervention chirurgicale, ou si vous avez été opéré(e) récemment. Nexavar peut avoir des conséquences sur la cicatrisation de vos plaies. Généralement, si vous devez être opéré(e), le traitement par Nexavar sera interrompu. Votre médecin décidera du moment auquel vous pourrez le reprendre.\n- -Si vous prenez de l'irinotécan ou du docétaxel, qui sont également des médicaments utilisés dans le traitement du cancer. Nexavar peut augmenter les effets et en particulier les effets indésirables de ces médicaments.\n- -Si vous prenez de la néomycine ou d'autres antibiotiques, l'effet de Nexavar peut être diminué.\n- -Si vous avez une insuffisance hépatique sévère. Vous pouvez subir des effets indésirables plus sévères en prenant ce médicament.\n- -Si votre fonction rénale est altérée. Votre médecin surveillera votre équilibre hydroélectrolytique.\n- -Fertilité. Nexavar peut diminuer la fertilité des hommes ainsi que celle des femmes. Si vous êtes concerné(e), veuillez en parler avec votre médecin.\n- -Des perforations gastro-intestinales peuvent survenir au cours du traitement (voir rubrique 4 : Quels sont les effets indésirables éventuels) . Dans ce cas votre médecin arrêtera le traitement.\n- -Si vous avez un cancer de la thyroïde. Votre médecin surveillera votre taux de calcium sanguin et d'hormone thyroïdienne.""]","Nexavar peut interagir avec des médicaments utilisés pour traiter l'épilepsie, tels que la phénytoïne, la carbamazépine ou le phénobarbital. Il est donc important d'informer votre médecin ou votre pharmacien si vous prenez ces médicaments."," certains médicaments pour l épilepsie peuvent interagir avec Nexavar.En particulier : la phénytoïne, la carbamazépine et le phénobarbital peuvent modifier l'effet de Nexavar. Informez votre médecin si vous prenez ces traitements.",1.0,0.6448634741405606,0.9999999999,1.0,0.757290254624146,0.8863038756394412,Q42
 Quelle est la dose à prendre de Nexavar 200mg ?,"[""Les comprimés de Nexavar 200 mg sont des comprimés ronds, pelliculés, de couleur rouge portant la croix Bayer gravée sur une face et la mention '200' sur l'autre face. Ils sont conditionnés par boîtes de 112 comprimés : quatre plaquettes transparentes de 28 comprimés chacune."", ""La dose recommandée de Nexavar chez l'adulte est de deux comprimés à 200 mg, deux fois par jour.\n\nCeci équivaut à une dose totale journalière de 800 mg soit quatre comprimés par jour.\n\nAvalez les comprimés de Nexavar avec un verre d'eau, soit en dehors des repas soit au cours d'un repas pauvre ou modérément riche en graisses. Ne prenez pas ce médicament en même temps qu'un repas riche en graisses, car cela pourrait diminuer l'efficacité de Nexavar. Si vous avez l'intention d'avoir un repas riche en graisses, prenez les comprimés au moins 1 heure avant ou 2 heures après le repas.\n\nVeillez à toujours prendre ce médicament en suivant exactement les indications de votre médecin. Vérifiez auprès de votre médecin ou pharmacien en cas de doute.\n\nIl est important de prendre ce médicament à peu près à la même heure chaque jour, afin qu'il y ait une quantité constante du médicament dans votre sang.\n\nGénéralement, vous continuerez à prendre ce médicament tant que vous en tirerez des bénéfices cliniques et que vous ne ressentirez pas d'effets indésirables inacceptables."", '2. Quelles sont les informations à connaître avant de prendre Nexavar ?', ""- 1. Qu'est-ce que Nexavar et dans quel cas est-il utilisé\n- 2. Quelles sont les informations à connaître avant de prendre Nexavar\n- 3. Comment prendre Nexavar\n- 4. Quels sont les effets indésirables éventuels\n- 5 Comment conserver Nexavar\n- 6. Contenu de l'emballage et autres informations"", ""Informez immédiatement votre médecin si vous avez pris (ou si quelqu'un d'autre) a pris plus de Nexavar que la dose prescrite. Le fait de prendre trop de Nexavar peut induire plus d'effets indésirables ou des effets indésirables plus sévères, en particulier diarrhées et réactions cutanées. Votre médecin peut vous demander d'arrêter de prendre ce médicament."", 'Adressez-vous à votre médecin ou pharmacien avant de prendre Nexavar.']","La dose recommandée de Nexavar est de deux comprimés de 200 mg, deux fois par jour, ce qui équivaut à une dose totale de 800 mg par jour.","La dose recommandée chez l adulte est de deux comprimés de 200 mg, deux fois par jour, soit une dose totale journalière de 800 mg (quatre comprimés par jour)",1.0,0.8204773065636619,0.49999999995,1.0,0.8093703406240103,0.6660527910674698,Q43
"Est-ce que je peux utiliser Biafine 0,67 100g emuls comme crème solaire ?","['a. COMMENT lmUSER BIAFINE, émulsion pour application cutsnée ?', ""Que contient Biafne, émulsion pour application cutanée ?\n\nLa substance actiyI est :\n\nTrolamine\n\n0,670 g\n\nPour 100 g d'énUsion pour application cutanée."", ""- 1. QU'EST-CE QUE BIAF1NE, ÉMULSION POUR APPUCATlON CUTANÉE ET DANS QUELS CAS EST-IL unUSE ?\n- 2. QUELLES SONT LES INFORMATIONS A CONNAITRE AVANT D'UTIUSER BIAF1NE, ÉMULSION POUR APPUCATlON CUTANÉE?\n- 3. COMMENT unUSER BIAFINE, ÉMULSION POUR APPUCATiON CUTANÉE?\n- 4. QUElS SONT LES EFFETS INDESIRABLES EVENTUElS ?\n- 5. COMMENT CONSERVER BIAFINE, ÉMULSION POUR APPUCATION CUTANÉE?\n- 6. INFORMATIONS SUPPLEMENTAIRES."", ""Z ENCASDEDOUTIE,ILEST INDISPENSABLE DE DEMANDER L'AVIS DE VOTRE - Encasdebrûlure avec formation MEDECIN OU DE VOTRE PHARMACIEN. Faites attention avec BIAFINE, émulsion pour application cutanée : Mises en garde spécjales de cloque ou de brûlure étendue, ou en cas de plaie profonde ou étendue, une consuttation médicale est indispensable avant d'appliquer un médicament sur la kision. EN CAS DE DOUTE, IL EST INDISPENSABLE DE DEMANDER L'AVIS DE VOTRE MEDECIN OU DE VOTRE PHARMACIEN.\n\nCe médicament n'est pas un protecteur solaire. Ce médicament ne doit pas être utilisé comme crème de soins sur une peau saine.\n\nEN CAS DE DOUTIE NE PAS HESITER A DEMANDER L'AVIS DE VOTRE MEDECIN OU DE VOTRE PHARMACIEN.\n\nPrise ou utilisation d'autres médicaments :\n\nSI vous prenez ou avez pris récemment un autre médicament, y compris un médicament obtenu sans ordonnance, parlez·en il! votre médecin ou à votre phannacien.\n\nInformations importantes concernant certains composants de SIAFINE, émulsion pour application cutanée :\n\nLes excipients suivants sont des composants dont la connaissance est néc-essaire pi::5IJr1Jnë utilisa-tion sans rîsque chez certâins -paIients -\n\n- · Propylèneglycol\n- · $orbate de potassium\n- · Parahydroxybenzoate de méthyle sodé (E 219)\n- · Parahydroxybenzoste de propyle sodé (E 217)"", 'Tenir hors de la portée et de la vue des enfants.\n\nNe pas utiliser BIAFINE, émulsion JlOU\' application cutanée après la date de péremption mentionnée sur la boiIe.\n\nNe pas conserver à une température inférielre à O""C.\n\nLes médicaments ne doivent pas être jetés au tout à l\'égout ou avec les ordures ménagères. Demandez à votre pharmacien ce qu\'il faut faire des médicaments inutilisés. Ces meS&lt;.feS permettront de protéger l\'environnement.', ""Comme tous les médicaments, BIAFINE, émulsion JlOU' application cutanée est susceptible d'avoir des effets indésirables, bien que tout le monde n'y soit pas sujet.\n\n- · DouI&lt;us (picotements) modérées et transitoires (15 à 30 minutes) powant SUIV8rliraprès l'application.\n- · Rare alle!gie de contact.\n- · Très rares cas d'eczéma de contact nécessitant l'arrêt immédiat du traitement\n\nSi vous remarquez des effets indésirables non mentionnés dans cette notice, ou si certains effets indésirables deviennent graves, veuillez en infooner votre médecin ou votre pharmacien.""]","Biafine, émulsion pour application cutanée ne doit pas être utilisé comme crème solaire.","Non, ce médicament n est pas un protecteur solaire. Il ne doit pas être utilisé comme crème de soin sur une peau saine.",1.0,0.7018220094477812,0.249999999975,1.0,0.5126404597051162,0.5505618388204649,Q44
Est-ce que Biafine 100g emuls peut causer des effets indésirables ?,"[""Comme tous les médicaments, BIAFINE, émulsion JlOU' application cutanée est susceptible d'avoir des effets indésirables, bien que tout le monde n'y soit pas sujet.\n\n- · DouI&lt;us (picotements) modérées et transitoires (15 à 30 minutes) powant SUIV8rliraprès l'application.\n- · Rare alle!gie de contact.\n- · Très rares cas d'eczéma de contact nécessitant l'arrêt immédiat du traitement\n\nSi vous remarquez des effets indésirables non mentionnés dans cette notice, ou si certains effets indésirables deviennent graves, veuillez en infooner votre médecin ou votre pharmacien."", 'a. COMMENT lmUSER BIAFINE, émulsion pour application cutsnée ?', ""- 1. QU'EST-CE QUE BIAF1NE, ÉMULSION POUR APPUCATlON CUTANÉE ET DANS QUELS CAS EST-IL unUSE ?\n- 2. QUELLES SONT LES INFORMATIONS A CONNAITRE AVANT D'UTIUSER BIAF1NE, ÉMULSION POUR APPUCATlON CUTANÉE?\n- 3. COMMENT unUSER BIAFINE, ÉMULSION POUR APPUCATiON CUTANÉE?\n- 4. QUElS SONT LES EFFETS INDESIRABLES EVENTUElS ?\n- 5. COMMENT CONSERVER BIAFINE, ÉMULSION POUR APPUCATION CUTANÉE?\n- 6. INFORMATIONS SUPPLEMENTAIRES."", ""Que contient Biafne, émulsion pour application cutanée ?\n\nLa substance actiyI est :\n\nTrolamine\n\n0,670 g\n\nPour 100 g d'énUsion pour application cutanée."", 'Tenir hors de la portée et de la vue des enfants.\n\nNe pas utiliser BIAFINE, émulsion JlOU\' application cutanée après la date de péremption mentionnée sur la boiIe.\n\nNe pas conserver à une température inférielre à O""C.\n\nLes médicaments ne doivent pas être jetés au tout à l\'égout ou avec les ordures ménagères. Demandez à votre pharmacien ce qu\'il faut faire des médicaments inutilisés. Ces meS&lt;.feS permettront de protéger l\'environnement.', ""Si vous avez d'autres\n\nquestions, si\n\nvous avez un doute, demandez plus d'infonnations à votre médecin ou à votre pharmacien.\n\n- · Gardez cette natice, vous pourriez avoir besoin de la relire.\n- · Si vous avez besoin de plus d'informations et de conseils, adressez-vous à votre pharmacien.\n- · Si les symptômes s'aggravent ou persistent, consutter un médecin.\n- · Si vous rernatqU&lt;!Z \\_ effets indésirables non mentionnés dans cette notice, ou si vous ressentez un des effets mentionnés comme étant grave, veuillez en infonner votre médecin ou votre pharmacien.""]","Biafine, émulsion pour application cutanée peut causer des effets indésirables.","Oui, les effets indésirables suivants sont possibles : Douleurs (picotements) modérées et transitoires après application (15 à 30 minutes). Réactions allergiques de contact rares,rès rares cas d eczéma de contact nécessitant l Arrêt du traitement.",1.0,0.6259664611267336,0.8333333332916666,1.0,0.382519411394435,0.53007764557774,Q45
