user_input,retrieved_contexts,response,reference,faithfulness,answer_relevancy,context_precision,context_recall,answer_correctness,semantic_similarity,question_id
 comment conserver humalog mix 25 100ui kwikpen ,"[""## Préparation d'Humalog Mix25 KwikPen"", '## 5. COMMENT CONSERVER HUMALOG MIX25 KWIKPEN\n\nAvant  la  première  utilisation,  conserver  votre  Humalog  Mix25  KwikPen  au  réfrigérateur  (entre  2°C  et 8°C). Ne pas congeler.', ""## Dans cette notice :\n\n- 1. Qu'est-ce qu'Humalog Mix25 KwikPen et dans quel cas est-il utilisé\n- 2. Quelles sont les informations à connaître avant d'utiliser Humalog Mix25 KwikPen\n- 3. Comment utiliser Humalog Mix25 KwikPen\n- 4. Quels sont les effets indésirables éventuels\n- 5. Comment conserver Humalog Mix25 KwikPen\n- 6. Informations supplémentaires\n\n## 1. QU'EST-CE QU'HUMALOG MIX25 KWIKPEN ET DANS QUEL CAS EST-IL UTILISE"", ""## Injection d'Humalog Mix25 KwikPen"", ""Ne pas utiliser Humalog Mix25 KwikPen après la date de péremption mentionnée sur l'étiquette et la boîte. La date d'expiration fait référence au dernier jour du mois.\n\nNe pas utiliser Humalog Mix25 KwikPen, si la suspension présente des grumeaux ou si des particules blanches restent collées au fond de la cartouche ou sur les parois, lui donnant un aspect givré. Vérifiez l'apparence avant chaque injection."", ""Conserver votre Humalog Mix25 KwikPen en cours d'utilisation à température ambiante (entre 15°C et 30°C) et jeter-le après 28 jours. Ne pas exposer à une chaleur excessive ou au soleil. Ne laissez pas votre stylo KwikPen en cours d'utilisation au réfrigérateur. Le stylo KwikPen ne doit pas être conservé avec l'aiguille vissée dessus.\n\nTenir hors de la portée et de la vue des enfants.""]",Information non trouvée dans le contexte fourni. Veuillez consulter un professionnel de santé.,"Avant la première utilisation, Humalog Mix25 KwikPen doit être conservé au réfrigérateur entre 2°C et 8°C. Une fois en cours d'utilisation, il doit être conservé à température ambiante entre 15°C et 30°C et doit être jeté après 28 jours. Il ne doit pas être exposé à une chaleur excessive ou au soleil et ne doit pas être laissé au réfrigérateur .Le stylo KwikPen ne doit pas être conservé avec l’aiguille vissée dessus.",0.0,0.0,0.9999999999833333,0.25,0.05805729113184227,0.23222916452736908,Q1
Orapen 1500 000ui comp peut-il être utilisé en association avec un antihypertenseur?,"['Informez par ailleurs votre médecin si vous prenez un antihypertenseur ou un médicament atropinique , un sédatif (tranquillisants, somnifères, certains médicaments contre la toux ou contre la douleur contenant des opiacés, antidépresseurs, neuroleptiques...), un antidiabétique ou certains pansements gastriques.\n\n## Fertilité, grossesse et allaitement\n\n## Grossesse :', ""2.CLASSE THERAPEUTIQUE: 'Antihypertenseur: antagoniste des  récepteurs  l'angiotensine 1. de\n\n## SexeRoiseesticnee  ar\n\nN'a pas de  cause  connue)\n\n## Reserve à l'aguite\n\nPosologie\n\nHypertension  artérielle:\n\n(CO-BEKERDIS). en  évidence  en  cas  d'association de  ces  deux  médicaments. Réduction  dos  événements  cardiovasculares :\n\npr nt 24 heures. Ge Zong  ge  ose pus impor  de  80mg, où d :BEKERDIS*peut égalemer   être  associé  à  des  diuréiques  comme  thydrochlorothiazide l nt"", ""La prise de ce médicament doit être évitée en association avec certains médicaments utilisés dans le traitement de la tension artérielle élevée (antihypertenseurs tels que doxazosine, prazosine et urapidil) (Voir rubrique ''Autres médicaments et XATRAL LP 5 mg comprimé à libération prolongée'')."", ""-Horrrus les cas d'urgence,interrompre l'administration de la lévodopa au mmrnum 5 à 6 heurs avant une Intervention chirurgicale,le traitement sera ensuite repris à la dose adoptée antérieurement. Associations à prendre en compte\n\n-Antihypertenseurs: hypertension symptomatique posturale."", ""Ce médicament DOIT ÊTRE ÉVITÉ EN ASSOCIATION AVEC certains médicaments utilisés dans le traitement de la tension artérielle élevée (antihypertenseurs tels que doxazosine, prazosine et urapidil) (voir rubrique « Avertissements et précautions »).\n\n.\n\n## XATRAL LP 5 mg, comprimé pelliculé à libération prolongée avec des aliments et boissons\n\nSans objet.\n\n## Grossesse, allaitement et fertilité\n\nCe médicament n'est pas destiné à la femme.\n\n## Sportifs\n\nSans objet."", ""Colorant jaune orangé S: 0.06 mg/cp\n\n## CLASSETH~RAPEUTIQUE\n\nAntihypertenseur:\n\ndiurétique thiazidique associé\n\n## INDICATIONS\n\n- · Œdèmes cardiaques.\n- , Hypertension artérielle.\n- · Ascite et œdèmes des cirrhotiques.\n\n## POSOLOGIE ET MODE D'ADMINISTRATION\n\nRéservé à l'adulte, voie orale\n\nŒdème cardiaque: le traitement doit être débuté à la posologie de 1 ou 2comprimés par jour. Cette posologie peut être augmentée mais ne doit pas dépasser 4 comprimés par jour.""]",Information non trouvée dans le contexte fourni. Veuillez consulter un professionnel de santé.,Aucune information concernant les antihypertenseurs n'est mentionnée dans la notice.,0.5,0.0,0.94999999997625,1.0,0.10831241490136398,0.4332496596054559,Q2
Quels sont les signes d une réaction allergique grave à Calcidose 500mg sachet dose ?,"['- =  Réactions allergiques (par exemple difficultés respiratoire, sifllements respiratoires, edéme  de la peau) et choc (etaillance  circulatoire brutale}\n\n## SIGNALER A VOTRE MEDECIN OU A VOTRE PHARMACIEN TOUT EFFET NON SOUHAITE GENANT  QUI  NE  SERAIT  PAS  MENTIONNE  DANS  CETTE  NOTICE.\n\n## 12. SURDOSAGE', ""Ce médicament peut induire des réactions allergiques, bien que des réactions allergiques graves soient rarement rapportées. Informez immédiatement votre médecin si vous présentez soudainement un essoufflement, des problèmes respiratoires, un gonflement des paupières, du visage ou des lèvres, une éruption ou des démangeaisons, surtout si c'est sur tout le corps."", ""Très rarement: réactions allergiques sévères telles que gonflement du visage, des lèvres, de la langue, et/ou de la gorge entraînant des difficultés pour avaler.\n\nAppelez votre médecin si vous constatez l'un ou l'autre de ces effets indésirables.\n\nSi vous remarquez des effets indésirables non mentionnés dans cette notice veuillez en informer votre médecin ou votre pharmacien\n\n## Comment conserver Calcium Sandoz 500 mg, comprimé effervescent?"", ""Une réaction allergique grave à Actrapid ou à l'un de ses com posants (appelée réaction allergique systém ique) est un effet i n dési rabl e très rare m ai s qui  peut potenti el l em ent m enacer l a vi e. Cel a peut surveni r chez m oi ns de 1 personne sur 10 000.\n\nConsultez im m édiatem ent un m édecin :"", ""## 4. QUELS SONT LES EFFETS INDESIRABLES EVENTUELS ?\n\nComme tous les médicaments, ce médicament peut provoquer des effets indésirables, mais ils ne surviennent pas systématiquement chez tout le monde.\n\n## Réactions allergiques sévères\n\nSi vous avez une réaction allergique sévère, arrêtez d'utiliser MERONEM et consultez immédiatement un médecin. Un traitement médical en urgence peut être nécessaire. Les signes peuvent inclure l'apparition soudaine de :"", '## La substance active est:\n\nOxcarbazépine ................................................................................................................................. 150 mg\n\nPour un comprimé pelliculé.\n\n## Les autres composants sont:']",Information non trouvée dans le contexte fourni. Veuillez consulter un professionnel de santé.,Aucun signe de réaction allergique grave n'est mentionné dans la notice,0.5,0.0,0.9999999999666667,0.0,0.4533891039281398,0.3135564157125592,Q3
Quels sont les principes actifs contenus dans Calcidose 500mg sachet dose?,"[""Qu'est  ce  que  Kardegic  160  mg,  poudre  pour  solution  buvable  en  sachet-dose  et  contenu  de  l'emballage extérieur ?\n\nCe médicament se présente sous forme de poudre pour solution buvable en sachet-dose (Boîte de 30).\n\n## Titulaire et exploitant\n\nsanofi-aventis France 1-13, boulevard Romain Rolland 75014 Paris - France Information Patient : N° vert 0800 222 555 Appel depuis l'étranger : +33 1 57 63 23 23\n\n## Fabricant"", ""(en espaçant chaque prise d'environ 12 heures), ou de 8 mg/kg une seule fois par jour, sans dépasser la dose totale maximum de 300 mg par jour.\n\nUtilisez la seringue doseuse graduée pour usage oral contenue dans la boîte, afin de mesurer avec précision la dose prescrite :"", ""Si vous remarquez des effets indésirables non mentionnés dans cette notice, veuillez en informer votre médecin ou votre pharmacien.\n\n## COMMENT CONSERVER AUGMENTIN 500 mg/62,SO mg ENFANTS, poudre pour suspension buvable en sachet-dose\n\n## (rapport amoxicilli e/a -i ue' 8 --c \\_ c~\n\nPasde précautions particulières de conservation.\n\nTenir hors de la portée et de la vue des enfants.\n\nNe pas utiliser après la date de péremption figurant sur la boîte, le sachet-dose."", ""Si vous avez pris plus de Kardegic 160 mg, poudre pour solution buvable en sachet-dose que vous n'auriez dû Consulter rapidement un médecin en cas de surdosage accidentel (en particulier s'il s'agit d'un enfant).\n\nSi vous oubliez de prendre Kardegic 160 mg, poudre pour solution buvable en sachet-dose Continuez votre traitement mais prévenez votre médecin.\n\n## 4. QUELS SONT LES EFFETS INDÉSIRABLES ÉVENTUELS ?"", ""Liste des excipients dont la connais~nct est neces~irt' pour unt ulili~tion ~111 risque chez certains patients\n\nSaccharose, 4R rouge cochenille, E211 benzoate de sodium.\n\n## COMMENT UTILISER CE MEDICAMENT\n\n## ~\n\npr\n\nOROKEN\n\ng/5\n\nml est\n\npréronsée chez\n\nl'enfant de\n\n6d30\n\nmois, e prises; La présentat ~ litre indica 6 mois est de 4 mg/kg et par prise\n\nDAN OUS lES [A5 SE CONFORMER STRICTEMENr A l'ORDONNANCE DE VOTRE MEDE(W\n\n## Mode et voie d'administration\n\nVoeOlae."", ""## Grossesse et allaitement:\n\nSi vous êtes enceinte ou si vous allaitez, prenez l'avis de votre médecin ou de votre pharmacien avant de prendre Calcium Sandoz 500 mg, comprimé effervescent. Les besoins en calcium de la femme sont plus élevés lors de la grossesse et de l'allaitement.\n\nLors de la grossesse, la prise quotidienne ne doit pas excéder 1500 mg de calcium, c'est pourquoi il ne faut pas dépasser la dose quotidienne recommandée.""]",Information non trouvée dans le contexte fourni. Veuillez consulter un professionnel de santé.,la substance active contenue dans ce medicament est Carbonate de calcium,0.0,0.0,0.0,1.0,0.059164795074733864,0.23665918029893546,Q4
Quels sont les effets négatifs de Calcidose 500mg sachet dose?,"[""Si vous remarquez des effets indésirables non mentionnés dans cette notice, veuillez en informer votre médecin ou votre pharmacien.\n\n## COMMENT CONSERVER AUGMENTIN 500 mg/62,SO mg ENFANTS, poudre pour suspension buvable en sachet-dose\n\n## (rapport amoxicilli e/a -i ue' 8 --c \\_ c~\n\nPasde précautions particulières de conservation.\n\nTenir hors de la portée et de la vue des enfants.\n\nNe pas utiliser après la date de péremption figurant sur la boîte, le sachet-dose."", ""Si vous avez pris plus de Kardegic 160 mg, poudre pour solution buvable en sachet-dose que vous n'auriez dû Consulter rapidement un médecin en cas de surdosage accidentel (en particulier s'il s'agit d'un enfant).\n\nSi vous oubliez de prendre Kardegic 160 mg, poudre pour solution buvable en sachet-dose Continuez votre traitement mais prévenez votre médecin.\n\n## 4. QUELS SONT LES EFFETS INDÉSIRABLES ÉVENTUELS ?"", 'Si  vous  remarquez  des  effets  indésirables  non  mentionnés  dans  cette  notice,  ou  si  certains  effets  indésirables deviennent graves, veuillez en informer votre médecin ou votre pharmacien.\n\n## 5. COMMENT CONSERVER KARDEGIC 160 mg, poudre pour solution buvable en sachet-dose ?\n\nTenir hors de la portée et de la vue des enfants.', ""Comme tous les médicaments, Kardegic 160 mg, poudre pour solution buvable en sachet-dose est susceptible d'avoir des effets indésirables, bien que tout le monde n'y soit pas sujet :"", ""Dans l'otite moyenne, la dose peut être augmentée jusqu'à un maximum de 500 mg par jour en plusieurs doses.\n\n## Surdosage:\n\nLa concentration sérique de céfuroxime peut être réduite par hémodialyse ou dialyse péritonéale.\n\n## Effets indésirables:\n\nLes effets indésirables généraux les plus fréquents sont:"", ""Liste des excipients dont la connais~nct est neces~irt' pour unt ulili~tion ~111 risque chez certains patients\n\nSaccharose, 4R rouge cochenille, E211 benzoate de sodium.\n\n## COMMENT UTILISER CE MEDICAMENT\n\n## ~\n\npr\n\nOROKEN\n\ng/5\n\nml est\n\npréronsée chez\n\nl'enfant de\n\n6d30\n\nmois, e prises; La présentat ~ litre indica 6 mois est de 4 mg/kg et par prise\n\nDAN OUS lES [A5 SE CONFORMER STRICTEMENr A l'ORDONNANCE DE VOTRE MEDE(W\n\n## Mode et voie d'administration\n\nVoeOlae.""]",Information non trouvée dans le contexte fourni. Veuillez consulter un professionnel de santé.,"Les effets négatifs de Calcidose 500 peuvent inclure une bouche sèche et  en cas de traitement prolongé, un risque d'augmentation du taux de calcium dans le sang et les urines. SIGNALER À VOTRE MÉDECIN OU À VOTRE PHARMACIEN TOUT EFFET NON SOUHAITÉ ET GËNANT QUI NE SERAIT PAS MENTIONNÉ DANS CETTE NOTICE",0.0,0.0,0.26666666665333333,0.5,0.07346393748701036,0.2938557499480414,Q5
Quelle est la posologie recommandée de AMODEX-Gé 250MG 5ML pdre pour un enfant de 10 ans?,"[""## 5POSOLOGIE ET MODE D'ADMINISTRATION\n\n## Posologie\n\nLa posologienitiale est deparjour , elle peut êtreentéeà 10mg si nécessaire .\n\n## Mode et voie d'administration :\n\nAMLODIPINE BEKER ® est un médicamentdestiné à l'adulte i 5mg augm Ce médicament est prendre en une seule prise par jour. à"", ""Pour les enfants ayant un poids ou un âge différent, il existe d'autres présentations d'aspirine: demandez conseil à votre mëdedn ou à votre pharmacien.\n\n## 2 QUElLES SONT LES INFORMATIONS A CONNAITRE AVANT DE PRENDRE A,pegl( 250 mg\n\n~ votre médecin vous a informé(e) d'une intolérance à certains sucres,contartez-lesvant de prendre ce médicament. 1.,\n\n## Ne prenez jamais ASPEGtC250 mg da ns ca, ,uivants\n\n:"", ""Prévenez également votre médecin ou votre pharmacien si vous avez une faiblesse musculaire constante. Des examens complémentaires et un traitement peuvent être nécessaires pour la diagnostiquer et la traiter.\n\n## Enfants et adolescents\n\nINEGY n'est pas recommandé chez les enfants de moins de 10 ans.\n\n## Autres médicaments et INEGY 10 mg/40 mg, comprimé"", ""Tenir hors de la portée et de la vue des enfants.\n\nNe pas utiliser DUPHALAC 10g/15 ml, solution buvable en sachet apres la date de péremption mentionnée sur la boite.\n\nCemédicamentdoit êtreconservé à unetempératureinférieure à 25'C. Ne pas mettre au réfrigérateur.\n\nLes médicaments ne doivent pas être jetés au tout à l'égout ou avec les ordures ménagères. Demandez à votre pharmacien ce qu'il faut faire des médicaments inutilisés. Cesmesurespermettront de protéger l'environnement."", ""## Forme pharmaceutique et contenu\n\n## Qu'est ce que NEORAL 100 mg/ml, solution buvable et contenu de l'emballage extérieur ?\n\nNEORAL se présente sous forme de solution buvable. C'est un liquide limpide, jaune pâle à jaune brunâtre.\n\nIl se présente en flacon en verre de 10, 20 ou 50 ml, avec deux seringues pour mesurer la dose."", 'Si vous remarquez des effets indésirables non mentionnés dans cette notice, ou si certains effets indésirables deviennent graves, veuillez en informer votre médecin ou votre pharmacien, il se peut que vous ayez besoin de diminuer votre dose.\n\n## 5. COMMENT CONSERVER NORDITROPINE NORDIFLEX 15 mg/1,5 ml, solution injectable en stylo prérempli ?\n\nTenir hors de la portée et de la vue des enfants.\n\n## Date de péremption']",Information non trouvée dans le contexte fourni. Veuillez consulter un professionnel de santé.,la dose recommende pour un enfant de 10 ans est de 25 mg/kg à 150 mg/kg par 24 heures,0.5,0.0,0.0,0.0,0.053156520256559134,0.21262608102623654,Q6
Est-il possible d utiliser AMODEX-Gé 250MG 5ML pdre  pendant la grossesse?,"[""D'une fagon générale, il  convient, au cours de la grossesse ou de Pallaitement de toujours demander l'avis de votre médecin ou de votre pharmacien  avant  d'utiliser un  médicament.\n\n<!-- image -->\n\n## COMMENT PRENDRE CE MÉDICAMENT\n\nMode  et  vole  d'administration\n\nLa dose initiale  recommandée est de 1600 mg/jour (4x400 mg) soit 2 élules matin et soir."", ""Ne jetez aucun médicament au tout-à-l'égout ou avec les ordures ménagères. Demandez à votre pharmacien d'éliminer les médicaments que vous n'utilisez plus. Ces mesures contribueront à protéger l'environnement.\n\n## 6. CONTENU DE L'EMBALLAGE ET AUTRES INFORMATIONS\n\n## Ce que contient ELUDRIL 0.5 ml/0.5g pour 100 ml, solution pour bain de bouche\n\n- · Les substances actives sont :"", ""## Dénomination du médicament\n\n<!-- image -->\n\n## METHERGIN 0,25 mg/ml, solution buvable\n\nMaléate de méthylergométrine\n\n## Encadré\n\n## Veuillez lire attentivement l'intégralité de cette notice avant d'utiliser ce médicament.\n\n- · Gardez cette notice, vous pourriez avoir besoin de la relire.\n- · Si vous avez d'autres questions, si vous avez un doute, demandez plus d'informations à votre médecin ou votre pharmacien."", 'Comme tous les médicaments, CERUBIDINE 20 mg, poudre pour solution pour perfusion peut provoquer des effets indésirables, mais ils ne surviennent pas systématiquement chez tout le monde.', ""Si vous arrêtez d'utiliser ELUDRIL 0.5 ml/0.5 g pour 100 ml, solution pour bain de bouche Sans objet.\n\nSi vous avez d'autres questions sur l'utilisation de ce médicament, demandez plus d'informations à votre médecin ou à votre pharmacien.\n\n## 4. QUELS SONT LES EFFETS INDESIRABLES EVENTUELS ?\n\nComme tous les médicaments, ce médicament peut provoquer des effets indésirables, mais ils ne surviennent pas systématiquement chez tout le monde."", ""## Dénomination du médicament\n\n<!-- image -->\n\n## GLUCANTIME 1,5 g/5 ml, solution injectable Antimoniate de méglumine\n\n## Encadré\n\n## Veuillez lire attentivement cette notice avant d'utiliser ce médicament. Elle contient des informations importantes pour votre traitement.\n\nSi vous avez d'autres questions, si vous avez un doute, demandez plus d'informations à votre médecin ou à votre pharmacien.""]","Ceci signifie que l'on doit toujours demander l'avis d'un professionnel de santé avant d'utiliser ce médicament, y compris pendant la grossesse.","Amodex Gé peut être utilisé pendant la grossesse Amodex Gé peut être utilisé pendant la grossesse en cas de besoin. D'UNE FAÇON GÉNÉRALE, IL CONVIENT AU COURS DE LA grossesse de toujours demander l avis de votre medecin ou de votre pharmacien",0.5,0.4803025489627652,0.699999999965,1.0,0.5691945849138229,0.5624926253695774,Q7
Est-ce que AMODEX-Gé 250MG 5ML pdre  peut causer la diarrhée pour un adulte ?,"[""E CAS DE DOUTE, IL EST INDISPENSABLE DE DEMANDER L'AVIS DE VOTRE MEDECIN OU DE VOTRE PHARMACIEN.\n\n## Faites attention avec ZECLAR 50 mg/ml, granulés pour suspension buvable:\n\n## Mises en garde sPéciales\n\nCe médicament ne doit pas être associé à des médicaments qui peuvent être toxiques pour l'oreille.\n\nlnformer votre médecin de colites ou de diarrhées pouvant survenir au cours du traitement."", '| a) Si vous avez des troubles digestifs de type vomissements, diarrhées sévères.......................................... 33                                                                                                                                                                                                                                                                                                     |', ""Ce  médicament  est indiqué dans  le traitement  de  la diarrhée aigue d'origine infectueuse  chez l'adulte  et  l'enfant  de plus  de 6 ans. le traitement  ne dispense pas de mesures diététiques et d'une réhydratation  si elle est nécessaire.\n\n## ATTENTION  !\n\n## DANS  QUEL  CAS  NE  PAS  UTILISER  CE  MEDICAMENT\n\nCe  médicament  ne  doit pas  être utilisé en  cas  d'antécédent  de réaction allergique aux  dérivés  du  nitrofurane."", ""## Si vous avez pris plus de ALDACTONE 75 mg, comprimé sécable que vous n'auriez dû :\n\nEn cas d'absorption massive, prévenir immédiatement votre médecin, votre pharmacien ou le centre antipoison le plus proche.\n\nCe surdosage peut entraîner les malaises suivants: somnolence, nausées, vomissements, diarrhée\n\n## 4. QUELS SONT LES EFFETS INDESIRABLES EVENTUELS?"", ""Nom et adresse du fabricant :\nLaboratoires CONTINENTAL PHARM\n2 Lot 21/29 En-Nedjma Oran - Algérie-\n## Dans quels cas utiliser ce médicament ?\nAmodex Gé est indique dans le traitement des infections\nbactériennes à germes sensibles. Ce médicament est indiqué\négalement chez l'adulte dans le traitement de certains ulcères de\nl'estomac ou du duodénum\nAttention !\n## Dans quels cas ne pas utiliser ce médicament ?\nCe medicament NE DOIT PAS ETRE UTILISE dans les cas suivants"", ""Une diarrhée peut apparaître lors d'une prise prolongée et à fortes doses, et également rarement aux doses.\n\nrecommandées. Si cet effet indésirable persiste, interrompre la prise de MEFESTAN.""]","Ceci signifie que ZECLAR est utilisé pour traiter la diarrhée aigue d'origine infectueuse chez les adultes et les enfants de plus de 6 ans. Cependant, une diarrhée peut survenir en cas de prise prolongée et à fortes doses, ou même aux doses recommandées, bien que cela soit rare. Si cette diarrhée persiste, il est conseillé d'interrompre le traitement.","Oui, il peut causer des troubles digestifs comme la diarrhée ",0.25,0.3574662225752247,0.608333333318125,1.0,0.35172993204733305,0.5497768710464749,Q8
 qu'est ce que TOBREX 300000ui colly en solution et dans quels cas est il utiliser?,"[""pendant\n\n3 minutes,\n\n- · d'exercer une pression sur la partie haute latérale du nez. Si vous avez l'impression que l'effet de TOBREX 0,3%, collyre en solution est trop fort ou trop faible, consultez votre médecin ou votre pharmacien. Voie ophtalmique.\n\n- • de fermer\n\n<!-- image -->\n\nComme pour tous les collyres, effectuez, dans l'ordre les opérations suivantes:"", ""Durée du traitement: 5 à 15 jours.\n\nSi vous avez utilisé plus de TOBREX 0,3%, collyre en solution que vous n'auriez dû : consultez immédiatemen votre médecin ou votre pharmacien. Si vous oubliez de prendre TOBREX 0,3%, collyre en solution: ne prenez pas de dose double pour compenser la dose e que vous avez oubliée de prendre.\n\n## 4. QUELS SONT LES EFFETS INDESIRABLES EVENTUELS?\n\nComme tous les médicaments, TOBREX 0,3%, collyre en solution es suscep e d'entraîner des effets indés bles:"", ""ALCON\n\ncusi,\n\n.A.\n\nE-08320 EL MASNOU-BARCELONE\n\n## 1. QU'EST-CE QUE TOBREX 0,3%, collyre en solution ET DANS QUELS CAS EST-IL UTILISE?\n\nCollyre en solution.\n\nPrésenté sous forme de 5 ml en flacon: boite de 1.\n\nCe médicament contient un antibiotique de la famille des aminosides: la tobramycine."", '## 3. COMMENT UTILISER TOBREX 0,3%, collyre en solution?\n\nA titre indicatif, la posologie usuelle est:\n\n0,3 g\n\n-\n\n-\n\n<!-- image -->\n\ndes signes cliniques, puis diminuée progressivement, par votre médecin. du collyre, afin de favoriser son action locale, il est conseillé:\n\nla\n\n- Après instillation ou paupière\n\npendant\n\n3 minutes,', ""Ce médicament se présente sous forme de d'une solution buvable. Flacon de 150 ou 200 ml avec un bouchon de sécurité-enfant.\n\nNom et adresse du titulaire de l'autorisation de mise sur le marché et du titulaire de l'autorisation de fabrication responsable de la libération des lots, si différent\n\n## Titulaire\n\n## DEFIANTE FARMACEUTICA SA\n\nRua dos Ferreiros, 260 9000-082 FUNCHAL PORTUGAL\n\n## Exploitant\n\n## SIGMA TAU France"", ""## 2. QUELLES SONT LES INFORMATIONS A CONNAITRE AVANT D'UTILISER INNOHEP 4 500 UI anti-Xa/0,45 ml, solution injectable en seringue préremplie ?\n\n## N'utilisez jamais INNOHEP 4 500 UI anti-Xa/0,45 ml, solution injectable en seringue préremplie :""]","Ceci signifie que TOBREX 0,3%, collyre en solution est un médicament contenant un antibiotique appelé tobramycine et il est utilisé pour traiter les infections oculaires d'origine bactérienne."," TOBREX 0,3 est un collyre en solution est indiqué pour le traitement local de certaines infections de l'œil dues à des bactéries sensibles, telles que les conjonctivites, les kératites et les ulcères de la cornée.",0.6666666666666666,0.41199092023760525,0.99999999998,1.0,0.6198371408869275,0.7650628492619957,Q9
quels sont les effets indésirables possible de forlax 4g sach pdre solution buv pour un enfant ?,"[""En signalant les effets indésirables, vous contribuez à fournir davantage d'informations sur la sécurité du médicament.\n\n## 5. COMMENT CONSERVER CERULYSE 5 g/100 g, solution pour instillation auriculaire ?\n\nTenir ce médicament hors de la vue et de la portée des enfants.\n\nN'utilisez pas ce médicament après la date de péremption indiquée sur le conditionnement extérieur après EXP. La date de péremption fait référence au dernier jour de ce mois."", ""En signalant les effets indésirables, vous contribuez à fournir davantage d'informations sur la sécurité du médicament.\n\n## 5. COMMENT CONSERVER INNOHEP 4 500 UI anti-Xa/0,45 ml, solution injectable en seringue préremplie ?\n\nTenir ce médicament hors de la vue et de la portée des enfants.\n\nN'utilisez pas ce médicament après la date de péremption indiquée sur le conditionnement extérieur après EXP. La date de péremption fait référence au dernier jour de ce mois."", ""GARDENAL 40 mg/2 ml, poudre et solvant pour solution injectable ne doit pas être utilisé pendant la grossesse sauf en l'absence d'alternative moins à risque pour l'enfant à naître. Si vous envisagez une grossesse ou en cas de grossesse, n'interrompez pas brutalement votre traitement et contactez immédiatement votre médecin. Votre médecin envisagera un arrêt du traitement ou jugera de l'utilité éventuelle de poursuivre le traitement en l'absence d'alternative moins à risque pour l'enfant à"", ""## 5. COMMENT CONSERVER GADOVIST 1,0 mmol/mL, solution injectable en seringue préremplie ?\n\nTenir hors de la vue et de la portée des enfants.\n\n## Date de péremption\n\nN'utilisez pas ce médicament après la date de péremption indiquée sur l'étiquette et sur l'étui en carton après « EXP ». La date de péremption fait référence au dernier jour du mois. Ce médicament ne requiert pas de conditions particulières de stockage."", ""En signalant les effets indésirables, vous contribuez à fournir davantage d'informations sur la sécurité du médicament.\n\n## 5. COMMENT CONSERVER SUFENTA 10 microgrammes/2 ml, solution injectable (I.V. ou péridurale) ?\n\nTenir ce médicament hors de la vue et de la portée des enfants.\n\nN'utilisez pas ce médicament après la date de péremption indiquée sur l'étiquette après EXP.\n\nLa date de péremption fait référence au dernier jour de ce mois."", ""En signalant les effets indésirables, vous contribuez à fournir d'avantage d'informations sur la sécurité du médicament.\n\n## 5. COMMENT CONSERVER EAU OXYGENEE GIFRER 10 VOLUMES, solution pour application cutanée ?\n\nTenir ce médicament hors de la vue et de la portée des enfants.\n\n## Date de péremption\n\nN'utilisez pas ce médicament après la date de péremption indiquée sur la boîte ou sur le récipient unidose après {EXP}. La date de péremption fait référence au dernier jour de ce mois.""]",Information non trouvée dans le contexte fourni. Veuillez consulter un professionnel de santé.,"les effets indésirables possible de forlax 4g chez l'enfant sont: Douleurs abdominales, Diarrhée , Vomissements, Ballonnements, Nausée, Réactions d'hypersensibilité",0.0,0.0,0.0,1.0,0.06838506941096155,0.2735402776438462,Q10
quells sont Indications thérapeutiques de clovir 200mg comp?,"['PRÉSEIffATiONS-,\n\n--\n\nCLOVIR est disponible en 200mg, comprimés,\n\n## Ceci est un médicament', ""## INDICATIONS:\n\nLe CLOVIR comprimé est indiqué dans le traitement des Infections à virus herpes simplex, infections virales cutanées et de la membrane muqueuse, incluant les primo-infections génitales à virus herpes simplex et des récurrences ultérieures. Prévention des infections à virus herpes simplex chez les sujets immunodéprimés et leurs recurrence. Le CLOVIR comprimé est aussi indiqué dans le traitement des infections aiguës de l'Herpes Zoster.\n\n## POSOLOGIE ET MODE D'ADMINISTRATION:"", ""800 mg de clovir doit être prise 5 fois par jour à des intervalles d'environ 4 heures.\n\nle traitement doit être poursuivi pendant 7 jours.\n\nChez les patients gravement immunodéprimés ou présentant une altération de t'absorption intestinale , il faut utiliser la forme intraveineuse.\n\nL'administration doit débuter le plutôt possible: le traitement de l'herpes Zoster donne de meilleurs résultats si il est administré des le début de l'éruption."", '## Indications thérapeutiques :\n\nLopress 100mg est préconisé principalement dans :', ""SUPERSTAT tO mg, BI30 et BI90 Compnmés pelhculés, N' de la DE: 15/06 M 269/001 SUPERSTAT 20 mg, BI30 et BI90 Compnmés pel icuIes, N de la DE. 15/06 M 270/00t\n\n## PRESCRIPTION\n\nUsle 1\n\n## CECIESTUN MEDICAMENT\n\n• Un médtcamentest un produu qui affectela santé.son edrmmstratcnsans aVtS médicalpeut être dangereuse\n\n· SuM8 stnc1ement la prescnpton médicaleet les instructionsdu pharmacien.\n\n, Le médedn et le pnarmacienconnaissentle médicament,ses bienfaitset ses nsques."", ""## POSOLOGIE ET MODE D'ADMINISTRATION:\n\nMode d'administration: voie orale\n\nClovir peut être dissous dans un minimum de 50 ml d'eau ou avalé avec un peu d'eau.\n\n## Posologie:\n\nTraitement de l'herpès simplex chez l'adulte:\n\n200mg de clovir 5 fois par jour à environ 4 heures d'intervalles, le traitement doit être poursuivi pendant 5 jours.""]","Ceci signifie que : CLOVIR 200mg, comprimés, est indiqué dans le traitement de divers types d'infections causées par les virus herpes simplex, y compris les infections cutanées, les infections de la membrane muqueuse, les primo-infections génitales et les récurrences ultérieures, ainsi que dans la prévention des infections à virus herpes simplex chez les personnes immunodéprimées. Il est également utilisé dans le traitement des infections aiguës de l'Herpes Zoster.","CLOVIR 200mg est indiqué dans le traitement de Herpes simplex (incluant les primo-infections génitales et les récurrences ultérieures), des infections virales cutanées et de la membrane muqueuse, dans la prévention des infections à virus Herpes simplex chez les sujets immunodéprimés , et dans le traitement de l'Herpes Zoster",1.0,0.7910322505582105,0.81666666664625,1.0,0.5588228770561617,0.9495772225103614,Q11
"Quels sont les médicaments à ne pas utiliser avec ENCOFLUIDE ADULTE 0,25g ?","[""raison de son dosage, ce médicament est réservé à l'adulte et à l'enfant de plus de 50 kg."", ""à\n\nl'enfant\n\nà\n\npartir de 50 kg (soit environ\n\n15 ans).\n\n•\n\nPour les enfants de moins de 50 kg (soit environ 15 ans) et pour les adultes de moins de 50 kg, ce dosage n'est pas adapté: prendre l'avis de votre mëdeon.\n\nDemandez conseil à votre médecin ou à votre pharmacien.\n\nSi la douleur persiste plus de 5 jours ou la fièvre ~ ou en cas d'efficacité insuffisante ou de survenue de tout autre signe, ne pas continuer le traitement sans l'avis de votre médecin."", ""Il est nécessaire de lutter contre la sécheresse de l'air ambiant (humidificateur...) pour éviter le dessèchement des sécrétions. Il est également recommandé de boire beaucoup. Chez la personne âgée ou le jeune enfant, l'incapacité à évacuer les crachats peut justifier l'aide d'un kinésithérapeute, sur prescription médicale.\n\n## Effets indésirables possibles du médicament PULMOFOR ®\n\nDouleurs d'estomac, nausées, diarrhée."", ""D'une façon générale, il  convient, au cours  de la grossesse  ou  de  l'allaitement de toujours  demander  l'avis de  votre  médecin  ou  de  votre pharmacien  avant  d'utiliser un médicament.\n\n## Vy  COMMENT  PRENDRE  CE  MEDICAMENT\n\n<!-- image -->\n\nADULTE:  La posologie usuelle est  de 1-1,5 ou 2  g/jour  en  2  à  3  prises."", ""## GRO ES E - ALLAlTBIE:\\T\n\nIl est préférable de ne pas utiliser ce médicament pendant la grossesse.\n\nSi vou découvrez que vous êtes enceinte pendant le traitement, consultez votre médecin car lui seul peut juger de la nécessité de le poursuivre.\n\nD'une façon générale. il convient, au cours de la grosses e et de l'allaitement de toujours demander avis à votre médecin ou à votre pharmacien avant de prendre un médicament.\n\n## COMMENT UTILISER CE MÉDICAMENT POSOLOGIE\n\nRÉSERVÉ À L'ADULTE"", ""* Ou 40 kg\n\n** Eviter les réinjections,\n\n*** Quel que soit le poids de l'enfant, ne pas administrer plus de 150 mg par injection.\n\n## Mode et voie d'administration\n\nVoie injectable (sauf voie IV)\n\n## Ne pas réutiliser un flacon entamé.\n\n## Fréquence d'administration\n\nLa fréquence et le moment auxquels ce médicament doit être administré sont strictement déterminées par le médecin anesthésiste.\n\nLa durée du traitement est strictement déterminée par le médecin anesthésiste.""]","Ceci signifie que :
- Aucun autre médicament n'est explicitement mentionné dans la notice comme contre-indiqué avec ENCOFLUIDE ADULTE 0,25g.
- Il est important de suivre les instructions du médecin anesthésiste concernant la fréquence, le moment et la durée d'administration du médicament.
- Il ne faut pas administrer plus de 150 mg par injection et ne pas réutiliser un flacon entamé.",Encofluide adulte ne doit pas etre utiliser avec les médicaments à effet antabuse et les psychotropes.,0.75,0.8809915766889347,0.49999999995,0.0,0.15369012043707825,0.614760481748313,Q12
Est-ce qu il existe un risque d'un surdosage de doliprane 300mg suppo ?,"[""- 6. INFORMATIONS SUPPLEMENTAIRES\n- 1. QU'EST-CE QUE DOLIPRANE 100 mg, poudre pour solution buvable en sachet-dose ET DANS QUELS CAS EST-IL UTILISE ?"", 'Si vous remarquez des effets indésirables non mentionnés dans cette notice, ou si certains effets indésirables deviennent graves, veuillez en informer votre médecin ou votre pharmacien.\n\n- 5. COMMENT CONSERVER DOLIPRANE 100 mg, poudre pour solution buvable en sachet-dose ?\n\nTenir hors de la portée et de la vue des enfants.\n\nDate de péremption\n\nNe pas utiliser DOLIPRANE 100 mg, poudre pour solution buvable en sachet-dose après la date de péremption mentionnée sur la boîte.', 'Si vous remarquez des effets indésirables non mentionnés dans cette notice, ou si certains effets indésirables deviennent graves, veuillez en informer votre médecin ou votre pharmacien.\n\n## 5. COMMENT CONSERVER DOLIPRANE 150 mg, poudre pour solution buvable en sachet-dose ?\n\nTenir hors de la portée et de la vue des enfants.\n\n## Date de péremption\n\nNe pas utiliser DOLIPRANE 150 mg, poudre pour solution buvable en sachet-dose après la date de péremption mentionnée sur la boîte.', ""Contre-indications\n\nNe prenez jamais DOLIPRANE 100 mg, poudre pour solution buvable en sachet-dose en cas de:\n\n- \uf0b7 allergie connue au paracétamol ou aux autres constituants,\n- \uf0b7 maladie grave du foie.\n\nEN CAS DE DOUTE, IL EST INDISPENSABLE DE DEMANDER L'AVIS DE VOTRE MEDECIN OU DE VOTRE PHARMACIEN.\n\nPrécautions d'emploi ; mises en garde spéciales\n\nFaites attention avec DOLIPRANE 100 mg, poudre pour solution buvable en sachetdose:\n\n## Mises en garde spéciales"", '## Dénomination du médicament\n\n## DOLIPRANE 150 mg, poudre pour solution buvable en sachet-dose\n\n## Encadré\n\nVeuillez lire attentivement cette notice avant de prendre ce médicament. Elle contient des informations importantes pour votre traitement.', ""## Contre-indications\n\nNe prenez jamais DOLIPRANE 150 mg, poudre pour solution buvable en sachet-dose en cas de:\n\n- · allergie connue au paracétamol ou aux autres constituants,\n- · maladie grave du foie.\n\nEN CAS DE DOUTE, IL EST INDISPENSABLE DE DEMANDER L'AVIS DE VOTRE MEDECIN OU DE VOTRE PHARMACIEN.\n\n## Précautions d'emploi ; mises en garde spéciales\n\nFaites attention avec DOLIPRANE 150 mg, poudre pour solution buvable en sachet-dose:\n\nMises en garde""]",Ceci signifie que : La notice fournie ne contient aucune information directe sur le surdosage de Doliprane 3,"Oui,Il existe un risque de surdosage avec DOUPRANE 300 mg, suppositoireIl existe un risque de surdosage avec DOUPRANE 300 mg, suppositoire, et en cas de surdosage, un traitement symptomatique est nécessaire..",0.0,0.0,0.16666666665,0.0,0.08788183880045897,0.35152735520183587,Q13
est ce que je peux utiliser doliprane 300mg suppo si j'ai une inflammation annale?,"[""- 6. INFORMATIONS SUPPLEMENTAIRES\n- 1. QU'EST-CE QUE DOLIPRANE 100 mg, poudre pour solution buvable en sachet-dose ET DANS QUELS CAS EST-IL UTILISE ?"", 'Si vous remarquez des effets indésirables non mentionnés dans cette notice, ou si certains effets indésirables deviennent graves, veuillez en informer votre médecin ou votre pharmacien.\n\n- 5. COMMENT CONSERVER DOLIPRANE 100 mg, poudre pour solution buvable en sachet-dose ?\n\nTenir hors de la portée et de la vue des enfants.\n\nDate de péremption\n\nNe pas utiliser DOLIPRANE 100 mg, poudre pour solution buvable en sachet-dose après la date de péremption mentionnée sur la boîte.', 'Si vous remarquez des effets indésirables non mentionnés dans cette notice, ou si certains effets indésirables deviennent graves, veuillez en informer votre médecin ou votre pharmacien.\n\n## 5. COMMENT CONSERVER DOLIPRANE 150 mg, poudre pour solution buvable en sachet-dose ?\n\nTenir hors de la portée et de la vue des enfants.\n\n## Date de péremption\n\nNe pas utiliser DOLIPRANE 150 mg, poudre pour solution buvable en sachet-dose après la date de péremption mentionnée sur la boîte.', ""Contre-indications\n\nNe prenez jamais DOLIPRANE 100 mg, poudre pour solution buvable en sachet-dose en cas de:\n\n- \uf0b7 allergie connue au paracétamol ou aux autres constituants,\n- \uf0b7 maladie grave du foie.\n\nEN CAS DE DOUTE, IL EST INDISPENSABLE DE DEMANDER L'AVIS DE VOTRE MEDECIN OU DE VOTRE PHARMACIEN.\n\nPrécautions d'emploi ; mises en garde spéciales\n\nFaites attention avec DOLIPRANE 100 mg, poudre pour solution buvable en sachetdose:\n\n## Mises en garde spéciales"", '## Dénomination du médicament\n\n## DOLIPRANE 150 mg, poudre pour solution buvable en sachet-dose\n\n## Encadré\n\nVeuillez lire attentivement cette notice avant de prendre ce médicament. Elle contient des informations importantes pour votre traitement.', ""## Contre-indications\n\nNe prenez jamais DOLIPRANE 150 mg, poudre pour solution buvable en sachet-dose en cas de:\n\n- · allergie connue au paracétamol ou aux autres constituants,\n- · maladie grave du foie.\n\nEN CAS DE DOUTE, IL EST INDISPENSABLE DE DEMANDER L'AVIS DE VOTRE MEDECIN OU DE VOTRE PHARMACIEN.\n\n## Précautions d'emploi ; mises en garde spéciales\n\nFaites attention avec DOLIPRANE 150 mg, poudre pour solution buvable en sachet-dose:\n\nMises en garde""]",Information non trouvée dans le contexte fourni. Veuillez consulter un professionnel de santé.,"Non, ce médicament ne doit pas être utilisé en cas d inflammation recente anale.",1.0,0.0,0.249999999975,1.0,0.08780003927456213,0.35120015709824853,Q14
Quels sont les cas à ne pas utiliser DEXOREN 0.25mg comp ,"['## La substance active est:\n\nOxcarbazépine ................................................................................................................................. 150 mg\n\nPour un comprimé pelliculé.\n\n## Les autres composants sont:', 'Comme tous les médicaments, HEMI-DAONIL 2,5 mg, comprimé sécable peut provoquer des effets indésirables, mais ils ne surviennent pas systématiquement chez tout le monde.', ""<!-- image -->\n\nGardez cette notice, vous pourriez avoir besoin de la lire à nouveau. Si vous avez d'autres questions, adressez-vous à votre médecin ou à votre pharmacien. Ce médicament vous a été personnellement prescrit. Ne le donnez à personne d'autre. Vous risqueriez de lui causer du tort. même si elle présente les mêmes symptômes que vous.\n\n## Lessubstances actives sont:\n\nDexaméthasone (phosphate sodique de)\n\n.\n\n.\n\nFramycétine (sulfate de)\n\n.\n\n.\n\n.\n\n100\n\nmg\n\n630000\n\nUI\n\npour\n\n100\n\nml\n\n."", "",\n\n## ,\n\noUJours pre re ce m lcamen exa emen comme ns c e no xe ou qu 1 YOUS a été rKommandé par YOtremédecin ou pharmacien. Encas de doute demander conseil à l'Otr&lt; médecin ou pharmacien.\n\nCha les .nf.nts. partir de 3 mois une dose individuelle de 5110 mg de paracétamol/kg du poids corporel doit être utilisée pour traiter la lièvre et les doulturs."", ""Qu'est-ce que CÉLESTÈNE2 mg et contenu de l'emballage extérieur? Ce médicament se présente sous forme de comprimé dispersible sécable. Boîte de 1 flacon de 20 comprimés.\n\nDétenteur de D.E.\n\n## MSDFRANCE\n\n34, avenue Léonard de Vinci\n\n92400 Courbevoie\n\nFrance\n\n## Fabricant, Conditionneur et Libérateur SCHERING-PLOUGH\n\n2 rue Louis Pasteur\n\n14200 Herouville Saint Clair\n\nFrance\n\nALGERIE D.E. N°: 1S/ 04/ 09 H 133/024. DATE DE REVISION DE LA NOTICE: JANVIER 2016 LISTE 1\n\nfJO;)\n\n,.;)\n\n\\....\n\n2,00 mg"", ""Sans objet.\n\n## Contre-indications\n\n## N'UTILISEZ JAMAIS DEXAFREE 1 mg/ml, collyre en solution en récipient unidose :""]","Ceci signifie que HEMI-DAONIL 2,5 mg, comprimé sécable ne doit pas être utilisé dans les cas suivants :
- Si vous êtes allergique à l'oxcarbazépine ou à l'un des autres composants du médicament.
- Lorsqu'il est associé aux médicaments vincristine et miltéfosine.",Ce médicament ne doit pas être utilisé dans les cas de certaines anomalies du fonctionnement cardiaque et en association avec le sultopride ou des injections intraveineuses de calcium.,0.3333333333333333,0.6869686213865186,0.3333333333,1.0,0.0949315024695093,0.3797260098780372,Q15
quels sont les Effets indésirables possibles de cital 50mg comp?,"['Si un des effets indésirables listés vous gêne considérablement ou si vous remarquez des effets indésirables non mentionnés sur cette notice ou, informez votre médecin ou votre pharmacien.\n\n## 5. COMMENT CONSERVER ANDROCUR 50 MG?\n\nMédicament à conserver hors de portée des enfants.', ""## Si vous arrêtez de prendre IMATINIB CIPLA 100 mg, gélule :\n\nSans objet.\n\n## 4. QUELS SONT LES EFFETS INDESIRABLES EVENTUELS ?\n\nComme tous les médicaments, ce médicament peut provoquer des effets indésirables, mais ils ne surviennent pas systématiquement chez tout le monde.\n\nCertains effets indésirables peuvent être graves. Prévenez immédiatement votre médecin si vous présentez l'un des effets suivants :"", ""Sans objet.\n\n## Risque de syndrome de sevrage\n\nSi vous avez d'autres questions sur l'utilisation de ce médicament, demandez plus d'informations à votre médecin ou à votre pharmacien.\n\n## 4. QUELS SONT LES EFFETS INDESIRABLES EVENTUELS ?\n\n## Description des effets indésirables\n\nComme tous les médicaments, TRACRIUM 50 mg/5 ml (1 POUR CENT), solution injectable en ampoule est susceptible d'avoir des effets indésirables, bien que tout le monde n'y soit pas sujet."", ""Si vous avez d'autres questions sur l'utilisation de ce médicament, demandez plus d'informations à votre médecin ou à votre pharmacien.\n\n## 4. QUELS SONT LES EFFETS INDESIRABLES EVENTUELS ?\n\n## Description des effets indésirables\n\nComme tous les médicaments, TIENAM 500 mg/500 mg poudre pour solution pour perfusion peut provoquer des effets indésirables, mais ils ne surviennent pas systématiquement chez tout le monde."", ""Si vous avez d'autres questions sur l'utilisation de ce médicament, demandez plus d'informations à votre médecin ou à votre pharmacien.\n\n## 4. QUELS SONT LES EFFETS INDESIRABLES EVENTUELS ?\n\n## Description des effets indésirables\n\nComme tous les médicaments LESCOL L.P. 80 mg, comprimé pelliculé à libération prolongée peut provoquer des effets indésirables, mais ils ne surviennent pas systématiquement chez tout le monde."", ""## Description des effets indésirables\n\nComme tous les médicaments, RELPAX 40 mg, comprimé pelliculé est susceptible d'avoir des effets indésirables, bien que tout le monde n'y soit pas sujet.\n\nSi vous remarquez des effets indésirables non mentionnés dans cette notice, ou si certains effets indésirables deviennent graves, veuillez en informer votre médecin ou votre pharmacien.""]","Ceci signifie que CITAL 50 mg comp peut avoir des effets indésirables, bien que tout le monde n'en fasse pas l'expérience. Si vous remarquez des effets indésirables qui ne sont pas listés dans la notice ou si certains effets indésirables s'aggravent, vous devriez en informer votre médecin ou votre pharmacien.","Les effets indésirables possibles de CITAL 50mg comprimé incluent : troubles de la vision ; bouffées de chaleur, maux de tête, étourdissement, vertiges ; troubles digestifs ; règles plus abondantes, saignement entre les règles ; nervosité, insomnie, état dépressif ; envie d'uriner fréquente ; réaction allergique cutanée ; et augmentation de la probabilité d'une grossesse multiple.",0.5,0.9750512235625172,0.7099999999858001,1.0,0.481585668261553,0.7263426730462121,Q16
Quels sont les signes d'un surdosage du médicament DEXOREN 0.25mg comp ?,"[""## Posologie usuelle :\n\nTraitement d'attaque : une forte dose est parfois prescrite par le médecin pendant quelques jours, sous surveillance médicale.\n\nTraitement d'entretien : la posologie est adaptée par le médecin en fonction de l'effet recherché ; une analyse de sang permet de connaître la concentration du médicament dans le sang : en effet, le risque de surdosage est important.\n\n## Effets indésirables possibles du médicament DEXOREN ®\n\nIls sont le plus souvent le signe d'un surdosage :"", ""## CONDUITE A TENIR EN CAS DE SURDOSAGE\n\nEncas de surdosage avertir immédiatement votre médecin. Less p ô es d'un surdosage (pour des doses allant ju'qu'à 20 g) sont nausees, vomissements, diarrhées, vertiges et dans un cas, ombalgies avec oligurie,\n\nL'aüopurinol et son métabolite sont dialysables.\n\nD'une façon générale, il est recommandé de demander l'avis de votre médecin ou de votre pharmacien en cas\n\nde doute et de signaler tout traitement en cours ou tout\n\neffet non\n\nsouhai\n\né e gênant"", ""Ne jetez aucun médicament au tout-à-l'égout ni avec les ordures ménagères. Demandez à votre pharmacien d'éliminer les médicaments que vous n'utilisez plus. Ces mesures contribueront à protéger l'environnement.\n\n## 6. INFORMATIONS SUPPLEMENTAIRES\n\n## Liste complète des substances actives et des excipients\n\n## Aspect de DEXAFREE 1 mg/ml, collyre en solution en récipient unidose ?\n\n## La substance active est:"", ""<!-- image -->\n\n## Digitalique\n\n## Dans quel cas le médicament DEXOREN ® est-il prescrit ?\n\nCe médicament aux propriétés multiples appartient à la famille des digitaliques : il agit sur le cœur en permettant essentiellement d'en renforcer les contractions et de ralentir son rythme lorsqu'il est excessif.\n\nIl est utilisé dans le traitement de l' insuffisance cardiaque et de certaines tachycardies.\n\n## Présentations du médicament DEXOREN ®\n\nDEXOREN ® 0,25 mg\n\n: comprimé sécable ; boîte de 20"", ""Sans objet.\n\n## Contre-indications\n\n## N'UTILISEZ JAMAIS DEXAFREE 1 mg/ml, collyre en solution en récipient unidose :"", ""## Prise d'autres médicaments\n\nIl est important d'indiquer à votre médecin ou à votre pharmacien si vous prenez ou avez pris récemment un autre médicament, même s'il s'agit d'un médicament obtenu sans ordonnance. Cela inclut les préparations à base de plantes. Ceci parce que RENITEC 20 mg, comprimé sécable peut agir sur le mécanisme d'action de certains médicaments. Les autres médicaments peuvent également modifier le mécanisme d'action de RENITEC 20 mg, comprimé sécable.""]","Ceci signifie que : les signes d'un surdosage du médicament DEXOREN 0.25mg comprimé sont des nausées, vomissements, diarrhées, vertiges et dans certains cas, douleurs aux reins avec peu d'urine.","Les effets indésirables sont le plus souvent le signe d un surdosage : nausées, vomissements, diarrhée, perte de l appétit, coloration en jaune de la vision, vertiges, maux de tête, troubles psychiques (notamment chez la personne âgée), troubles du rythme cardiaque variés, palpitations.",0.2,0.9730002949232816,0.6666666666444444,1.0,0.6386481974641927,0.3727746080385888,Q17
Est-ce que je peux prendre le médicament ipnodis 5mg ml sol inj si j'si des troubles respiratoires?,"[""## EN CAS DE DOUTE NE PAS HESITER A DEMANDER L'AVIS DE VOTRE MEDECIN OU DE VOTRE PHARMACIEN.\n\n## Interactions avec d'autres médicaments\n\n## Autres médicaments et GARDENAL 40 mg/2 ml, poudre et solvant pour solution injectable\n\nVous devez prévenir votre médecin si vous prenez l'un des médicaments suivants :"", ""Demandez à votre médecin ou votre pharmacien plus d'informations sur les effets indésirables.\n\nSi vous remarquez des effets indésirables non mentionnés dans cette notice, ou si certains effets indésirables deviennent graves, veuillez en informer votre médecin ou votre pharmacien.\n\n## 5. COMMENT CONSERVER SINGULAIR 5 mg, comprimé à croquer ?\n\nTenir hors de la portée et de la vue des enfants.\n\n## Date de péremption"", ""## Durée  du  traitement\n\nN'arrêtez pas la prise de PAKEDAL sans l'avis  de votre médecin. L'interruption de votre traitement devra étre réalisée de maniére progressive. Si vous arrétez de prendre PAKEDAL  brutalement ou  avant que  votre médecin  ne  vous  l'ait demandé, vous vous exposez à un risque accru de crises.\n\n## CONTRE  INDICATIONS:\n\nNe  prenez  jamais PAKEDAL  200  mg/ml,  solution  buvable:"", ""## Risque de syndrome de sevrage\n\n## Si vous arrêtez de prendre RISPERDAL 1 mg/ml, solution buvable:\n\nVous ne devez pas arrêter de prendre ce médicament sans que votre médecin vous ait dit de le faire. Vos symptômes peuvent réapparaître. Si votre médecin décide d'arrêter ce médicament, votre posologie pourra être progressivement diminuée sur plusieurs jours.\n\nSi vous avez d'autres questions sur l'utilisation de ce médicament, demandez plus d'informations à votre médecin ou à votre pharmacien."", ""Dans ce cas, l'administration du produit sera arrêtée, et vous recevrez de votre médecin un traitement approprié.\n\n## Si vous oubliez d'utiliser RAPIFEN 5 mg (0,5 mg/ml), solution injectable\n\nSans objet.\n\n## Si vous arrêtez d'utiliser RAPIFEN 5 mg (0,5 mg/ml), solution injectable\n\nSans objet.\n\nSi vous avez d'autres questions sur l'utilisation de ce médicament, demandez plus d'informations à votre médecin ou à votre pharmacien.\n\n## 4. QUELS SONT LES EFFETS INDESIRABLES EVENTUELS ?"", ""En signalant les effets indésirables, vous contribuez à fournir davantage d'informations sur la sécurité du médicament.\n\n## 5. COMMENT CONSERVER RAPIFEN 5 mg (0,5 mg/ml), solution injectable ?\n\nTenir ce médicament hors de la vue et de la portée des enfants.\n\nN'utilisez pas ce médicament après la date de péremption indiquée sur la boite après EXP. La date de péremption fait référence au dernier jour de ce mois.\n\nAprès ouverture : le produit doit être utilisé immédiatement.""]","Ceci signifie que : Aucune information spécifique concernant les troubles respiratoires et l'utilisation de GARDENAL 40 mg/2 ml, poudre et solvant pour solution injectable n'a été fournie dans le contexte.",vous devez informer le medecin avant de prendre Ipnodis si vous avez des difficultés respiratoires,0.0,0.0,0.4499999999775,1.0,0.08172281402100201,0.32689125608400804,Q18
"est-il possible de prendre Cerazette 0,75 mg comp durant la grossesse ?","['- 2. QUELLES SONT LES INFORMATIONS A CONNAITRE AVANT DE PRENDRE TAREG 80 mg, comprimé pelliculé ?', ""- · Si vous avez plus de 12 heures de retard pour la prise d'un comprimé, la fiabilité de Cerazette peut se trouver diminuée. Plus vous avez oublié de comprimés consécutifs, plus important est le risque de réduction de l'efficacité contraceptive. Prenez le dernier comprimé oublié dès que vous vous en rendez compte et continuez à prendre les comprimés suivants au moment habituel. Utilisez également une méthode contraceptive supplémentaire (méthode de barrière) pendant les 7 jours suivants de la"", ""- · Si vous avez plus de 12 heures de retard pour la prise d'un comprimé, la fiabilité de Cerazette peut se trouver diminuée. Plus vous avez oublié de comprimés consécutifs, plus important est le risque de réduction de l'efficacité contraceptive. Prenez le dernier comprimé oublié dès que vous vous en rendez compte et continuez à prendre les comprimés suivants au moment habituel. Utilisez également une méthode contraceptive supplémentaire (méthode de barrière) pendant les 7 jours suivants de la"", ""## Chez l'homme:\n\nSivous avez oublié de prendre les comprimés dans les temps, continuer tout de même la thérapie en omettant les comprimés oubliés conformément aux instructions. Ne pas prendre de double dose d'Androcur 50 mg pour rattraper des comprimés oubliés.\n\n## Si vous interrompez la prise d'Androcur 50 mg:"", '- 2. QUELLES SONT LES INFORMATIONS A CONNAITRE AVANT DE PRENDRE LESCOL L.P. 80 mg, comprimé pelliculé à libération prolongée ?', ""## Si vous avez pris plus de Cerazette que vous n'auriez dû\n\nSi vous avez pris trop de Cerazette, prenez immédiatement contact avec votre médecin ou votre phanmacien. Il n'y a pas eu de rapports d'effets néfastes sérieux suite à la prise d'un trop grand nombre de comprimés de Cerazette en une fois. Les symptômes qui peuvent apparaître sont des nausées, des vomissements et, chez les jeunes filles, des saignements vaginaux légers. Demandez l'avis de votre médecin.""]",Ceci signifie que : Aucune information directe sur la prise de Cerazette durant la grossesse dans le contexte fourni.,Il est déconseillé de prendre Cerazette pendant la grossesse,0.5,0.0,0.16666666665,0.0,0.17334440387224803,0.6933776154889921,Q19
quels sont les effects indesirables du maalox maux destomac?,"[""Sivous remarquez des eftets indésorables non mentionnés dans cette notice, ou si certains effets indësirebles deviennent graves, veuillez en informer votre médecin ou votre pharmacien .\n\n## -.;5'-', COMMENTCONSERVER MAALOX',suspension buvable en flacon? erur hors de la portee et de la vue des enfants. -----\n\nDate de péremption\n\nNe pas utiliser\n\nMAALOX',suspension buvable en flacon après la date de péremption\n\nmentionnée sur\n\nle conditionnement\n\nextérieur."", ""1.QU'ESHE QUEMAALOX',suspension buvable en flacon ETDANSQUELSCAS ..fSUi UTtLlSE? \\_ \\_\\_\n\ntndications tlWrapeutiques: Ce médicament est indiqué chez l'adulte (à partir de 15 ans) dans les brûlures d'estomac et remontées acides.\n\n## 2. QUEUESSONTLESINFORMATIONS ACONNAITREAVANTDEPRENDRE\n\n## MAALOX',suspension buvable en flacon?\n\nListe des informations nécessaires avant la prise du médicament"", ""l'effet d'Androcur 50 mg utilisé pour réduire les pulsions sexuelles peut être diminué en cas de consommation simultanée d'alcool en raison de l'effet désinhibiteur de l'alcool.\n\nAvant le début du traitement chez la femm amen médical gynécologique approfondi (comprenant un examen mammaire et un ro e l'utérus) doit être pratiqué et une grossesse doit impérativement être exclue."", ""## Attention\n\nEn cas d'urticaire ou de troubles nerveux, prévenez votre médecin avant de poursuivre le traitement.\n\nDes précautions sont nécessaires chez les personnes ayant des antécédents d'anomalie de la numération formule sanguine.\n\nÉvitez l'absorption de boissons alcoolisées ou de médicaments contenant de l'alcool pendant le traitement : risque d'effet antabuse.\n\nLa suspension buvable contient du sucre (saccharose) en quantité notable."", ""- · Ce  médicament  ne  pourra  généralement  pas  vous  être  administré  si  vous  consommez  des  boissons alcoolisées,  si  vous  prenez  des  médicaments  contenant  de  l'alcool,  ou  si  vous  prenez  du  crizotinib  ou  de l'idélalisib  (médicaments  anticancéreux),  ou  de  l'oxybate  de  sodium  (voir  rubrique  «  Autres  médicaments  et SUFENTA 10 microgrammes/2 ml, solution injectable (I.V. ou péridurale) »)."", ""Des irritations et une sécheresse de la peau, en cas d'applications fréquentes (en raison de la présence d'alcool). Dans tous ces cas, avertir votre médecin.\n\nSi vous remarquez des effets indésirables non mentionnés dans cette notice, ou si certains effets indésirables deviennent graves, veuillez en informer votre médecin ou votre pharmacien.\n\n## SURDOSAGE:\n\nSi vous avez pris plus de KETUM~ 2,5 %, gel que vous n'auriez dû:""]","Ceci signifie que MAALOX, suspension buvable en flacon est un médicament destiné aux adultes souffrant de brûlures d'estomac et de remontées acides, et sa formulation contient une quantité notable de sucre.","Les effets indésirables possibles de Maalox incluent : troubles digestifs comme la diarrhées ou la constipation et, en cas d'utilisation prolongée ou à fortes doses, une diminution du taux de phosphore dans le sang. ",1.0,0.5759402963785335,0.499999999975,1.0,0.15373636369221225,0.614945454768849,Q20
est ce que je peux  injecter le medicament insuman rapid 100ui sol dans la veine a la maison?,"[""Sans objet.\n\n## 3. COMMENT UTILISER DETICENE 100 mg, poudre et solvant pour solution pour perfusion ?\n\n## Instructions pour un bon usage\n\n## Posologie\n\nVotre médecin évaluera la dose à administrer selon votre état de santé.\n\n## Mode et voie d'administration\n\nCe médicament sera préparé et vous sera injecté par un professionnel de santé :\n\n- · soit dans une veine (perfusion intra veineuse), -\n- · soit dans une artère (perfusion intra artérielle). -"", ""- · au cours de la perfusion, une fuite du médicament hors de la veine perfusée peut provoquer une douleur très vive  au  point  d'injection  parfois  associée  à  une  lésion  de  la  peau.  Si  vous  ressentez  cet  effet,  vous  devez immédiatement le signaler au médecin ou à l'infirmière qui vous administre le produit,"", ""Ce médicament se présente sous forme de solution injectable pour perfusion en ampoules. Boîte de 1, 10, 15 ou 20.\n\nNom et adresse du titulaire de l'autorisation de mise sur le marché et du titulaire de l'autorisation de fabrication responsable de la libération des lots, si différent\n\n## Titulaire\n\n## Pierre FABRE MEDICAMENT\n\n45, place Abel Gance\n\n92100 BOULOGNE\n\n## Exploitant\n\n## Pierre FABRE MEDICAMENT\n\n45, place Abel Gance 92100 BOULOGNE\n\n## Fabricant\n\n## Pierre FABRE MEDICAMENT"", ""## Mode d'administration\n\nInsuman Rapid est une solution destinée à être injectée sous la peau ou, dans des circonstances exceptionnelles, dans une veine (vaisseau sanguin).\n\nVotre médecin vous montrera dans quelle zone cutanée vous devez injecter votre insuline. A chaque injection d'insuline, vous devez changer de point de piqûre au sein d'une zone cutanée donnée."", ""## Mode d'administration\n\nVoie injectable.\n\nCe médicament ne doit être administré que par voie veineuse en perfusion LENTE pendant au moins 30 minutes pour 200 mg de solution d'ofloxacine à injecter.\n\n## Fréquence d'administration\n\n1 à 2 administration(s) par 24 heures.\n\n## Durée du traitement\n\nPour être efficace, cet antibiotique doit être utilisé régulièrement aux doses prescrites, et aussi longtemps que votre médecin vous l'aura conseillé."", 'le site d injection de maniëre aseptique comme conseillé par votre médecin point |']",Ceci signifie que DETICENE est un médicament destiné à être administré par voie veineuse sous forme de perfusion lente pendant au moins 30 minutes.,"Non, l'administration d'insuline dans la veine exige de l'expérience et des précautions rigoureuses. Pour ces raisons, cela doit être fait en milieu hospitalier ou dans une structure spécialisée similaire, et non à domicile.",1.0,0.2557896332714183,0.9666666666473333,1.0,0.1541366638437729,0.6165466553750916,Q21
"C est quoi la thrombose associée avec Cerazette 0,75 mg comprimé ?","['Les effets indésirables sérieux associés à l\'utilisation de Cerazette sont décrits dans les paragraphes ""Cancer du sein"" et ""Thrombose"" dans la rubrique 2 ""Dans quel cas, vous ne pouvez pas prendre ce médicament ou les cas où vous devriez être extrêmement prudent"". Pour plus d\'informations veuillez lire cette rubrique et, si nécessaire, consultez immédiatement votre médecin.', ""Commencez à prendre Cerazette le lendemain de la prise du dernier comprimé de la plaquette de votre pilule actuelle ou le jour du retrait de l'anneau vaginal ou du patch transdermique (donc pas d'intervalle sans pilule, anneau ou patch). Si la plaquette de votre pilule actuelle contient des comprimés placebo (donc sans hormones), vous devez commencer à prendre Cerazette le lendemain de la prise du dernier comprimé actif (en cas de doute, demandez à votre médecin ou à votre pharmacien de quel"", '- -vous avez ou avez eu un cancer du sein.\n- -vous avez un cancer du foie car il n\'est pas possible d\'exclure un éventuel effet de Cerazette.\n- -vous avez eu une thrombose.\n- -vous êtes diabétique.\n- -vous souffrez d\'épilepsie (voir rubrique"" Autres médicaments et Cerazette »).\n- -vous souffrez de tuberculose (voir rubrique"" Autres médicaments et Cerazette »],\n- -vous avez une tension artérielle élevée.', ""- -Si vous êtes allergique au désogestrel ou à l'un des autres composants de Cerazette (mentionnés dans la rubrique 6)\n- -Si vous souffrez de thrombose. Une thrombose est la formation d'un caillot de sang dans un vaisseau sanguin [par exemple au niveau d'une jambe (thrombose veineuse profonde) ou des poumons (embolie pulmonaire)].\n- -Si vous avez ou avez eu la jaunisse (jaunissement de la peau) ou une maladie grave du foie et que votre fonction hépatique n'est toujours pas normale."", ""Pour un comprimé.\n\n· Les autres composants sont : hypromellose, amidon de maïs prégélatinisé, cellulose microcristalline, fumarate de stéaryle sodique.\n\n## Qu'est-ce que TRIATEC 1,25 mg, comprimé et contenu de l'emballage extérieur"", 'PRÉSEIffATiONS-,\n\n--\n\nCLOVIR est disponible en 200mg, comprimés,\n\n## Ceci est un médicament']","Ceci signifie que la thrombose est un effet indésirable sérieux associé à l'utilisation de Cerazette 0,75 mg comprimé."," Une thrombose est la formation d'un caillot de sang susceptible d'obstruer un vaisseau sanguin, souvent dans une veine profonde de la jambe (thrombose veineuse profonde) ou dans les poumons (embolie pulmonaire) Le risque de thrombose est plus élevé chez les utilisatrices de pilules contraceptives, mais il est plus faible avec Cerazette, qui contient uniquement un progestatif, comparé aux pilules combinées contenant des œstrogènes.",0.5,0.5190032194139286,0.999999999975,0.5,0.4673465918278813,0.6693863673115249,Q22
 ce que Risperdal Consta LP 25mg est un medicament psychotrope?,"[""<!-- image -->\n\nANSM - Mis à jour le : 12/04/2016\n\n## Dénomination du médicament\n\n## RISPERDALCONSTA L.P. 25 mg/2 ml, poudre et solvant pour suspension injectable à libération prolongée en seringue préremplie\n\nRispéridone\n\n## Encadré\n\nVeuillez lire attentivement cette notice avant d'utiliser ce médicament car elle contient des informations importantes pour vous."", ""<!-- image -->\n\nANSM - Mis à jour le : 12/04/2016\n\n## Dénomination du médicament\n\n## RISPERDALCONSTA L.P. 50 mg/2 ml, poudre et solvant pour suspension injectable à libération prolongée en seringue préremplie\n\nRispéridone\n\n## Encadré\n\nVeuillez lire attentivement cette notice avant d'utiliser ce médicament car elle contient des informations importantes pour vous."", ""Si vous êtes actuellement traité par d'autres antipsychotiques oraux que la rispéridone, votre dose initiale dépendra de votre traitement actuel. Votre médecin choisira RISPERDALCONSTA L.P. 25 mg ou 37,5 mg.\n\nVotre médecin décidera de la dose de RISPERDALCONSTA L.P. adaptée pour vous.\n\n## Dose d'entretien"", ""Si vous êtes actuellement traité par d'autres antipsychotiques oraux que la rispéridone, votre dose initiale dépendra de votre traitement actuel. Votre médecin choisira RISPERDALCONSTA L.P. 25 mg ou 37,5 mg.\n\nVotre médecin décidera de la dose de RISPERDALCONSTA L.P. adaptée pour vous.\n\n## Dose d'entretien"", ""## 1. QU'EST-CE QUE RISPERDALCONSTA L.P. 25 mg/2 ml, poudre et solvant pour suspension injectable à libération prolongée en seringue préremplie ET DANS QUELS CAS EST-IL UTILISE ?\n\n## Classe pharmacothérapeutique\n\nRISPERDALCONSTA L.P. 25 mg/2 ml, poudre et solvant pour suspension injectable à libération prolongée en seringue préremplie appartient à un groupe de médicaments appelés « antipsychotiques ».\n\n## Indications thérapeutiques"", ""Si vous commencez ou arrêtez un traitement avec ces médicaments vous pourriez avoir besoin d'une dose différente de rispéridone.\n\nSi vous n'êtes pas certain que ce qui précède s'applique à vous, parlez-en à votre médecin ou à votre pharmacien avant d'utiliser RISPERDALCONSTA L.P. 25 mg/2 ml, poudre et solvant pour suspension injectable à libération prolongée en seringue préremplie.\n\n## Interactions avec les aliments et les boissons""]","Ceci signifie que : RISPERDALCONSTA L.P. 25 mg/2 ml, poudre et solvant pour suspension injectable à libération prolongée en seringue préremplie est un médicament psychotrope, appartenant à la classe des antipsychotiques.","Oui, Risperdal Consta LP 25mg est un medicament psychotrope ",0.3333333333333333,0.8000895277943151,0.6333333333122222,0.0,0.4936333881881074,0.7745335527524295,Q23
Est-ce que je peux utiliser voltarene emulgel 0.01 pour traiter l'eczema?,"['Dans certains cas, il est possible que survienne un eczéma allergique avec parfois des lésions éloignées du lieu de traitement, il faut immédiatement arrêter le traitement et avertir votre médecin.\n\nSi vous remarquez des effets indésirables non mentionnés dans cette notice, ou si certains effets indésirables deviennent graves, veuillez en informer votre médecin ou votre pharmacien.\n\n## 5. COMMENT CONSERVER FUCIDINE 2 POUR CENT, crème ?\n\nTenir hors de la portée et de la vue des enfants.', ""Si vous ressentez un quelconque effet indésirable, parlez-en à votre m édecin, votre pharm acien ou à votre infirm ier/ère. Ceci s'applique aussi à tout effet indésirable qui ne serait pas m entionné dans cette notice. Vous pouvez égalem ent déclarer les effets indésirables directem ent via le systèm e national de déclaration: en Belgique :  Agence fédérale des m édicam ents et des produits de santé. Division Vigilance. EUROSTATION II. Place Victor Horta, 40/ 40. B-1060 Bruxelles. (Site"", ""Si vous ressentez un quelconque effet indésirable, parlez-en à votre m édecin ou votre pharm acien. Ceci s'applique aussi à tout effet i n dési rabl e qui  n e serai t pas m enti onné dans cette noti ce. Vous pouvez égalem ent déclarer les effets indésirables directem ent via le système national de déclaration: en Belgique: Agence fédérale des m édicam ents et des produits de santé. Division Vigilance. EUROSTATION II. Place Victor Horta, 40/ 40. B-1060 Bruxelles. (Site internet: www.afm ps.be,"", ""Si vous ressentez un quelconque effet indésirable, parlez-en à votre médecin ou votre pharmacien. Ceci s'applique aussi à tout effet indésirable qui ne serait  pas mentionné dans cette notice. V ous pouvez également déclarer les effets indésirables directement via : Belgique : Agence fédérale des médicaments et des produits de santé, Division Vigilance, EUROSTATION II, Place Victor Horta, 40/40, B-1060 Bruxelles, Site internet: www.afmps.be, e-mail: patientinfo@fagg-afmps.be; Luxembourg:"", ""## Déclaration des effets secondaires\n\nSi vous ressentez un quelconque effet indésirable, parlez-en à votre m édecin ou votre pharm acien. Ceci s'applique aussi à tout effet i n dési rabl e qui  n e serai t pas m enti onné dans cette noti ce. Vous pouvez égalem ent déclarer les effets indésirables directem ent via :\n\n## Belgique\n\nAgence fédérale des m édicam ents et des produits de santé - Division Vigilance\n\nEUROSTATION II - Place Victor Horta, 40/ 40 - B-1060 Bruxelles"", 'Dans ce cas, ne le sous-estimez pas et consultez votre médecin.\n\n## Fréquence indéterminée :']",Information non trouvée dans le contexte fourni. Veuillez consulter un professionnel de santé., Voltarene Emulgel gel ne doit pas être utilisé sur des zones de peau affectes par des lésions comme l'eczéma,1.0,0.0,0.699999999965,1.0,0.06314140467714123,0.2525656187085649,Q24
quels sont les médicaments qui peuvent affecter l'activité d'IRESSA 250mg comp pelli  ?,"['Comme tous les médicaments, HEMI-DAONIL 2,5 mg, comprimé sécable peut provoquer des effets indésirables, mais ils ne surviennent pas systématiquement chez tout le monde.', ""Sans objet.\n\n## Risque de syndrome de sevrage\n\n## Si vous arrêtez de prendre MODOPAR 250 (200 mg/50 mg), gélule:\n\nL'interruption brutale du traitement peut provoquer l'apparition d'une rigidité musculaire, tremblements, agitation, confusion, fièvre.\n\n## 4. QUELS SONT LES EFFETS INDESIRABLES EVENTUELS ?\n\n## Description des effets indésirables\n\nComme tous les médicaments, ce médicament peut provoquer des effets indésirables, mais ils ne surviennent pas systématiquement chez tout le monde."", ""Les médicaments ne doivent pas être jetés au tout à l'égout ou avec les ordures ménagères. Demandez à votre pharmacien ce qu'il faut faire des médicaments inutilisés. Ces mesures permettront de protéger l'environnement.\n\n## 6. INFORMATIONS SUPPLEMENTAIRES\n\n## Liste complète des substances actives et des excipients\n\n## Que contient TRILEPTAL 150 mg, comprimé pelliculé ?\n\n## La substance active est:"", ""## Faites attention avec ANAFRANIL 75 mg, comprimé pelliculé sécable:\n\n## Mises en garde spéciales\n\nNe pas interrompre brutalement le traitement.\n\nComme pour tous les autres antidépresseurs, l'action de ce médicament ne se manifeste qu'au bout de plusieurs jours. Il est donc important de poursuivre le traitement régulièrement, même en l'absence d'amélioration immédiate, sauf avis contraire de votre médecin.\n\n## Idées suicidaires et aggravation de votre dépression ou de votre trouble anxieux"", ""Les médicaments ne doivent pas être jetés au tout à l'égout ou avec les ordures ménagères. Demandez à votre pharmacien ce qu'il faut faire des médicaments inutilisés. Ces mesures permettront de protéger l'environnement.\n\n## 6. INFORMATIONS SUPPLEMENTAIRES\n\n## Liste complète des substances actives et des excipients\n\n## Que contient TICLID 250 mg, comprimé pelliculé ?\n\n## La substance active est:"", '## Description des effets indésirables\n\nComme tous les médicaments, LASILIX FAIBLE 20 mg, comprimé peut provoquer des effets indésirables, mais ils ne surviennent pas systématiquement chez tout le monde.']",Ceci signifie que : Aucune information pertinente trouvée dans le contexte fourni pour répondre à la question sur les médicaments affectant l'activité d'IRESSA 250mg comp pelli.,"Les médicaments qui peuvent affecter l'activité d'IRESSA sont : la phénytoïne, la carbamazépine, la rifampicine, l'itraconazole, les barbituriques, les remèdes à base de plantes contenant du Millepertuis, les inhibiteurs de la pompe à protons, les antagonistes des récepteurs H2 et les anti-acides.",0.0,0.0,0.49999999995,1.0,0.11995551739580924,0.479822069583237,Q25
Le medicament eprex 40000ui ml est utiliser pour traiter quelles maladies ?,"[""<!-- image -->\n\nANSM - Mis à jour le : 27/04/2017\n\n## Dénomination du médicament\n\n## EPREX 40000 UI/mL, solution injectable en seringue préremplie Epoétine alfa\n\n## Encadré\n\nVeuillez lire attentivement cette notice avant d'utiliser ce médicament car elle contient des informations importantes pour vous."", ""<!-- image -->\n\nANSM - Mis à jour le : 27/04/2017\n\n## Dénomination du médicament\n\n## EPREX 4000 UI/mL, solution injectable en seringue préremplie Epoétine alfa\n\n## Encadré\n\nVeuillez lire attentivement cette notice avant d'utiliser ce médicament car elle contient des informations importantes pour vous."", ""<!-- image -->\n\nANSM - Mis à jour le : 27/04/2017\n\n## Dénomination du médicament\n\n## EPREX 10000 UI/mL, solution injectable en seringue préremplie Epoétine alfa\n\n## Encadré\n\nVeuillez lire attentivement cette notice avant d'utiliser ce médicament car elle contient des informations importantes pour vous."", ""## Conduite de véhicules et utilisation de machines\n\nSans objet.\n\n## 3. COMMENT UTILISER EPREX ?\n\nVeillez à toujours utiliser ce médicament en suivant exactement les indications de votre médecin. Vérifiez auprès de votre médecin en cas de doute.\n\nVotre médecin a demandé des analyses sanguines et a décidé que vous deviez être traité par EPREX.\n\nEPREX peut être administré sous forme d'injection :"", ""## Conduite de véhicules et utilisation de machines\n\nSans objet.\n\n## 3. COMMENT UTILISER EPREX ?\n\nVeillez à toujours utiliser ce médicament en suivant exactement les indications de votre médecin. Vérifiez auprès de votre médecin en cas de doute.\n\nVotre médecin a demandé des analyses sanguines et a décidé que vous deviez être traité par EPREX.\n\nEPREX peut être administré sous forme d'injection :"", ""## Conduite de véhicules et utilisation de machines\n\nSans objet.\n\n## 3. COMMENT UTILISER EPREX ?\n\nVeillez à toujours utiliser ce médicament en suivant exactement les indications de votre médecin. Vérifiez auprès de votre médecin en cas de doute.\n\nVotre médecin a demandé des analyses sanguines et a décidé que vous deviez être traité par EPREX.\n\nEPREX peut être administré sous forme d'injection :""]","Ceci signifie que la notice ne fournit pas d'informations sur les maladies spécifiques traitées par EPREX 40000 UI/mL, solution injectable en seringue préremplie.","EPREX est utilisé pour traiter l'anémie symptomatique due à des maladies du rein (chez les enfants en hémodialyse, adultes en hémodialyse ou dialyse péritonéale, et adultes non encore dialysés avec anémie sévère). Il est aussi utilisé dans le traitement de l'anémie chez les adultes sous chimiothérapie pour des tumeurs solides, lymphome malin ou myélome multiple, chez les adultes modérément anémiques donnant leur sang avant une chirurgie, et chez les adultes devant avoir une intervention chirurgicale orthopédique majeure pour diminuer le besoin de transfusions sanguines. Enfin, EPREX est utilisé pour traiter l'anémie chez les adultes atteints de syndromes myélodysplasiques.",1.0,0.713005625028277,0.9999999999833333,1.0,0.12395961884451297,0.49583847537805187,Q26
 quels sont les hormones peuvent etre affecter par le medicament Risperdal Consta LP 25mg ?,"[""## Consultez votre médecin dès que possible.\n\n## Cancer du sein\n\nLes données suggèrent que la prise d'un THS combiné estro-progestatif et possiblement à base d'estrogène seul augmente le risque de cancer du sein. Ce risque supplémentaire dépend de la durée de prise du THS. Ce risque supplémentaire devient évident après plusieurs années. Toutefois, il revient à la normale en quelques années (maximum 5 ans) après l'arrêt du traitement."", ""## consultez votre médecin dès que possible.\n\n## Cancer du sein\n\nLes données suggèrent que la prise d'un THS combiné estroprogestatif et possiblement également les THS à base d'estrogène seul augmente le risque de cancer du sein. Ce risque supplémentaire dépend de la durée de prise du THS.\n\nCe risque supplémentaire devient évident après plusieurs années. Toutefois, il revient à la normale en quelques années (au maximum 5 ans) après l'arrêt du traitement."", ""## Interactions avec d'autres médicaments\n\n## Autres médicaments et RISPERDALCONSTA L.P. 25 mg/2 ml, poudre et solvant pour suspension injectable à libération prolongée en seringue préremplie\n\nInformez votre médecin ou pharmacien si vous prenez, avez récemment pris ou pourriez prendre tout autre médicament.\n\nIl est particulièrement important de parler avec votre médecin ou votre pharmacien si vous prenez l'un des produits suivants"", 'Les substances suwanres peuvent tédu re \'eUet hypog!ycéfr..od\'"" di \'epagmde conrraceprrfs oraux. nfampione, barbltunques, carbamazepme -&gt;BZ!dlÇues, cOflKosreroides, danazo/, hormones rhyrQid"""",,,,,, er symparhooumeClques', ""- · le type d'hormones qu'elles contiennent (œstrogène + progestatif ou progestatifs seuls),\n- · la dose d'hormone qu'elles contiennent (par exemple 50-35-30-20-15 microgrammes d'éthinylestradiol),\n- · la répartition des hormones dans le cycle menstruel (monophasique, biphasique et séquentielle),\n- · la durée de prise dans le cycle (en général 21 jours sur 28 avec arrêt pendant 7 jours, mais parfois 24 jours sur 28 ou 28 jours sur 28 c'est-à-dire prise sans interruption),"", ""- · Les symptômes suivants peuvent apparaître chez les nouveau-nés dont les mères ont utilisé RISPERDALCONSTA L.P. 25 mg/2 ml, poudre et solvant pour suspension injectable à libération prolongée en seringue préremplie durant le dernier trimestre (les trois derniers mois de leur grossesse) : tremblement, raideur et/ou faiblesse musculaire, endormissement, agitation, problème de respiration et difficultés à s'alimenter. Si votre bébé développe l'un de ces symptômes, vous devez contacter votre""]",Ceci signifie que : Risperdal Consta LP 25mg peut affecter le métabolisme des hormones stéroïdiennes et des hormones peuvent aussi affecter le métabolisme de Risperdal Consta LP 2,Risperdal Consta peut augmenter les taux du hormone prolactine.,0.0,0.6305255987889694,0.19999999998,0.0,0.14108842237036578,0.5643536894814631,Q27
"Est-ce que je peux utiliser BRONCHOCALM enfants 0,1 sirop pour un nouveau-né ?","[""## Allaitement\n\nOn ne sait pas si Ventavis passe dans le lait maternel. L'éventualité d'un risque pour l'enfant allaité ne pouvant être exclue, il est préférable de ne pas allaiter pendant le traitement par Ventavis.\n\nDemandez conseil à votre médecin ou à votre pharmacien avant de prendre tout médicament.\n\n## Les nouveau-nés, les jeunes enfants ainsi que les femmes enceintes ne doivent pas être dans la même pièce pendant que vous inhalez Ventavis."", ""## INDICATIONS THÉRAPEUTIQUES\n\nTraitement d'appoint des affections bronchiques aiguës bénignes.\n\n## POSOLOGIE ET MODE D'ADMINISTRATION\n\nVoie rectale\n\nTROPHYL E est contre-indiqué chez l'enfant de moins de 30 mois.\n\nEnfant de plus de 30 mois et de plus de 12 kg : 1 suppositoire TROPHYL E Enfant, matin et soir.\n\n## La durée du traitement est limitée à trois jours\n\nUn usage prolongé n'est pas conseillé, car ce médicament peut provoquer des troubles rectaux.\n\n## CONTRE-INDICATIONS"", '## BronchocQlm®\n\n~/\n\n## Enfants\n\nBromhydrate de dextrométhorphane 0.1 POURCENT\n\n## Lisez attentivement cette notice car elle contient des informations importantes pour vous.', ""## Allaitement\n\nOn ne sait pas si Ventavis passe dans le lait maternel. L'éventualité d'un risque pour l'enfant allaité ne pouvant être exclue, il est préférable de ne pas allaiter pendant le traitement par Ventavis.\n\nDemandez conseil à votre médecin ou à votre pharmacien avant de prendre tout médicament.\n\nLes nouveau-nés, les jeunes enfants ainsi que les femmes enceintes ne doivent pas être dans la même pièce pendant que vous inhalez Ventavis."", ""- Si votre asthme ou votre essoufflement s'aggrave, consultez votre médecin immédiatement. Si vous entendez des sifflements bronchiques plus importants, si vous vous sentez plus souvent oppressé au niveau de la poitrine ou si vous avez plus souvent besoin d'utiliser votre traitement bronchodilatateur de secours, continuez à utiliser Seretide sans augmenter le nombre de bouffées de Seretide. Votre état respiratoire pourrait s'aggraver et vous pourriez alors être davantage malade. Dans ce cas,"", ""Si votre asthme ou votre essoufflement s'aggrave, consultez votre médecin immédiatement. Si vous entendez des sifflements bronchiques plus importants, si vous vous sentez plus souvent oppressé au niveau de la poitrine ou si vous avez plus souvent besoin d'utiliser votre traitement bronchodilatateur de secours, continuez à utiliser Seretide sans augmenter le nombre de bouffées de Seretide. Votre état respiratoire pourrait s'aggraver et vous pourriez alors être davantage malade. Dans ce cas,""]","Ceci signifie que :
- La possibilité de passage de Ventavis dans le lait maternel n'est pas connue, ce qui implique un risque potentiel pour le nourrisson allaité. Il est donc recommandé de ne pas allaiter pendant le traitement par Ventavis.
- Les nouveau-nés, les jeunes enfants et les femmes enceintes ne doivent pas être présents dans la même pièce lors de l'inhalation de Ventavis.","Non, ce médicament ne peut pas etre utiliser pour un nouveau-ne.",1.0,0.47934170332930215,0.8055555555287036,1.0,0.10487103964800111,0.41948415859200444,Q28
"Quels sont les médicaments à ne pas associer avec BRONCHOCALM enfants 0,1 sirop ?","['Ne laisser pas les médicaments à la portée des enfants\n\n<!-- image -->', ""Des bronchospasmes peuvent notamment survenir chez des patients ayant des antécédents d'allergie ou d'asthme.\n\nComme pour tous les médicaments de sa classe, TRACRIUM peut s'avérer être moins efficace chez les brulés. En cas d'utilisation chez ce type de patients, la posologie pourra être augmentée si nécessaire en fonction de l'étendue et du temps écoulé depuis la survenue de la brûlure.\n\n## Interactions avec d'autres médicaments\n\n## Prise ou utilisation d'autres médicaments"", '## BronchocQlm®\n\n~/\n\n## Enfants\n\nBromhydrate de dextrométhorphane 0.1 POURCENT\n\n## Lisez attentivement cette notice car elle contient des informations importantes pour vous.', ""## Mises en garde spéciales\n\nEn cas de survenue de crises ou de gêne respiratoire, n'utilisez pas ce médicament mais un bronchodilatateur bêta2 mimétique par voie inhalée à action rapide et de courte durée (médicament qui augmente le calibre des bronches) que votre médecin vous aura prescrit à cet effet.\n\nLe soulagement habituellement obtenu doit alors être observé rapidement.\n\n## En cas d'échec, consultez immédiatement un médecin."", ""Vous ne devez pas interrompre ce traitement sans avis médical, même en cas d'amélioration très nette des symptômes.\n\nAttention: ce médicament n'est pas un bronchodilatateur.\n\nIl ne permet pas le traitement de la crise d'asthme.\n\nIl n'apporte pas de soulagement immédiat. Il est en particulier sans action sur la crise d'asthme déclarée."", ""NE PAS LAISSER A LA PORTEE DES ENFANTS.\n\n## Interactions avec d'autres médicaments\n\n## Prise ou utilisation d'autres médicaments\n\nAFIN D'EVITER D'EVENTUELLES INTERACTIONS ENTRE PLUSIEURS MEDICAMENTS, notamment la bromocriptine, la cabergoline et le pergolide, les anesthésiques généraux par inhalation, l'ocytocine et les prostaglandines, IL FAUT SIGNALER SYSTEMATIQUEMENT TOUT AUTRE TRAITEMENT EN COURS A VOTRE MEDECIN OU A VOTRE PHARMACIEN, MEME S'IL S'AGIT D'UN MEDICAMENT PRIS SANS ORDONNANCE.""]","Ceci signifie que les médicaments suivants ne doivent pas être associés avec BRONCHOCALM enfants 0,1 sirop : bromocriptine, cabergoline, pergolide, anesthésiques généraux par inhalation, ocytocine et prostaglandines.",Il ne faut pas associer ce médicament avec les IMAO (antidépresseurs) ni avec d autres antitussifs.,0.5,0.9608399804034405,0.7099999999858001,0.0,0.10745492711026505,0.4298197084410602,Q29
Quelle est la dose recommandée de BRONCHOCALM enfants sirop pour un enfant de 45 kg ?,"[""* Ces doses impliquent une surveillance attentive de la respiration au moins 3 heures après la fin de l'intervention.\n\n## Population pédiatrique\n\nDu matériel permettant une ventilation assistée doit toujours être disponible lors de l'utilisation chez l'enfant quel que soit son âge, même lors d'interventions de courte durée chez des enfants respirant spontanément."", ""## 1. QU'EST-CE QUE TROPHIRES COMPOSE ENFANTS, suppositoire ET DANS QUELS CAS EST-IL UTILISE ?\n\n## Classe pharmacothérapeutique\n\nANTALGIQUE périphérique\n\nANTIPYRETIQUE\n\n(N. Système nerveux central)\n\n(R. Système respiratoire)\n\n## Indications thérapeutiques\n\nCe médicament contient du paracétamol.\n\nIl est préconisé dans le traitement de la fièvre au cours des maladies bronchiques aiguës bénignes, chez l'enfant de 16 à 25 kg (soit environ 4 à 8 ans).\n\nLa durée de traitement est limitée à 3 jours."", ""## INDICATIONS THÉRAPEUTIQUES\n\nTraitement d'appoint des affections bronchiques aiguës bénignes.\n\n## POSOLOGIE ET MODE D'ADMINISTRATION\n\nVoie rectale\n\nTROPHYL E est contre-indiqué chez l'enfant de moins de 30 mois.\n\nEnfant de plus de 30 mois et de plus de 12 kg : 1 suppositoire TROPHYL E Enfant, matin et soir.\n\n## La durée du traitement est limitée à trois jours\n\nUn usage prolongé n'est pas conseillé, car ce médicament peut provoquer des troubles rectaux.\n\n## CONTRE-INDICATIONS"", ""## 1. QU'EST-CE QUE TROPHIRES ENFANTS, suppositoire ET DANS QUELS CAS EST-IL UTILISE ?\n\n## Classe pharmacothérapeutique\n\nA VISEE ANTISEPTIQUE. (R. Système respiratoire).\n\n## Indications thérapeutiques\n\nCe médicament est préconisé au cours des affections bronchiques aiguës bénignes chez l'enfant de plus de 12 kg (soit environ 30 mois).\n\nLa durée de traitement est limitée à 3 jours.\n\n## 2. QUELLES SONT LES INFORMATIONS A CONNAITRE AVANT D'UTILISER TROPHIRES ENFANTS, suppositoire ?"", ""THÉOSTAT 200 mg A LIBERATION PROLONGEE, comprimé sécable, appartient à une famille de médicaments appelés les bronchodilatateurs (xanthines). Il agit en augmentant le diamètre des bronches.\n\nCe médicament est utilisé chez l'adulte et l'enfant de plus de 6 ans pour traiter :\n\n- · certaines formes d'asthme (asthme à dyspnée paroxystique, asthme à dyspnée continue),\n- · un encombrement sévère des bronches et des poumons (bronchopneumopathie chronique obstructive) s'accompagnant de spasmes."", ""THEOSTAT 300 mg A LIBERATION PROLONGEE, comprimé sécable appartient à une famille de médicaments appelés les bronchodilatateurs (xanthines). Il agit en augmentant le diamètre des bronches.\n\nCe médicament est utilisé chez l'adulte et l'enfant de plus de 6 ans pour traiter :\n\n- · certaines formes d'asthme (asthme à dyspnée paroxystique, asthme à dyspnée continue),\n- · un encombrement sévère des bronches et des poumons (bronchopneumopathie chronique obstructive) s'accompagnant de spasmes.""]","Ceci signifie que : La dose recommandée de TROPHIRES COMPOSE Enfants pour un enfant de 45 kg est de 1 suppositoire, deux fois par jour.","la dose recommandée pour enfant de 45 kg  est de:  2 cuillères-mesure par prise, à renouveler en cas de besoin au bout de 4 heures, sans dépasser 8 cuillères-mesure par jour.",0.0,0.8092876107227284,0.8333333332916666,1.0,0.17661085978836868,0.7064434391534747,Q30
Quelle est la classe pharma du médicament kyncept 10mg comp orodispersible?,"[""L'allaitement est à éviter pendant le traitement en raison du passage dans le lait maternel.\n\nDemandez conseil à votre médecin ou à votre pharmacien avant de prendre tout médicament.\n\n## Sportifs\n\nCette spécialité contient un principe actif pouvant induire une réaction positive des tests pratiquês lors des contrôles antidopages.\n\nEffets sur l'aptitude à conduire des véhicules ou à utiliser des machines\n\nSans objet.\n\n## 3. COMMENTPRENDRESOLUPREDORO 5 mg, comprimé orodispersible ?\n\n## ~"", ""Comme tous les médicaments, SOLUPREDORO 5 mg, comprimé orodispersible est susceptible d'avoir des effets indésirables, bien que tout le monde n'y soit pas sujet. Ce médicament, indispensable, est le plus souvent bien toléré lorsque l'on suit les recommandations et notamment le régime (voir rubrique · Faites attention avec SOLUPREDORO.5 mg, comprimé orodispersible »]. Il peut néanmoins entraîner, selon la dose et la duree du traitement, des effets plus ou rnoms gênants."", ""Elle est déterminée par votre médecin.\n\nEn cas de traitement prolongé, ne pas arrêter brutalement le traitement mais suivre les recommandations de votre médecin pour la diminution des doses.\n\n## Svmptômes et instructions en cas de surdosage\n\nSans objet.\n\nlnstructionsen cas d'omission d'une ou de plusieurs doses SIvous oubliez de prendre SOLUPRED ORO5 mg, comprimé\n\norodispersible:"", ""## Mises en garde et précautions d'emploi\n\nAdressez-vous à votre médecin ou votre pharmacien avant de prendre RISPERDALORO 1 mg, comprimé orodispersible si :"", ""Si vous prenez ou avez pris récemment un autre médicament, y compris un médicament obtenu sans ordonnance, parlez-en à votre médecin ou à votre pharmacien.\n\n## THEOSTAT 300 mg A LIBERATION PROLONGEE, comprimé sécable avec des aliments, boissons et l'alcool"", ""Demandez à votre médecin ou votre pharmacien plus d'informations sur les effets indésirables.\n\nSi vous remarquez des effets indésirables non mentionnés dans cette notice, ou si certains effets indésirables deviennent graves, veuillez en informer votre médecin ou votre pharmacien.\n\n## 5. COMMENT CONSERVER SINGULAIR 5 mg, comprimé à croquer ?\n\nTenir hors de la portée et de la vue des enfants.\n\n## Date de péremption""]",Information non trouvée dans le contexte fourni. Veuillez consulter un professionnel de santé.,KYNCEPT 10mg appartient à la classe des médicaments appelés inhibiteurs de l'acétylcholinestérase,0.0,0.0,0.49999999995,0.0,0.031410730569149226,0.1256429222765969,Q31
Zyloric 100mg comp est utilisé pour traiter quels problemes de sante ?,"[""Agence nationale de sécurité du médicament et des produits de santé (ANSM) et réseau des Centres Régionaux de Pharmacovigilance Site internet : www.ansm.sante.fr\n\nEn signalant les effets indésirables, vous contribuez à fournir davantage d'informations sur la sécurité du médicament.\n\n## 5. COMMENT CONSERVER ZYLORIC 100 mg, comprimé ?\n\nTenir ce médicament hors de la vue et de la portée des enfants."", ""N'arrêtez pas de prendre ZYLORIC 100 mg, comprimé sans en avoir parlé avec votre médecin.\n\nSi vous avez d'autres questions sur l'utilisation de ce médicament, demandez plus d'informations à votre médecin ou à votre pharmacien.\n\n## 4. QUELS SONT LES EFFETS INDESIRABLES EVENTUELS ?\n\nComme tous les médicaments, ZYLORIC 100 mg, comprimé est susceptible d'entrainer des effets indésirables, mais ils ne surviennent pas systématiquement chez tout le monde."", ""## Enfants\n\nSans objet.\n\n## Autres médicaments et ZYLORIC 100 mg, comprimé\n\nInformez votre médecin ou pharmacien si vous prenez, avez récemment pris ou pourriez prendre l'un des médicaments suivants :"", ""Dans de rares cas, la prise de ce médicament peut entraîner des étourdissements, des vertiges, ou des problèmes de coordination. Si c'est le cas, ne conduisez pas ou n'utilisez pas d'outils ou de machines.\n\nZYLORIC 100 mg, comprimé contient du lactose.\n\nSi votre médecin vous a dit que vous aviez une intolérance à certains sucres, contactez votre médecin avant de prendre ce médicament.\n\n## 3. COMMENT PRENDRE ZYLORIC 100 mg, comprimé ?"", ""L'utilisation de ce médicament est déconseillée, sauf avis contraire de votre médecin, pendant la grossesse.\n\nEn raison du passage de ce médicament dans le lait maternel, il est donc conseillé de ne pas prendre ZYLORIC 100 mg, comprimé au cours de l'allaitement.\n\n## Sportifs\n\nSans objet.\n\n## Conduite de véhicules et utilisation de machines"", ""## Dénomination du médicament\n\n<!-- image -->\n\n## ZYLORIC 100 mg, comprimé Allopurinol\n\n## Encadré\n\nVeuillez lire attentivement l'intégralité de cette notice avant de prendre ce médicament car elle contient des informations importantes pour vous.""]","Ceci signifie que : ZYLORIC 100 mg, comprimé est utilisé pour traiter les problèmes de santé liés à des taux élevés d'acide urique dans le sang, tels que la goutte, les calculs rénaux ou d'autres affections, ainsi que des taux élevés d'acide urique dans le sang dus à certains médicaments ou à une chimiothérapie.","ZYLORIC 100 mg, comprimé est utilisé pour réduire la formation de dépôts d’acide urique responsables de la goutte, de certains types de calculs rénaux ZYLORIC 100 mg, comprimé est utilisé pour réduire ou prévenir la formation de dépôts d’acide urique responsables de la goutte, de certains types de calculs rénaux .",0.25,0.66211576133269,0.8766666666491333,1.0,0.6026280984749975,0.7741487575363538,Q32
 quels sont les contre indication de lamitor 5mg comp dispers ?,"[""## Il est utilisé dans :\n\n- \uf0a7 le traitement de l' épilepsie , seul ou en complément des traitements classiques lorsque ceux-ci ne parviennent pas à prévenir la survenue des crises ;\n- \uf0a7 la prévention des épisodes dépressifs associés à un trouble bipolaire .\n\n## Présentations du médicament LAMITOR ®\n\nLAMITOR ® 25 mg\n\n: comprimé; boîte de 60\n\nLAMITOR ® 50 mg\n\n: comprimé ; boîte de 40\n\nLAMITOR ®  5 mg\n\n: comprimé dispersible ; boîte de 30\n\n## Composition du médicament LAMITOR ®"", ""Les comprimés dispersibles LAMITOR ®  5 mg peuvent être avalés tels quels, croqués ou dissous dans un peu d'eau (pour l'enfant de moins de 6 ans, ils doivent être dissous). Ils peuvent être pris indifféremment au cours ou en dehors des repas.\n\n## Posologie usuelle :\n\nLa posologie est variable d'un sujet à l'autre. Elle ne dépend pas de la gravité des troubles mais de la réaction de chacun.\n\nSeul le médecin peut la définir.\n\nMode d'administration : voie orale.\n\n## Conseils"", '## Composition du médicament LAMITOR ®\n\n|             | p cp   | p cp   | p cp   |\n|-------------|--------|--------|--------|\n| Lamotrigine | 25 mg  | 50 mg  | 5 mg   |\n\n## Contre-indications du médicament LAMITOR ®\n\nCe médicament ne doit pas être utilisé dans les cas suivants :', '--- Page 1 ---\n\nal ELKENDI\nlamcbriol ne\n\n## Composition: \nAmiral 5mg : chaque comprimé dispersible contient 5 mg de lamotigine.\n\nAiraf 25mg : chaque comprimé dispersile contient 25 mg de lamotrigne.\n\nAmiral 100mg : chaque comprimé dispersible contient 100 mg de lamotrgine.\n\nExcipients : carbonate de sorbol cacique, celluose microcristaline, crospovidone, amidon de mais, talk, sacchanne\nsodique, stéaryle fumarate sodique, aerosi et arôme de groseile', ""Ne jetez aucun médicament au tout-à-l'égout ou avec les ordures ménagères. Demandez à votre pharmacien d'éliminer les médicaments que vous n'utilisez plus. Ces mesures contribueront à protéger l'environnement.\n\n## 6. CONTENU DE L'EMBALLAGE ET AUTRES INFORMATIONS\n\n## Ce que contient GLUCOVANCE 500 mg/5 mg, comprimé pelliculé\n\n- · Les substances actives sont :"", 'Comme tous les médicaments, HEMI-DAONIL 2,5 mg, comprimé sécable peut provoquer des effets indésirables, mais ils ne surviennent pas systématiquement chez tout le monde.']",Ceci signifie que : les contre-indications du médicament LAMITOR ® 5 mg comprimé dispersible incluent l'insuffisance hépatique sévère et certaines associations médicamenteuses.,"Lamitor 5mg comprimé dispersible ne doit pas être utilisé chez l'enfant de moins de 2 ans, en association avec le millepertuis, et pendant l'allaitement. ",0.0,0.8691410678772679,0.8055555555287036,0.3333333333333333,0.18692761896797655,0.7477104758719062,Q33
comment conserver le medicament zinnat 250mg comp?,"['## Dénomination du médicament\n\n<!-- image -->\n\n## ZINNAT 250 mg, comprimé pelliculé Céfuroxime\n\n## Encadré\n\nVeuillez lire attentivement cette notice avant de prendre ce médicament car elle contient des informations importantes pour vous.', ""En signalant les effets indésirables, vous contribuez à fournir davantage d'informations sur la sécurité du médicament.\n\n## 5. COMMENT CONSERVER ZINNAT 250 mg, comprimé pelliculé?\n\nTenir ce médicament hors de la vue et de la portée des enfants.\n\nN'utilisez pas ce médicament après la date de péremption indiquée sur la boîte après EXP. La date de péremption fait référence au dernier jour du mois mentionné.\n\nA conserver à une température ne dépassant pas 30°C."", ""## Avertissements et précautions\n\nAdressez-vous à votre médecin ou à votre pharmacien avant de prendre Zinnat 250 mg, comprimé pelliculé Enfants\n\nZinnat est déconseillé chez les enfants âgés de moins de 3 mois car la sécurité et l'efficacité ne sont pas connues dans cette tranche d'âge."", ""Agence nationale de sécurité du médicament et des produits de santé (ANSM) et réseau des Centres Régionaux de Pharmacovigilance Site internet : www.ansm.sante.fr\n\nEn signalant les effets indésirables, vous contribuez à fournir davantage d'informations sur la sécurité du médicament.\n\n## 5. COMMENT CONSERVER ZYLORIC 100 mg, comprimé ?\n\nTenir ce médicament hors de la vue et de la portée des enfants."", ""## 5. Comment conserver Zometa\n\nVotre médecin, pharmacien ou infirm ière savent dans quelles conditions conserver correctem ent Zom eta (voir rubrique 6).\n\n## 6. Contenu de l'em ballage et autres inform ations\n\n## Ce que contient Z ometa"", ""Si vous avez pris plus de Zinnat que vous n'auriez dû, vous pouvez présenter des troubles neurologiques, en particulier vous avez un risque plus important d'avoir des convulsions.\n\nN'attendez pas. Contactez immédiatement votre médecin ou le service d'urgences de l'hôpital le plus proche. Si possible, montrez-leur la boîte de Zinnat.\n\n## Si vous oubliez de prendre ZINNAT 250 mg, comprimé pelliculé""]",Information non trouvée dans le contexte fourni. Veuillez consulter un professionnel de santé.,Conservez-le à une température ne dépassant pas 30°C,0.0,0.0,0.5833333333041666,1.0,0.5684416298927676,0.27376651957107034,Q34
"Que contient le médicament trois B 125MG 125MG 0,55MG ?","['Respectez toujours la posologie indiquée par votre médecin. En cas de doute, consultez votre médecin ou votre pharmacien.\n\n## Posologie\n\nAvant et pendant le traitement par Navelbine, votre médecin vérifiera votre bilan sanguin pour déterminer à quel moment vous devez commencer le traitement et à quelle dose. Votre médecin vous indiquera le nombre et le dosage des capsules que vous devez prendre par semaine.\n\nLa dose totale ne doit jamais dépasser 160 mg par semaine.', ""D'une fagon générale, il  convient, au cours de la grossesse ou de Pallaitement de toujours demander l'avis de votre médecin ou de votre pharmacien  avant  d'utiliser un  médicament.\n\n<!-- image -->\n\n## COMMENT PRENDRE CE MÉDICAMENT\n\nMode  et  vole  d'administration\n\nLa dose initiale  recommandée est de 1600 mg/jour (4x400 mg) soit 2 élules matin et soir."", '- · Ce médicament contient 3,5 mg de sodium par millilitre, il faut en tenir compte chez les personnes suivant un régime pauvre en sel strict. Prévenez votre médecin si vous suivez un tel régime.', 'Comme tous les médicaments, HEMI-DAONIL 2,5 mg, comprimé sécable peut provoquer des effets indésirables, mais ils ne surviennent pas systématiquement chez tout le monde.', ""07/13B201l173\n\nWlne. 400 mg:\n\n07l13B294/173\n\n## «&gt; est une marque déposée\n\n## Ceci est un médicament\n\n· Un médicamentest un produit qui utilisé en dehors de ses prescriptionspeut nuire à votre santé.\n\n- Se conformer strictement à l'ordonnance de votre médecin et aux conseils du pharmacien.\n\n· Le médecin et pharmacien connaissent les risques éventuels de ce médicament.\n\n·Ne pas interrompre le traitement sans l'accord de votre médecin ou pharmacien."", '## Dénomination du médicament\n\n<!-- image -->\n\n## TRIATEC 1,25 mg, comprimé Ramipril\n\n## Encadré\n\nVeuillez lire attentivement cette notice avant de prendre ce médicament car elle contient des informations importantes pour vous.']",Ceci signifie que : Le médicament nommé Navelbine est utilisé dans un contexte de traitement médical et nécessite une surveillance par un médecin pour déterminer la posologie adéquate.,"Il contient 125 mg de vitamine B1, 125 mg de vitamine B6 et 0,55 mg de vitamine B12. ",0.6666666666666666,0.5261996117999196,0.8666666666377778,1.0,0.04201384708768353,0.1680553883507341,Q35
"TROIS B 125MG 125MG 0,55MG nécessite-t-il une ordonnance médicale ?","['Respectez toujours la posologie indiquée par votre médecin. En cas de doute, consultez votre médecin ou votre pharmacien.\n\n## Posologie\n\nAvant et pendant le traitement par Navelbine, votre médecin vérifiera votre bilan sanguin pour déterminer à quel moment vous devez commencer le traitement et à quelle dose. Votre médecin vous indiquera le nombre et le dosage des capsules que vous devez prendre par semaine.\n\nLa dose totale ne doit jamais dépasser 160 mg par semaine.', '## Posologie tt\\_ d\'\\_lrristrotion:\n\n- Hyper1ensiorl ar1érietto····· \\_: 12.5 mg unebs par jeu. les deuxpreniers jotn p!is 25 mg une fois par jeu . .Ijris deux semaines. si r\\_ est \\_. augmentar ta dose à 50mg par jeu (dose ""\'-). Chez les patients égés, 12,5 mg par jeu SlBent parfois pour un \\_ adéquat de la pression art6rioIe.', ""<!-- image -->\n\n<!-- image -->\n\nVeuillez lire attentivement  cette notice avant  de  prendre ce médicament.\n\nSi vous  avez  des questions, si vous  avez un doute,  demandez  plus d'informations à votre médecin ou à votre pharmacien.\n\nGardez cette notice, vous pourriez avoir besoin de vous  y référer à nouveau.\n\n## IDENTIFICATION  DU  MÉDICAMENT\n\nComposition :\n\npar comprimé\n\nDIOSMINE neo rene mennee sin\n\nsept  oe  es  -mnrse  600  mg"", ""07/13B201l173\n\nWlne. 400 mg:\n\n07l13B294/173\n\n## «&gt; est une marque déposée\n\n## Ceci est un médicament\n\n· Un médicamentest un produit qui utilisé en dehors de ses prescriptionspeut nuire à votre santé.\n\n- Se conformer strictement à l'ordonnance de votre médecin et aux conseils du pharmacien.\n\n· Le médecin et pharmacien connaissent les risques éventuels de ce médicament.\n\n·Ne pas interrompre le traitement sans l'accord de votre médecin ou pharmacien."", '## Dénomination du médicament\n\n## DOLIPRANE 150 mg, poudre pour solution buvable en sachet-dose\n\n## Encadré\n\nVeuillez lire attentivement cette notice avant de prendre ce médicament. Elle contient des informations importantes pour votre traitement.', ""- · Problèmes rénaux modérés: 5 mg à 10 mg par jour.\n- · Problèmes rénaux graves: 2,5 mg par jour.\n- · Si vous êtes hémodialysé: 2,5 mg par jour. Durant les jours sans dialyse, votre dose pourra être modifiée selon l'état de votre tension artérielle.\n\n## Patients âgés:\n\nVotre médecin décidera de la dose en fonction de l'état de santé de vos reins.\n\n## Enfants:""]",Information non trouvée dans le contexte fourni. Veuillez consulter un professionnel de santé.,"Oui , il necessite une ordonnance medicale.",0.6666666666666666,0.0,0.7499999999625,1.0,0.41386366859092644,0.45545467436370557,Q36
"Quels sont les dangers de prendre des doses élevées de TROIS B 125MG 125MG 0,55MG ?","[""En cas de surdosage ou d'intoxication accidentelle, prévenir immédiatement votre médecin.\n\n## Instructions en cas d'omission d'une ou de plusieurs doses\n\n## Si vous oubliez de prendre ISORYTHM L.P. 250 mg, gélule à libération prolongée:\n\nNe prenez pas de dose double pour compenser la dose que vous avez oublié de prendre, mais continuez votre traitement normalement.\n\n## Risque de syndrome de sevrage\n\nSans objet.\n\n## 4. QUELS SONT LES EFFETS INDESIRABLES EVENTUELS ?"", ""## Combien en prendre\n\nLa dose recommandée est de 300 mg (trois comprimés de 100 mg) deux fois par jour le 1 er jour, puis de 300 mg (trois comprimés de 100 mg) une fois par jour, les jours suivants.\n\nLa durée du traitement peut dépendre de la nature de l'infection que vous avez et peut être adaptée au cas par cas par votre médecin. N'adaptez pas votre dose ou ne changez pas votre traitement vousmême avant d'avoir consulté votre médecin.\n\n## Prendre ce médicament"", ""## 12OMISSION D'UNE OU PLUSIEURS DOSES :\n\nSi vous oubliez de prendreSAN MYCO 50 mg, gélule: e prenez pas de dose double n pour compenser la dose simple que vous avez oublié de prendre.\n\nCe  médicament  NE  DOIT  GENERALEMENT  PAS  ETRE  U TILISE  en  association  avec l'halofantrine (médicament utilisé dans le traitement du paludisme).\n\nEN  CAS  DE  DOUTE,  IL  EST  INDISPENSABLE  DE  DEMANDER  L'AVIS  DE  VOTRE MEDECIN OU DE VOTRE PHARMACIEN.\n\n## 13-CONDITIONS DE CONSERVATION S"", ""En cas de surdosage ou d'intoxication accidentelle, prévenir en urgence un médecin.\n\n## Instructions en cas d'omission d'une ou de plusieurs doses\n\nSi vous oubliez de prendre DOLIPRANE 150 mg, poudre pour solution buvable en sachet-dose:\n\nNe prenez pas de dose double pour compenser la dose simple que vous avez oublié de prendre.\n\n## Risque de syndrome de sevrage\n\nSans objet.\n\n## 4. QUELS SONT LES EFFETS INDESIRABLES EVENTUELS ?\n\n## Description des effets indésirables"", ""Ne prenez pas de dose double pour compenser la dose que vous avez oublié de prendre.\n\n## Risque de syndrome de sevrage\n\n## Si vous arrêtez de prendre ANAFRANIL 75 mg, comprimé pelliculé sécable:\n\nDe rares cas de syndrome de sevrage (maux de tête, malaises, nausées, anxiété, troubles du sommeil) ayant été observés à l'arrêt du traitement, ne pas interrompre celui-ci sans l'avis de votre médecin.\n\n## 4. QUELS SONT LES EFFETS INDESIRABLES EVENTUELS ?\n\n## Description des effets indésirables"", ""## Mises en garde et précautions d'emploi\n\n## Consultez votre médecin avant de prendre TRILEPTAL 150 mg, comprimé pelliculé si un des cas suivants vous concerne :""]",Information non trouvée dans le contexte fourni. Veuillez consulter un professionnel de santé.,"De fortes doses de vitamine B12 peuvent induire une acné.De très fortes doses prolongées de vitamine B6 (≥ 500 mg pendant plus de 5 mois) peuvent entraîner des neuropathies sensitives périphériques, généralement réversibles après arrêt du traitement.",0.5,0.0,0.7499999999625,0.0,0.02983169033850394,0.11932676135401576,Q37
quelle est la dose recommende par jour de curacne 5mg caps?,"['## Dénomination du médicament\n\n<!-- image -->\n\n## CURACNE 5 mg, capsule molle Isotrétinoïne\n\n## Encadré\n\nVeuillez lire attentivement cette notice avant de prendre ce médicament car elle contient des informations importantes pour vous.', ""## Sommaire notice\n\n## Dans cette notice :\n\n- 1. QU'EST-CE QUE CURACNE 5 mg, capsule molle ET DANS QUELS CAS EST-IL UTILISE ?\n- 2. QUELLES SONT LES INFORMATIONS A CONNAITRE AVANT DE PRENDRE CURACNE 5 mg, capsule molle ?\n- 3. COMMENT PRENDRE CURACNE 5 mg, capsule molle ?\n- 4. QUELS SONT LES EFFETS INDESIRABLES EVENTUELS ?\n- 5. COMMENT CONSERVER CURACNE 5 mg, capsule molle ?\n- 6. INFORMATIONS SUPPLEMENTAIRES\n\n## 1. QU'EST-CE QUE CURACNE 5 mg, capsule molle ET DANS QUELS CAS EST-IL UTILISE ?"", ""## Forme pharmaceutique et contenu\n\n## Qu'est-ce que CURACNE et contenu de l'emballage extérieur ?\n\nCe médicament se présente sous forme de capsule molle. Boîte de 30.\n\nChaque capsule de 5 mg est constituée d'une enveloppe de gélatine opaque bicolore rouge/brun et crème, renfermant une substance jaune brillant/orange et portant le logo « 5 » imprimé sur un des côtés"", ""- (4) Dosages à réaliser tous les 3 mois en suivi, sauf lorsque des circonstances médicales particulières justifient des contrôles plus fréquents\n\nLes patients doivent être avertis qu'ils ne devront jamais donner ce médicament à une personne de leur entourage, et qu'ils doivent rapporter toutes les capsules non utilisées à leur pharmacien à la fin du traitement.\n\n## Guide du pharmacien pour la délivrance de l'isotrétinoïne\n\n## Pharmaciens\n\n## Brochure pour la délivrance de CURACNE"", ""## CURACNE contient de l'huile de soja.\n\nNe prenez pas ce médicament si vous êtes allergique à l'arachide ou au soja.\n\n## 3. COMMENT PRENDRE CURACNE 5 mg, capsule molle ?\n\n## Instructions pour un bon usage\n\nSans objet.\n\n## Posologie, Mode et/ou voie(s) d'administration, Fréquence d'administration et Durée du traitement\n\n## Posologie :\n\nPrenez toujours CURACNE en suivant à la lettre les recommandations de votre médecin. En cas de doute, consultez votre médecin ou votre pharmacien."", ""Le traitement par CURACNE doit être prescrit et surveillé par un médecin ayant une bonne expérience dans l'utilisation et le suivi des rétinoïdes dans le traitement des acnés sévères.\n\nCURACNE n'est pas indiqué pour traiter les acnés survenant avant la puberté et n'est pas recommandé avant l'âge de 12 ans.\n\n## 2. QUELLES SONT LES INFORMATIONS A CONNAITRE AVANT DE PRENDRE CURACNE 5 mg, capsule molle ?\n\n## Liste des informations nécessaires avant la prise du médicament""]","Ceci signifie que : la dose recommandée par jour de Curacne 5mg capsule est de 0,5 mg/kg par jour, répartie en 2 prises. Cette dose peut être ajustée en fonction de la réponse au traitement et de la tolérance au médicament."," La dose usuelle de CURACNE est de 0,5 mg par kilogramme par jour . Pour la plupart des patients, une plage de 0,5 à 1,0 mg/Kg/jour.",0.0,0.8375347211028829,0.8766666666491333,0.5,0.46374647015622905,0.8549858806249163,Q38
Quels sont les médicaments à ne pas utiliser avec METRONIDAZOLE BEKER 250mg ?,"[""PHARMACIEN. En particulier:\n\nRe  and ye  cadans, moele), + Du  Géulirame (utisé dans la  prévention des rechues au  cour de falcooo-dépendnce). sez  avec précauton  Metronidazole BEKER® vec: fampicne nm, tes niconiisvantsnducteurs e a\n\nazymatiques tls quel carbamazepine.\n\n## $-OFOSSESSE ET ALLATENEMT\n\nRene nn Pme e  onne a se  de ce médicament. c dérier  'latement  pendant  la  pri"", ""<!-- image -->\n\n## Métronidazole Mécronidazole\n\nGélules 250  mg  et 500  mg\n\n## :FORME      :  Gélues Bote  de 30 gues. ET  PRESENTATION: Metronidazole g BEKER® 250  m Metronidazole  Bote de 20 gues. BEKER? 500  mg: Ges\n\nGrane  gee  cer: ae    me i  EN  ane -\\_ a  o   Sone de ane, ay de  rune, ae. nam ) Sept,rye e tae,  ge 129 12), émane  C ple,\n\n500  mg elcamosino  2),  u  patent,  onde  do  tae,  nye  oen, éaine. (E1 22 D d Aronbineamaisne  1 pate V do one g\n\n'Azorubinelcarmoisine (E122)"", ""## Dénomination du médicament\n\n<!-- image -->\n\n## METHERGIN 0,25 mg/ml, solution buvable\n\nMaléate de méthylergométrine\n\n## Encadré\n\n## Veuillez lire attentivement l'intégralité de cette notice avant d'utiliser ce médicament.\n\n- · Gardez cette notice, vous pourriez avoir besoin de la relire.\n- · Si vous avez d'autres questions, si vous avez un doute, demandez plus d'informations à votre médecin ou votre pharmacien."", ""Liste des excipients dont la connais~nct est neces~irt' pour unt ulili~tion ~111 risque chez certains patients\n\nSaccharose, 4R rouge cochenille, E211 benzoate de sodium.\n\n## COMMENT UTILISER CE MEDICAMENT\n\n## ~\n\npr\n\nOROKEN\n\ng/5\n\nml est\n\npréronsée chez\n\nl'enfant de\n\n6d30\n\nmois, e prises; La présentat ~ litre indica 6 mois est de 4 mg/kg et par prise\n\nDAN OUS lES [A5 SE CONFORMER STRICTEMENr A l'ORDONNANCE DE VOTRE MEDE(W\n\n## Mode et voie d'administration\n\nVoeOlae."", ""<!-- image -->\n\nANSM - Mis à jour le : 15/02/2013\n\n## Dénomination du médicament\n\n## BECLOJET 250 microgrammes/dose, solution pour inhalation en flacon pressurisé Dipropionate de béclométasone\n\n## Encadré\n\n## Veuillez lire attentivement l'intégralité de cette notice avant d'utiliser ce médicament."", ""D'une fagon générale, il  convient, au cours de la grossesse ou de Pallaitement de toujours demander l'avis de votre médecin ou de votre pharmacien  avant  d'utiliser un  médicament.\n\n<!-- image -->\n\n## COMMENT PRENDRE CE MÉDICAMENT\n\nMode  et  vole  d'administration\n\nLa dose initiale  recommandée est de 1600 mg/jour (4x400 mg) soit 2 élules matin et soir.""]","Ceci signifie que les médicaments qui ne doivent pas être utilisés avec Métronidazole BEKER 250mg sont les médicaments injectables contenant du procaïnamide, le disulfirame, la cimétidine et les médicaments contenant des ions métalliques tels que les antiacides contenant du magnésium ou de l'aluminium, les sels de fer, etc.","Il ne faut pas associer ce médicament avec : Le disulfirame (utilisé dans le traitement de l’alcoolo-dépendance),le busulfan ( utiliser pour traiter certaines maladies du sang et dans la préparation à la greffe de moelle).Certains inducteurs enzymatiques comme la carbamazépine.",0.5714285714285714,0.9861943941055328,0.8333333333055556,1.0,0.2641786165190001,0.5112599206214551,Q39
Quels sont les signe d'un surdosage accidentel de oxynorm 20mg 2ml sol pour inj?,"['## La substance active est:\n\nOxcarbazépine ................................................................................................................................. 150 mg\n\nPour un comprimé pelliculé.\n\n## Les autres composants sont:', ""OxyNorm 10 mg/ml, 1 ml ampoule\n\nBE339814\n\nOxyNorm 10 mg/ml, 2 ml ampoule\n\nBE339823\n\nPour  toute  information  relative  au  présent  médicament,  veuillez  prendre  contact  avec votre  médecin  ou  votre  pharmacien.    Si  vous  le  souhaitez,  vous  pouvez  également prendre contact avec le détenteur d'enregistrement du médicament à savoir.\n\nMode de délivrance : Médicament soumis à prescription médicale."", ""En cas de surdosage ou d'intoxication accidentelle, prévenir immédiatement votre médecin.\n\n## Instructions en cas d'omission d'une ou de plusieurs doses\n\n## Si vous oubliez de prendre ISORYTHM L.P. 250 mg, gélule à libération prolongée:\n\nNe prenez pas de dose double pour compenser la dose que vous avez oublié de prendre, mais continuez votre traitement normalement.\n\n## Risque de syndrome de sevrage\n\nSans objet.\n\n## 4. QUELS SONT LES EFFETS INDESIRABLES EVENTUELS ?"", ""## Ce  médicament  est  autorisé  dans  les  Etats  membres  de  l'Espace  Economique Européen sous les noms suivants :\n\nAllemagne\n\nOxygesic injekt 10 mg/ml\n\nBelgique\n\nOxyNorm 10 mg/ml\n\nIslande\n\nOxyNorm 10 mg/ml\n\nLuxembourg\n\nOxyNorm 10 mg/ml\n\nPortugal\n\nOxyNorm 10 mg/ml\n\nLa dernière date à laquelle cette notice a été révisée est: 06/2016"", ""## NOTICE : INFORMATION DE L'UTILISATEUR\n\n## OxyNorm 10 mg/ml, solution injectable/solution à diluer injectable ou perfusion\n\n## chlorhydrate d'oxycodone\n\n## Veuillez lire attentivement cette notice avant d'utiliser ce médicament car elle contient des informations importantes pour vous.\n\n- -Gardez cette notice. Vous pourriez avoir besoin de la relire.\n- -Si vous avez  d'autres questions, interrogez votre médecin ou votre pharmacien."", ""En cas de Trouble panique avec ou sans agoraphobie, d'insuffisance hépatique et chez les personnes de plus de 65ans : Une posologie initiale de 5 mg par JOUrest recommandée, avant !.Ile augmentation à 10 mg par jour.\n\nLa sécurrté à des posologies supéneures à 20 mg par jour n'a pas été démontrée\n\nTaJoprel est adlTllnistré en une seule pnse journalière pendant les repas ou à distance de ceux-ci. L'arrêt brutal doit être éVIté\n\n## Surdosage :""]","Ceci signifie que : si une personne prend accidentellement une dose supérieure à la dose prescrite d'OxyNorm, elle doit contacter immédiatement son médecin.","Les signes d'un surdosage d'OxyNorm peuvent être : pupilles dilatées, insuffisance respiratoire, somnolence, déficience musculaire, pouls ralenti, hypotension. Dans les cas les plus sévères, une perte de conscience , une accumulation de liquide dans les poumons et un collapsus circulatoire peuvent se développer, pouvant entraîner la mort.",0.0,0.6756560626776856,0.36666666664833336,0.5,0.1384993114849844,0.5539972459399376,Q40
quelle la psologie recommendee de stagid 700mg comp sec,"[':~i\n\n:\n\nüu\'est-œ que Praxi~nc 200 mg comprirM pclliculi: et contenu de l\'emballage extérieur? Cc médicament sc presente sous forme de comprimés pellicutés. Boite de 20 comprimés, sous plaquettes thermoformées.\n\nüétenteur de la Décision d\'Enregistrement en Algérie:\n\nMerde:Sante s.a.s. 37, rue Saint Romain 69379lyon cedex 08 Franet\n\nN"" de üécisicn d\'Enregistrement: 10/97/06J 101/062 Fabricant:\n\nFamar lyon 29, avenu, Oiartes de Gaull, 69230 Saint G,nis Laval.. france\n\nConditionneur:', ""Au bout de 6 mois de traitement, consultez votre médecin. Il jugera de la nécessité de poursuivre ou non le traitement\n\n## Mode:et yoie d'administration\n\nVoie orale. Avaler les comprimés sans I~ croquer, toujours avec un grand verre d'eau. ErCquenct d'administration les ~rises seront réparties au cours des repas.\n\noyrce dy traitement\n\nSECONFORMER Al'ORDONNANCE DEVOTRE MEDECIN.\n\n\\_\\_\n\nIl\n\n',MERCK\n\nIl\n\n,\n\nSi vous avez pris plus ce Prarlene 200 mg comprimé pelliculé que vous n'auriez dû"", ""Le comprimé doi être placé sous la langue pour permettre sa désintégration avant de l'avaler, avec\nou sans eau, pendant ou après le repas.\n\nLe dosage des comprimés que vous allez prendre et la durée de votre traitement peuvent varier en\nfonction des recommandations de votre médecin. La posologie maximale recommandée est de 10 mg\npar jour."", ""D'UNE FAÇON GÉNÉRALE, IL CONVIENT, AU COURS DE LA GROSSESSE OU DE LJ\\LLAITEMENT DE TOUJOURS DEMANDER LJ\\VIS DE VOTRE MtDEClN OU DE VOTRE PHARMACIEN AVANT D'UTILISER UN MtDICAMENT.\n\n<!-- image -->\n\n<!-- image -->\n\n## Vole et mode d'administration\n\nVoie orale. Les comprimés sont à avaler tels quels avec une boisson (par exemple: eau, lait ou jus de fruit).\n\n## Posologie\n\nDOLYC· 500 [comprimé à 500 mg) est réservé à l'adulte et à l'enfant à partir de 27 kg (environ à partir de 8 ans)."", ""850 : Boites de et 90 comprimés pelliculés 30 .\n\nNEXECOR 1000 : Boites de 90 comprimés pelliculés le . sécab s\n\n®\n\nD'UNE FAÇON GENERALE, IL CONVIENT AU COURS DE LA GROSSESSE ET DE L'ALLAITEMENT DE TOUJOURS DEMANDER L'AVIS DE VOTRE MEDECIN OU DE VOTRE PHARMACIEN AVANT DE PRENDRE UN MEDICAMENT.\n\n## 2-COMPOSITION\n\nChaque c omprimé pelliculé contient :\n\n## 8INTERACTIONS AVEC D'AUTRES MEDICAMENTS\n\nCe médicament est à éviter en association avec :\n\nNEXECOR 500 mg :"", 'Les comprimés de NovoNorm sont ronds, bombés et gravés avec le logo Novo Nordisk (taureau Apis). Les dosages sont 0,5 mg, 1 mg et 2 mg. Les comprimés de 0,5 mg sont blancs, les comprimés de 1 mg sont jaunes et les comprimés de 2 mg sont de couleur pêche. Quatre tailles de boîte comprenant des plaquettes thermoformées sont disponibles. Chaque boîte contient 30, 90, 120 ou 270 comprimés.\n\nToutes les présentations peuvent ne pas être commercialisées.']",Ceci signifie que : Le contexte ne fournit aucune information spécifique sur la posologie de Stagid 7,"La posologie recommandée de STAGID 700 mg, comprimé sécable est généralement de 1 comprimé trois fois par jour. Elle peut être determinees par le médecin en fonction des résultats d'examens de laboratoire.",0.0,0.0,0.6791666666496875,0.5,0.09984661611501261,0.39938646446005044,Q41
Est-ce que je peux utiliser Nexavar 200mg avec mes médicaments d épilepsie ?,"[""## Autres médicaments et Nexavar\n\nCertains médicaments peuvent avoir un effet sur Nexavar, ou leur effet peut être modifié par ce dernier. Informez votre médecin ou votre pharmacien si vous prenez, avez récemment pris ou pourriez prendre l'un ou plusieurs des médicaments mentionnés ci-dessous ou tout autre médicament, y compris un médicament obtenu sans ordonnance :"", '## Avertissements et précautions\n\nAdressez-vous à votre médecin ou pharmacien avant de prendre Nexavar.\n\n## Faites attention avec Nexavar', ""car ce médicament peut interférer avec le développement de votre bébé.\n\n## Conduite de véhicules et utilisation de machines\n\nRien ne laisse prévoir que Nexavar puisse affecter l'aptitude à conduire des véhicules ou à utiliser des machines.\n\n## 3. Comment prendre Nexavar ?\n\nLa dose recommandée de Nexavar chez l'adulte est de deux comprimés à 200 mg, deux fois par jour.\n\nCeci équivaut à une dose totale journalière de 800 mg soit quatre comprimés par jour."", ""D'une fagon générale, il  convient, au cours de la grossesse ou de Pallaitement de toujours demander l'avis de votre médecin ou de votre pharmacien  avant  d'utiliser un  médicament.\n\n<!-- image -->\n\n## COMMENT PRENDRE CE MÉDICAMENT\n\nMode  et  vole  d'administration\n\nLa dose initiale  recommandée est de 1600 mg/jour (4x400 mg) soit 2 élules matin et soir."", '## Liste des informations nécessaires avant la prise du médicament\n\nANSM - Mis à jour le : 02/11/2011\n\nSans objet.\n\n## Contre-indications\n\n## Ne prenez jamais RENITEC 20 mg, comprimé sécable:', ""## Prise d'autres médicaments\n\nIl est important d'indiquer à votre médecin ou à votre pharmacien si vous prenez ou avez pris récemment un autre médicament, même s'il s'agit d'un médicament obtenu sans ordonnance. Cela inclut les préparations à base de plantes. Ceci parce que RENITEC 20 mg, comprimé sécable peut agir sur le mécanisme d'action de certains médicaments. Les autres médicaments peuvent également modifier le mécanisme d'action de RENITEC 20 mg, comprimé sécable.""]","Ceci signifie que : il est important d'informer son médecin ou pharmacien si on prend des médicaments d'épilepsie avant de commencer un traitement avec Nexavar, car ces médicaments peuvent interagir avec Nexavar."," certains médicaments pour l épilepsie peuvent interagir avec Nexavar.En particulier : la phénytoïne, la carbamazépine et le phénobarbital peuvent modifier l'effet de Nexavar. Informez votre médecin si vous prenez ces traitements.",0.0,0.793509312989026,0.9999999999833333,0.3333333333333333,0.6218698809386081,0.7731938094687177,Q42
 Quelle est la dose à prendre de Nexavar 200mg ?,"[""car ce médicament peut interférer avec le développement de votre bébé.\n\n## Conduite de véhicules et utilisation de machines\n\nRien ne laisse prévoir que Nexavar puisse affecter l'aptitude à conduire des véhicules ou à utiliser des machines.\n\n## 3. Comment prendre Nexavar ?\n\nLa dose recommandée de Nexavar chez l'adulte est de deux comprimés à 200 mg, deux fois par jour.\n\nCeci équivaut à une dose totale journalière de 800 mg soit quatre comprimés par jour."", '## Si vous oubliez de prendre Nexavar\n\nSi vous avez oublié de prendre une dose, prenez-la dès que vous vous en apercevez. Si le moment de prendre la dose suivante est proche, ne tenez plus compte de la dose oubliée et continuez normalement votre traitement. Ne prenez pas de dose double pour compenser la dose que vous avez oublié de prendre.\n\n## 4. Quels sont les effets indésirables éventuels ?', ""- · Si  vous  avez  oublié  de  prendre  une  dose,  prenez-la  dès  que  vous  vous  en  apercevez.  Cependant,  s'il  est presque  l'heure  de  votre  prochaine  dose,  ne  prenez  pas  la  dose  oubliée.  Puis  continuez  à  prendre  votre traitement normalement.\n- · Ne prenez pas de dose double pour compenser la dose que vous avez oublié de prendre.\n\n## Risque de syndrome de sevrage\n\n## Si vous arrêtez de prendre NEORAL 100 mg/ml, solution buvable :"", '## Avertissements et précautions\n\nAdressez-vous à votre médecin ou pharmacien avant de prendre Nexavar.\n\n## Faites attention avec Nexavar', ""## Dose d'entretien\n\nla dose unttalre maxima e recommandée est de 4 mg, à prendre aux pnnClpaux repas la dose Journalière totale maXimale ne dOtt pas excéder 16 mg"", ""Si vous présentez un risque de saignement potentiellement plus important, votre médecin pourra décider de prescrire une dose quotidienne de Pradaxa de 220 mg sous forme d'une gélule de 110 mg deux fois par jour.""]",Information non trouvée dans le contexte fourni. Veuillez consulter un professionnel de santé.,"La dose recommandée chez l adulte est de deux comprimés de 200 mg, deux fois par jour, soit une dose totale journalière de 800 mg (quatre comprimés par jour)",0.5,0.0,0.999999999975,1.0,0.05891363695417469,0.23565454781669876,Q43
"Est-ce que je peux utiliser Biafine 0,67 100g emuls comme crème solaire ?","['## La substance active est :\n\nAcide fusidique ................................................................................................................................ 2,000 g\n\nPour 100 g de crème\n\n## Les autres composants sont :', 'de fa fièvre ou des douleurs (~ 500 mg par prise et/ou &lt; 3 g par Jour),', 'Sans objet.\n\n## Contre-indications\n\n## Ne prenez jamais METHERGIN 0,20 mg/1 ml, solution injectable, ampoule :', ""Sans objet.\n\n## Contre-indications\n\n## N'utilisez jamais OLICLINOMEL N 7-1000, émulsion pour perfusion :"", '## Grossesse -Allaitement\n\nDemandez conseil à votre médecin ou à votre pharmacien avant de prendre tout médicament.\n\nII.\n\nIII\n\nIl\n\n<!-- image -->\n\n<!-- image -->\n\n@I\n\n## a. COMMENT lmUSER BIAFINE, émulsion pour application cutsnée ?\n\n## ~', '| Huile essentielle de pin sylvestre .......................................................................................................               | 0,020 g |']","Ceci signifie que la notice officielle de BIAFINE, émulsion pour application cutanée ne mentionne pas son utilisation comme crème solaire.","Non, ce médicament n est pas un protecteur solaire. Il ne doit pas être utilisé comme crème de soin sur une peau saine.",0.5,0.30796006602438214,0.0,1.0,0.4222424041828451,0.4889696167313801,Q44
Est-ce que Biafine 100g emuls peut causer des effets indésirables ?,"[""Effets indésirables peu fréquents (pouvant affecter jusqu'à une personne sur 100)"", 'Les autres effets indésirables qui peuvent se produire, sont:\n\n## Effets indésirables fréquents (affectant de 1 à 10 personnes sur 100)', '## Liste des autres effets indésirables\n\n## Effets indésirables peu fréquents\n\nPouvant survenir chez m oins de 1 personne sur 100.', '<!-- image -->\n\n## EFFETS INDÉSIRABLES\n\nComme tout principe actif, ce médicament peut, chez certaines personnes, entraîner des effets plus ou moins gênants:', '<!-- image -->\n\n## EFFETS INDÉSIRABLES\n\nComme tout principe actif, ce médicament peut, chez certaines personnes, entraîner des effets plus ou moins gênants: .', '## b) Liste des autres effets indésirables\n\n## Effets indésirables peu fréquents\n\nPouvant survenir chez m oins de 1 personne sur 100.']","Ceci signifie que : Oui, Biafine 100g emuls peut causer des effets indésirables.","Oui, les effets indésirables suivants sont possibles : Douleurs (picotements) modérées et transitoires après application (15 à 30 minutes). Réactions allergiques de contact rares,rès rares cas d eczéma de contact nécessitant l Arrêt du traitement.",0.0,0.5399479550167138,0.6999999999766667,0.0,0.4795956761932308,0.41838270477292316,Q45
